今年考上了北京化工大学的研究生，做的是碳材料，求相关介绍?,北化的材料哪个比较好啊
在北京化工大学读高分子材料专业是一种怎样的体验？,北化14级研究生，材料学院，今年刚毕业，过来者的感受，这三年真心不好过，毕竟当时选导师，瞎了眼，进了石...课题组，估计从这个实验室出去的学生都不可能说好的，所以，毕业时只有一个感受:终于解脱了！！去他妈的xxx
如何看待北京化工大学成立能源学院？,新形势下，成立新的学院，从一个学院独立出去，说明至少现在看来有发展前景
为什么北京化工大学那么穷。明明是个211大学。？,其实也不算穷，只是大家都哭穷而已。不然那么多个校区，还有占地2000亩的南口正在筹建的校区的钱哪里来的。 还有化工人本人就很低调，化工大学的科研经费可真是不低啊。
如何看待北京理工大学化学学院与化工学院合并一事？,被赶到良乡也就算了，学院还被合并了，估计再过几年，大家就直接简称为化学学院了吧？  非常不高兴。  去过校史馆的同学都能见到，化工学院和延安自然科学院一起建立的，当年老六系火药专业也是很牛的，最后混到今天这个田地，到底是谁的锅呢？
化工专业考研，北京化工大学排斥外校学生吗?,就我的研究生同学来看，外校的占一大半吧。 除去一些职业考研的学校（只学考研课，专业课不上之类的，高分低能）老师不愿意要。这也是前些年被坑了，招进来什么都不会。 其他正常教学的学校的只要你分数够能力还行，老师是很愿意要的。
北京化工大学和沈阳化工大学有什么联系？,中国仅有的两所化工大学。就这么简单
选南京工业大学的市政工程还是选北京工业大学的环境工程或者北京化工大学的环境工程还是河海大学环境工程？,不太清楚，建议河海的市政。因为有个师兄是河海的 
听说所有大学生都在等北京化工大学放假？,高级黑
如何看待北京化工大学在新校区宿舍还没有公布甲醛测量报告之前就安排学生入住？,我只在里面睡了一晚嗓子疼头疼 你也不用洗，我自己身体我清楚 我们两个同学在贴吧说这个事两个都被封号 书记直接到门口要求删除 毕竟还是自己母校就删了 等我们删除了，书记直接怼着骂我们，要告我们诽谤学校 我现在再意的，失望的已经不是甲醛问题 是这个学校到底还要不要学生了 把自己学生当学生么 什么事，只要出问题，所有导员捂嘴 捂不住嘴就威胁你 不用洗，因为我同学三个就被警告了 另外北化天天骗人，忽悠学生 也许北化也不在乎我这种学渣学生 无奈吧，自己的同学都很棒，学校却这样 整个大学生涯真的觉的遗憾 上几张图，是这次甲醛学校的公关 大家就当笑话看吧 这个学校真的已经是完完全全的官僚主义了       怕被查水表就匿了   哦，对了…这个图你们不用怀疑真假，我同学自己亲手测的，亲手拍得照。也不用怀疑我是什么来黑北化的所以匿名。你亲眼看着你同学在讲述一个事实发帖，然后领导来指着鼻子骂他，要告他诽谤，你也得匿，虽然这个大学很失望，但是我需要毕业证。很无奈。学校耍起流氓，真的可怕。  9-5 学校已经开始准备第三方检测了…到需要时间 大家努力吸几天甲醛没了 就合格了
北京化工大学碳纤维怎么样？,北化大三学生，真的好巧  我现在就在听我化碳纤维实验室大Boss的讲座。 对于你的问题我只想说：这教授牛逼吹得可以。
北京化工，燕山大学，黑龙江大学，东北林业大学的法学哪个相对好些？(因为高考分数有限),刚才都看了一下，这四所院校全都是理工类的院校，其中有两所211（东北林大和北京化工），燕大和黑大虽然不是211，但教学水平都已经达到211水平了。所以说这四所大学都挺好的，但法学说句实话，在这四所里面都不是很好，毕竟全都是理工类的学校，你报考时要多方面考虑，地理位置，就业评价什么的都要看一看。我只对北京化工比较了解，北化的法学真就是一般般，但我们这能转专业，如果你在入学考试考的好的话可以转专业（转到什么专业都可以）。另外，如果真想学法学的话建议还是报个文史类的学校吧，因为师资能好一些。理工类的学校在文史类专业的师资不是很强，就拿我们北化来说，好的老师都是在理工类的专业，文法那边并不是很强。。。然后报考时也别光看211，看一下大学的实际办学水平～
有人有北京化工大学历年来的录取通知书图片吗？,  我自己的 
中央民族大学和北京化工大学如何选择？,化学在知乎上，不景气。  民大读个商科，抱得美人归，事业也有了
北京化工大学生命学院哪个老师人比较好？,为什么校长不带课，因为他教出来的成绩不如一般老师的好。为了让自己在全体教师面前好说嘴，所以他们不敢代课。
天津理科女585高一本分数线64分 在中国石油大学南京师范大学北京化工大学中哪个较为适合些呢 望推荐？,蟹药~~  1.你自己做功课了么？  2.不同学校的分数线不一样。所以很难回答~~  3.不需要其他证书，但是没准可以为你增加色彩~~所以自己去调查调查~~  —以上—
北京化工大学西校区宿舍怎么样？,17.07.20 西区六人间 八人睡六人 上下铺 物理什么都没有 桌子也没 独立卫浴不要想 不可能 有空调
如果在北京化工大学财务考研的时候有可能申请到好大学吗？比如爱丁堡大学，伦敦大学之类的？,这问题问的，我是北化财务专业大三，我的小伙伴是国教学院，大二就申到了爱丁堡和北卡，转去学本科，但是呢，这妹子加权均分90＋，还获得了国奖，语言成绩也是妥妥的，还是一文科生从金融跨专业到数学专业，所以咯，只要自己有水平哪个好学校申不到，毕竟北化历史上还有申到斯坦福的呢，所以你觉得北化会耽误你前程嘛？
哈尔滨工程大学和北京化工大学学计算机哪个好 ？,不请自来 不是学计算机的北化人，看到知乎另一个北化校友的回答计算机专业一般，不知道哈工程的计算机如何，如果两个差不多等级的话可以考虑考虑北化，实际上对于考虑来北化的人大家都是劝退的，但是我姐姐大学是在哈工程，学的是金融，研究生在上海，她不是不喜欢哈工程，但是去了上海后告诉我环境对人是会有影响的，因为学的是金融所以在上海的机会更多一些。当然了如果哈工程的计算机专业挺好的那就不用考虑北化了，因为北化条件确实一般，新校区去了南口距离市里很远，周围还比较荒凉，只有大四回本部后才能显出地理位置的优势。另外，哈工程学校很美。
有在北京化工大学留学的朋友吗？,    等过了一周，你确定你还是喜欢那个泰国女生的话，直接去北京化工大学找呗，想找个留学的泰国女生应该很容易吧（如果你真想找的话）
在北京化工大学合唱团里当团员是怎样一种体验？,上次在教室，听到隔壁在练合唱。一开始以为在唱什么红歌，仔细一听居然是we are the world……我只能说，这学校的合唱水平，远远不如我们高中强，自娱自乐罢了。
北京化工大学的电子信息专业怎么样？,就业还好，现在是互联网+时代，往计算机方面靠不会吃亏，而且北京是个特别特别特别特别有互联网基因的城市，IT产业发展的特别好，作为北京高校且教育部直属211大学，北化的出身不差。加油。
本人是北京化工大学的一名大一学生，专业环境工程……？,喜欢化学就应该去理学院应用化学专业
普通二本学生考研如何考北京化工大学？,我是北化化工学院的学生，化工专业的分数比较高，今年的考研分数分别是340/320-学硕/专硕。环工就一般了，分数不是很高，但是以后找的工作还是不错。有很多进环保局的，还有设计院的。 如果想考的话，建议你联系北化环工的同学，我把我环工的同学联系方式给你，你问问需要准备那些资料。好好复习还是可以考上的，不难。 北化研究生在朝阳的东校区，去哪里都很方便，还是很不错。我深爱北化，也希望别人爱我的学校。
北京化工16新生 北化真的那么差吗？,北化能作为一所211大学必然有它的优点和独特的地方。而且他的化工，化学，材料和高分子什么的不用我说了吧，每年想往这些专业考研的真的不是少数。 相信我，北化能给你你想要的，就算不能，北京总可以吧。 不要再说学校烂，不好。只要你自己肯努力，积极的去成长，在哪里都不会差。嗯，关键在自己。  利益相关：北化化工专业2015届毕业生 
北京化工大学中外合作专业 中法合作项目好么？,我也报的这个专业，看好
北京化工大学今天开始不让外卖进学校会不会对饿了么、美团外卖等有所冲击？,我觉得学校领导做的很有考虑的，是一个正常的决定吧。可能大家不是很了解情况，作为一名学生，我是非常不愿意在校园里还得担心被电动车蹭来蹭去的，先说说情况吧，北化校园（朝阳东校区）比较小，但是学生非常多啊，所以难免很挤，尤其是哪个中午吃饭点儿，那个衰啊。。。食堂里都找不着位子，外卖小哥们，都是骑着电动车进学校的，而且速度非常快，又听不见声音，每天那么多学生，简直是考验骑车技术啊，而且随意停放在路边，谁知道下一个被撞的不是你呢？那时候可能又有人怪学校不作为了吧，加上各家外卖竞争异常激烈，在公寓门口堵的水泄不通，各种宣传单到处都是，难为了保洁。。。这样很好？ 而且，学校并不是不让学生定外卖，只是不让外卖电动车进入学校，只是单纯的确保学生安全和学校秩序而已啊！而且外卖小哥们也没有抱怨啥的，他们换成自行车了也挺好啊！至少走在学校不用随时担心后面飞奔而过的电动车了！  放心吧，这些当然不会威胁到外卖公司啦～  随便说一句，那些外卖真不比食堂好吃多少啊。。。
北京化工大学过程装备与控制工程怎么样？,单说实力的话国内前几。学校有地域优势，有行业优势，性价比也不错。打算搞这行的话是很好的选择。  如果想更多了解的话还要描述清楚你想知道什么...比如高考，考研，抑或就是简单的了解了解？
北京化工大学的材料科学与工程专业和应用化学专业哪个比较好？,你好，我是高材专业毕业的学姐。我不清楚你为什么产生了要转专业的想法，是课程的学习难以适应，还是对所学习的专业不感兴趣呢？鉴于你是大一的学生，其实材料与应化专业在大一大二的基础课基本相同。材料专业属于工学，应化专业属于理学，在我的感觉中应化对化学知识的学习更加看重，从应化专业学习的有机化学书可以大概看出。如果今后想从事偏向于工程化或实际生产方面的工作我建议是材料工程，如果想从事化学研究方向可以考虑应化专业。
北京化工大学还是南京化工大学好 本人理科女 父母很想让我去北京化工 但是个人比较偏向南京理工大？,首先，南京理工大是南京理工大学？ 其次，北化比南化好，毋庸置疑，因为它是211，211，211。 如果是和南京理工大学比较的话，我觉得是看你将来想要发展的地域。北方就北化，南方就南理工咯。 最后，看你个人兴趣吧。
在北京化工大学 学过程装备与控制工程的女生最好的出路是什么啊？,考研 出国 换专业 ，工科女生太苦逼，尤其是学校还不是特别优秀的情况下
北京化工大学材料学院研究生，博士生待遇如何？,谢邀，不知道。可以去小木虫问问
大学毕业半年，先在北京工作半年，然后辞职，现在在十八线家里的化工企业打算上班，很害怕很恐惧怎么办？,       一个外地人在北京混真的很难。巨额的房价又没有户口，压力确实很大。         既然选择了回家，就要接受家乡的薪资待遇，虽然国企关系乱了点，但是轻松啊，没有互联网公司那么大的压力，只不过你在那里可能找不到你想要的东西，那不是你想要的工作，你可以先干着，再找找其它工作。
在北京化工大学读研什么感觉？,我是16年毕业生。这个体验跟你老板风格关系极大，有的极其苦逼，手套都买不起，毕业找不到工作。有的又极其潇洒，设备全，有钱任性，随便毕业，工作随便挑。一定要选好自己想跟什么样的老板，毕业后打算做什么。 无论如何，当你毕业离开的那天，你可以问心无愧的说，I did my best.
北京化工大学入学考试考些什么？如何准备？,主要就是两科，英语和综合。 英语是四级的题型，综合考语文数学和逻辑。 英语用来分班，综合如果你不转专业或者不为了奖学金的话没有很重要。 不知道今年安排是怎样的，去年先考两个半小时综合，五分钟之后考两个小时英语。 英语主要背四级词汇，综合要复习的话可以找学长学姐要一下往年的入学考试题目。 目前我了解的情况是这些，希望对你有帮助。
有关北京化工大学公共管理120400专业研究生？,你好  北京化工大学你考了吗
北京化工大学创行怎么样，值得加入吗？, 在创行这个大集体中，你需要牺牲很多时间去学习、去实践。很多人会问我值不值得。在我心里这个答案是肯定的。我在收获友谊的同时学到了不少电脑技术，但我觉得更为重要的是你有相比与同龄人更多的与经济金融等领域的大佬们接触的机会，你会在这之中更为真实地了解这个社会，进而萌生改变社会的想法。而这正是创（新）行（动）的开始。 
北京工业大学和北京化工大学哪个比较好？,你不妨看看这个问题： 如何看待北京化工大学（北区）学生期末无充足座位复习而跑遍昌平城区，到石油政法蹭自习被他校禁止的行为？ - 北京化工大学  由于女票在北工大，因此鄙人每星期至少都要去一次北工大，北工大可以算是第二个母校了，因为实在是去的太多了.. 从刚才那个北化工期末复习无座位的问题下的答案看，北化工貌似挺穷的，校园竟然如此破败，自习教室都不够用..而根据我在北工大的见闻，北工大是很富的（毕竟是北京市直属），教学设施很完善，最大的那个教学楼有中央空调，而且教学楼面积巨大，教室颇多，而且人少，夏季自习非常惬意；两个图书馆条件也还可以，不过老馆貌似没空调？新馆是有的，环境比较优雅；体育馆是作为08年奥运会羽毛球场馆来用的，条件自然不必多说，不过收费也很黑，一小时30，当然奥运馆也用作学校大型活动，例如开学典礼的时候，搞得跟演唱会一样；宿舍自然是带空调的，而且自认为宿舍比清华的强，清华的紫荆公寓远看还行，近看也是坑坑洼洼（最近学校一直在修修补补，我看还是打倒重建吧...）；食堂只去过两个，清真食堂价钱比较良心，不过口味一般，美食园好吃一些，不过比较贵  另外北工大这个暑假正在大兴土木，建新的游泳馆、教学楼，图书馆也要翻修，而且北工大的建设速度非常快，不会像某些学校拖拖拉拉图书馆建个四年建不好，女票的宿舍楼就是“大干特干100天”平地而起建好的，估计年底就都能建好了，到时候工大又是一番面貌了  北工大的地理位置，自认为是比北化工好多了，三四环之间，地铁站直接修道了校门口（14号线北工大西门站），出行非常方便；周边配套设施很齐全，北门出去就是奥莱特购物中心（名字好像记错了），南门右边走几步就到了京客隆超市，再往前几百米就是大地影院，欢乐谷（大型游乐场）、潘家园（古玩杂货，北京风情）、十里河（古玩、花鸟虫鱼文化市场）坐地铁几站就到，周边娱乐设施齐全，一条龙服务- -  学风上，北工大的北京学生占多数，到了双休日都回家了，教学楼、图书馆都比较空荡，学风可见一斑，而且学校管理比较松懈，没有集体自习、没有早读、没有早操（难以理解某些大学竟然会有这些东西搞得跟高中一样），但我个人比较喜欢这样宽松自由的环境；至于学校近年来的进步，不妨看看这个新闻： 工大要闻     总的来说，个人感觉北工大最大的好处就是不差钱，令人印象深刻的是，校庆的时候不像某些学校强制学生参加，而是以利诱之，参加就发50元补助... 北京化工的话，个人不太看好化工专业，而近来比较火爆的计算机，正好是北工大的王牌专业之一..  无聊瞎扯几句，北化工的同学轻喷
北京化工大学考研。。有今年北化考研的本校生么。我想咨询一下国庆物化辅导班的事情，还有专业课复习和导师?,辅导班是内部通知，九月份报名，导师去研究生招生网去看
华东理工大学和北京化工大学比哪个更好？,住宿环境一个上海第一差一个北京第一差
北京化工大学职教部怎么样？,同学，你好！我是一个学化工的本科生，我们在北区，你说的专业是在东区教学，我还真不太了解，我给你一个新生群，那里边有你学的专业的直系学长学姐，你进里边问一问，看看啥情况。北京化工大学16级新生群号码：236899493。
合肥工业大学、北京化工大学、北京工业大学、华南师范大学、上海理工大学选哪一个好？, 泻药，广东省外学校不是很熟，就不误导人了，作为广东省内，既然想学理工科，如果你报了物理，计算机等专业印象华师也就是师范了，你想做研究，好像选它比较一般，而且华师的石牌校区，住宿不要太烂，你选的专业不知道是不是那边，理工科，广东省内的广东工业大学，华南理工大学和深圳大学都是比较突出的，深大很推荐，环境超级好，大城市，氛围好，不过好像分数这几年有点飞涨，作为女生，去了理工科，你会成为国宝的，最后，既然出国，学校嘛，never mind。  
北京化工大学那么差吗？,曾经在北区的时候一宿洗4，5个澡还是睡不着觉，然后校医院才可怕，支气管说正常感冒，然后最后发展到肺积水，我一个同学骨癌，校医院诊断为运动损伤，应该是16年底吧，我这个同学也没撑住去世了。读到研究生了，这都第6个年头了，按理说大多数事情你应该都习惯了吧，但是依然有惊喜有陷阱让你觉得，卧槽，这种傻逼事儿也能干得出来？所以，你要是想知道这些事儿是不是真的，来这个学校体验一下吧，哈哈哈哈，还有说loser 的朋友，衷心祝愿你在接下来的几年里在我化一定不要生病，生病了也一定别让校医院给误诊了，这么优秀的人才，万一大病让校医院耽误了英年早逝，那可真是可惜
山东大三学生，想考北京化工大学的药物化学专业研究生，有哪些可以分享的联系？谢谢?,我是今年刚刚考上北化药学的学生，普通二本考过去的，其实经验就是好好准备一步一步稳扎稳打还是比较好考上的，看到你说药物化学专业，这个应该是细分的方向，大面上应该是要考药学专业，考上之后根据你想跟的导师，或者其他的考虑再确定的方向，目前我知道的就这么多，祝考研成功！
如何评价北京化工大学六号宿舍楼利用广播设备播放网络歌曲等噪音？,完全无视学生权益。痛斥他们
北京化工大学计算机研究生住宿条件怎样？, 四人间，不会去北区，这两年入学的话估计也赶不上南口校区，所以在东区呆着肯定有空调。  两个上下铺，四个袖珍电脑桌，四个小柜子，然后有个小凉台，有个小电扇。  没有独卫，成功摆脱异味困扰，但是早上起来可能面临如厕难问题。  另外宿舍很狭小。 
北京化工大学（211）化工硕士如何进入金融行业？,cfa
北京化工大学生物工程专业怎么样？该专业就业前景怎么样？,工作好找但收入极低，基本需要通过读研读博改变人生，不知道北京化工大学是不是这样子。
选择 兰州大学 还是北京化工大学 ？,有一个很好用的数据，叫ESI学科排名。期末复习时间紧，我就不去找了，题主自己去查查吧。13年兰大化学似乎是220左右，北化280左右，不知道这两年的变化情况，应该还是兰大稍好一些吧 ————————分割线———————— 作为一个北化学生，建议你，别来北化。我们的新校区离市中心两小时车程，而且没有地铁。我们还好，呆一年就走了；而你如果过来，要在那里呆三年  ♂️
长安大学好还是北京化工大学好？,要是问我，我肯定说北京化工大学好啊。 说实话，我报志愿的时候还真没考虑过长安大学。听说过，没考虑过。所以不太了解。 具体还是得看学什么专业吧。 虽然没什么干货，但还是应邀来答，主要是为了放张图。  
北京化工大学博士好毕业吗？,谢邀，我目前还在上研三，不敢说对博士毕业的难度有多详细的了解，只是把自己知道的一些情况和想法写出来，希望能对题主有所帮助。  据我所知，博士是否难毕业一是看研究方向，二是看导师。   首先说研究方向，现在博士毕业要求要有Top，所以我觉研究方向最好是比较热门，易发文章的，不然达不到学校要求就算导师同意也是不能毕业的。如果博士的课题是工业化的项目，那就不容易发文章，或者这个方向已经过时，也是不容易发的。例如生物化工方向中的酶固定化，生物柴油，都是很难发文章的研究方向，因为基本上各种方法和技术都被人研究过了。所以我觉得题主应该先看看自己导师的研究方向，自己查查文献或咨询一些大牛，看看是否容易发表文章。另外如果是直博的话你的硕士研究内容可以写入博士论文，而考博则不行。因此如果题主想直博且不需要更换研究方向，那就可以看看现在的研究方向是否新颖或热门。  完成了学校发文章的要求，剩下的就是和老板的战斗……有些老师会有让博士延期的习惯，所以题主最好先问问你们课题组的博士师兄，是否存在被延期的情况。我们课题组的博士如果不出国交换，则一般延期一年，也就是4年毕业；如果出国交换，则有很大可能要5年才能毕业。所以我觉得是否容易毕业是要看导师的，而不是看学校。还有就是，导师即便承诺你3年毕业，他也可能会在你读博后反悔，当然这不能一概而论，要看你老板的性格了。  最后多说一句，我个人建议题主换个更好的环境读博。总是待在一个地方，会束缚我们的视野，而北化本身就是一个气氛比较压抑，人文气息淡薄的工科院校。当然这只是我的一点肤浅的看法，希望这些能帮助题主做出更好的选择。
北京化工大学教学楼wifi如何使用？,谢邀！居然有如此神奇的问题！目前教学楼wifi有两种，学校网buct和中国电信chinanet。登录buct需要用学生个人账户进行登录(一人一号)，如果不是本校学生的话可能比较麻烦；chinanet和全国其他的chinanet规则一样，使用电信的账户密码登录，如果没有的话可以使用万能的马云买一个临时的，大部分时候网速还是相当不错的。
重庆理工大学和北京石油化工大学哪个好？,北京石油化工大学没听说过，而北京石油化工学院也是一个比五大连池还大的坑
遇上北京化工大学王嘉泽及其父亲是一种怎样的感受？,活久见嘛… 活的长了什么奇葩也能遇见…   －－－－－－－－－－－－－－－－－－－－  人前几天判了  今天收到了追回款  无债一身轻啊  只希望自己以后可以审慎行事  希望她，出来后，可以好好活。
