是否应该放弃北京化工大学的化学系而选择澳洲国立大学的化学系？,不如考虑放弃化学系吧，真的
我是准大学生。北京化工大学2015届入校后在哪个校区啊？新校区现在就可以搬吗？希望学长告知?,听说要搬
北京化工大学机电学院石油机械方面研究生研究方向都有哪些？,这个学院据我所知只有两个搞石油机械地老师，全从我们石大过去的，据我同学说，也就院长和院长的一个博士，院长为人不清楚，但他那个博士人品相当。。。据说都快从副教授混到教授了。但是他的学生很痛苦。我一哥们很后悔，甚至想退学。
北京化工大學附屬中學怎麼樣.?,12年从化附高中毕业，对初中不是很了解。全年级大概一百150人左右，有大概40多人能上二本以上的，大部分都是三本。排名在北京市算是三流末位的吧。学校面积没多大，有个羽毛球馆平常自己去还要收钱。不过对我本人来说觉得母校还是挺好的，毕竟在这里有太多美好的回忆了。
北京化工大学考研？,不请自来。。。只为验证下这个账号是否激活成功。顺便回答一下。表达我→_→  首先，学硕和专硕区分不是太大，近几年可能比较严了，专硕一般都是要去工厂等地实习半年的；这也可能是很多老师不想要专硕的原因，因为还得给你专门制定个培养计划。  研究生宿舍条件较本科生比好太多了，四人间，上下铺，有写字桌（带有衣橱），不断电。但是尼玛我们今年化院（还有材院，经管的难兄难弟）的研一新生回北区啊，北区没空调啊，但是有独立卫生间啊！！！研二搬回东区，东区有空调啊，但是没独卫了啊！！！总之，空调独卫不可得兼。如果你去常州院读研究生，研二开始去常州，那里的条件好，空调独卫可得兼。条件啥的就酱。ps，如果不去常州，就一直在北京读的话，对食堂要有一定的心里准备。
北京化工大学发生的70万元诈骗案是如何实现的？,谢胃药 你不要总想搞个大新闻，大校比你高到不知道哪去？
北京化工大学的老师几点下班呀？,没课的17点下班，有课的20点30分吧
北京化工大学真的很官僚吗？,作为一个在北化工和北理工都呆过的人表示，连北化的管理都官僚的话那北理工的管理算什么？
在北京化工大学食堂如何点菜性价比最高？,两碗小碗米饭和一碗大碗米饭一样价格，而前者米饭更多。 不要吃二食堂的白斩鸡。
去北京化工大学参加自主招生需要准备些什么？,宝宝今年去考了北化的自招 是化工材料类 刚考完并没有出结果，祝愿 考试科目是数学和化学 没有超纲内容，都是高三狗应该接触的内容 数学主要就是函数，三角，向量比较多 化学大概就是自偶电离，化工，有机，结构 面试当时等了三个半小时，然而面试时间只有十分钟 面试内容主要是社会热点，生活常识，还有英文题 大概就是这样吧，开了这个帖子没有等到大神 就自己来说一点吧，希望可以给以后的小朋友们一些经验
华东理工大学和北京化工大学哪个化学较好？,华理只能说是一般般吧。也就是化工专业才排全国前三，也就是毕业的学生才占据江浙沪化工行业半壁江山，也就是被化工业内人士贴上踏实低调的标签，也就是以一个舅舅不疼姥姥不爱的211身份(你懂的)超越某些985，也就是才在三大世界高校排行榜挤进世界前500名，也就是这样，真没啥的。  PS: 目前经济形势这么差，能不学化工还是别学了吧，虽然华理化工很牛，但是在整个行业都不景气的大趋势面前也没辙啊。。。
北京化工大学有“水资源研究中心”这个单位吗？,金日光在知网上能搜到60多篇文章，but都是发表在北京化工大学的期刊上。 家里也有人迷上这个产品，觉得是无比伟大的科学家，还跟他合影什么的。 宣传材料上的文字也漏洞百出，称其“与爱因斯坦比肩”。  期待真正的科学家来挽救一下，诸多深陷的家人。
北京某211化工类大学应化专业大二下在读，但是想毕业后从事金融法律方面的工作？,为什么是金融跟法律？ 如果是金融的话，也有细分：银行、证券、信托、信贷、保险、投行、互联网金融都不太一样。选错了也是恨好长时间的。 考证券从业资格证、银行从业资格证，然后尽快到金融机构实习（建议不要去传统银行，去股份制银行、券商、基金公司、投行等地实习，做什么都可以）。
北京化工大学宿舍条件怎么样？,四人间，上床下桌，有空调，据说是公共卫生间，苦了南方不习惯大澡堂的孩子，但是有好有坏，不用自己刷厕所。这是公众号之前放出来的图片  
如何看待北京化工大学从昌平县城搬迁到南口？, 谢邀，影响一般是从利弊两个方面来分析，此次搬迁获得的利处无非就是更好的硬件设施，比如更大的运动馆，更好的学习环境等，但这些并不是必需得去改善的，这么多年了，北化的学生凑合凑合也能过，而且硬件的改善对学生综合素质的提升也是十分有限的。   弊端就比较明显了，全体本科生都要为此付出更大的时间成本，你本来可以很方便的做许多事情，现在要把大量时间浪费在交通上。   对要继续深造的同学来说，虽然在郊区能更安心的学习了，但会影响上考研出国的培训班，毕竟有的课程郊区没有，你必须跑到市区上。  对要实习找工作的同学来说，去实习的时候恐怕要租房子，从学校出发上班的话，路上可能要两个小时，你是受不了的，那租房子后生活成本一下子就高了很多，一个月2000块左右的实习工资，交个房租也就所剩无几了。   更重要的一点，在那么偏僻的郊区视野会被局限，由于周边没什么学校，许多活动你都不能便捷的参与。本科生的可塑性较高，接受到的某一条信息，参加的某一个活动可能会完全改变一个人的人生路径。把最需要开拓视野的本科生却被扔在了郊区，需要专心做研究的研究生却放在了繁华的市区，有点本末倒置了。尽管学生的本职是学习，但是学习的方式是多元的，学习不仅仅是呆在自己的学校里，去别的学校，去社会上参加各种活动也是在学习。   更全面的利弊分析还是要靠与其他学校对比才能得出，沙河高教园、良乡大学城的那些学校虽然也偏僻，但至少是学校扎堆的地方，交通也比南口好得多，而且硬件条件不会比我们南口新校区差。学校还是处在比较聚集的大学城里比较好，毕竟男女比例会平衡一些，方便解决婚姻大事，而北化却一个人呆在南口，学校不一定要处在闹市，但也不能这样孤苦伶仃啊。   近朱者赤近墨者黑，还有孟母三迁的故事，都告诉了我们环境的重要性。20岁左右的年轻人最好还是去接近“中心”的地方，你可以考不上北清，那就去接近北清的地方，你可以不去北上广，那至少去接近北上广的地方，在这些中心地带接受的信息，质量更高也更全面，更加有利于你的成长。   总之，别让南口局限了你的脚步和视野，努力从昌平走向世界吧！ 
北京化工大学的美术系怎么样，重点专业是什么，是否学校会重视这个专业？,有工业设计专业，还可以的。 新成立美术系了？
如果不打算干大学的专业，你会怎么选择第一份工作，我是学化工的，想去北京找份工作，应该怎么考虑呢?,谢邀。问题描述得不够详细，所以无法作答。请参考知乎上类似问题的回答： 怎样进行职业规划？ - 杨毅的回答 
如何看待北京化工大学（北区）学生期末无充足座位复习而跑遍昌平城区，到石油政法蹭自习被他校禁止的行为？,不行，看到前面一大堆校友开喷，而且一些人我还能猜出是谁来，有点小激动- -。来强答一发。  先说北化的经费问题，就像校长说的一样。   我们来详细看看经费有多少吧！！  北化在地53名，第一栏是预算榜，第二个是实际收入榜。单位是亿元。 北化作为化工项目上的主要科研学校之一，经费之少，令人发指。不客气说一下，石油大学两个校区的经费是国家分开拨款的，而且两个都比北化多。【加起来超过北化两倍】 一个20亿，一个17亿。 在看看2015年的科研经费方面。 北化6.01亿。比石油又低了不少。而且又比两个校区都低。【可以的，这很北化】 这下你们知道北化是真穷了吧，石油比北化有钱不是开玩笑233。  -----------------------------------------------------分割线------------------------------------------------------------------------------          下面说正事，北化北区的教学资源确实少得令人发指，考四六级的两天又全都封了楼。导致三个学习的地方两个主要区域没有了。那天早上，图书馆7点30开门但是6点50不到就有同学去图书馆门前排队等开门，然后7点30开门后不足20分钟，图书馆488个位置【四楼220个，五楼268个】全部爆满。         大家没有地方学习，马上又就有考试，那怎么办呢？？去昌平找其他地方学呗。于是，石油，政法，昌图，乃至万科，KFC，M记全部被占领，而且还有一大堆因为晚了时间没地方最后只能在宿舍的，那天北京最高32度。北校区破，我们都知道，北校区卖了，我们也知道。但一年拖一年就是不给北区装空调真的是很无奈。宿舍里人多，地方小，楼道里也吵闹。宿舍的气温比室外还高个2，3度。在宿舍学习，真是...........................不如跳舞，呵呵。于是有了这样的图  有句话叫不患贫而患不均，那如果又贫又不均呢(⊙o⊙)?？。那...............我只能说..................不如跳舞，啊，不，是不如跳楼。      这下明白为毛大家去自习趋之若鹜了吧，宿舍除了睡觉根本待不下去啊啊啊啊！！现在连睡觉都待不下去了。 所以，北区没空调不是一天两天了，2002年买的北区，到现在没装，你说现在因为卖个石油了，不想再投资了。大哥，十多年了啊啊，他若想投资，改善学生宿舍用得着到现在？？？现在说是因为卖了才不再装空调的，洗地能不能有点水平。  神论2  北化有三个校区要顾，没那么多钱啊。 大哥，西校区是个职业技术学院和继续教育学院，基本和北化本区没有毛线关系了，只是挂个名，方便招生啊。而且他们西校区的设施比北化两个本区都好，你跟我说这个，excuse me？ 至于东区，目前来看，近几年都是小范围修修，没大改动。   神论3  大家爱学习，这是好事。北化学风好。         你说有学霸们天天都自习，不否认。但看看平时晚自习主教人口密度和期末主教的人口密度就明白了。有人在每天都学习，但大多数确实考前两个星期学完全学期的课程考个试。就好比一个高中，肯定有一些想学习的人，再烂的高中都有一些学习好的人，但要是这个高中里大多数学生高三100天倒计时了开始疯狂刷夜，疯狂学习，前面都去玩了。你看到他们100天里学习的样子，就能说明这个高中学风好？？学风，从来都是平时的一点一滴的积累。一次一次作业认真自己完成，实验报告是自己写还是直接抄爱课程网，大雾实验是自己写还是抄模板，高数是自己下课写完作业当复习还是周日的时候抄答案第二天直接就交。这就是差距，恕我直言，我是化工专业的，就我看到的人， 第二种明显多。    神论4  北化就是你们的母校，你们怎么能这样骂你们母校。以后离开北化，你要照相的地方是北化，你要照毕业照的人是你在北化的同学，你填在简历上的本科学校就是北化，你没有办法去否认。       说实话，这和五毛说“中国是你们的祖国，你们不爽你移民啊”没什么区别了。自己有问题别人说你，你就道德绑架别人？恕我直言，你化思修洗脑教育确实一流。北化的条件确实不好，北校区的条件更是在北京圈里大学连一堆2本院校都比不上的水平。【甚至不如西校区3本】这样的状况你依然觉得正常，可以接受，还是自我催眠说，可以，这很北化。    --------------------------------------------------------分割线--------------------------------------------------------------------------       北区这边用了14年了，几乎没改善过学生的生活条件，新校区这两年才修，北区也这两年才卖。不要在用新区做借口了好吗？？北化建新区为了啥？目的只有一个啊， 扩招。 近几年每年都在扩招，为啥扩招？没钱啊！再扩招北区装不下啊！       吐槽了那么多北区的种种，后面还有人跟我说，现在正是招生季，别说这些了。影响不好。对，影响肯定不好，但要是没有影响北化就不会变得更好，也不会有人来重视学生们的诉求。  这样的情况发生时，老师的选择是：在楼上看戏，拍照，然后发了朋友圈。看我们学校的学生多有趣。  --------------------------------------------------------------------------------------------------------------------可能未完待续
北京化工大学是否适合想从事3D打印方面工作的人就读？,谢邀  3D打印是一个科研的热门方向，北京化工大学高分子材料先进制造英蓝创新团队就在从事3D打印方面的研究，该实验室研制的3D打印产品曾亮相2015广州“CHINPLAS”国际橡塑展。新闻报道称，该团队杨卫民教授以微积分思想位基础，采用标准塑料颗粒加工技术，摆脱传统3D打印机耗材种类少、专机专料的局限，创造性开发出“熔体微分3D打印技术”。并称该技术“在生命科学、高仿生机器人领域具有重大的应用价值”。  英蓝创新团队官方介绍如下： “高分子材料先进制造科技创新英蓝团队”由教育部“新长江学者奖励计划”特聘教授杨卫民为学术带头人，是一支人员组成合理、创新能力强、具有很大发展潜力的研究队伍。创新团队依托“有机无机复合材料”国家重点实验室、“轮胎设计与制造工艺”国家工程实验室以及“高分子材料加工装备”教育部工程研究中心，努力建设国家重点学科“化工过程机械”、“材料加工工程”以及北京市重点学科“机械设计及理论”；同时，围绕“高端装备制造”和“新材料”两大战略新兴产业发展的国家重大需求开展研究，在“高分子材料加工成型高端装备”领域系统深入地开展高分子材料精密成型原理及装备、高分子材料加工成型重大关键装备以及高分子材料加工成型微纳制造装备等研究工作。  若需了解该团队的有关信息，可访问其网站： 高分子材料先进制造科技创新英蓝团队   。
怎样在没有本校校园卡的情况下进入北京化工大学的图书馆？,我也想问，你找到了吗
北京化工大学有哪些值得称道的方面？,泻药。 这是一道送分题。 因为不存在。 如果你硬要从骨头里面挑出鸡蛋，可能是远离家乡的无法无天，可能是地处北京的优越感，可能是偶遇的老师才华横溢，可能是夏季太热没有空调引起的姑娘的玉腿横陈，嗷了四年给你一张211的文凭以至于侥幸可过招聘时的文凭筛选面。 但同样离家太远易孤独，地处的北京不在中心（本人在昌平），好的老师难相遇，没有空调能是优点？211同分数档次北京也有别的学校吧。 但有一个很好的地方是——我们不会以学校为骄傲，所以我们只能强调自我。我们没有光环，所以只能依靠自己发光，在很多人还没褪去名校症结时，我们知道keep learning的道理。 当然啦，我说的不是优点，只是希望勉励一下大家。 还有我学习挺渣的，希望这个文笔大家多多包涵。 谭校长要不把广告费结一下？（逃
如何评价神舟十一号工作团队选定北京化工大学所研制的材料作为太阳能电池翼的原材料？,北化工本身就有有机无机复合材料国家实验室，挑大梁天经地义无可厚非~
北京化工大学究竟有哪些需要改进的地方？,最大的问题其实是中国大学的通病，政治业绩代替了教学成绩，领导个人的短期业绩代替了学校的长期发展。比方说，一个211大学，就不说教育部直属985平台了吧，一个正常的211大学，是不是要满足学生的基本学习和生活需求？学习和生活的硬件需求无非四样，寝室 教室 食堂 教学设施。先看寝室，狭窄，分校区无空调，主校区无独卫且宿舍狭窄。狭窄的宿舍早晨了十分难堪的生活环境，好比是农民工住的工棚，没有独立和隐私空间，除非宿舍决定一致，不然根本无法在宿舍有人的情况下，独自学习。空间狭小，也容易引发同学矛盾，极大影响日常休息。在看教室，桌椅陈旧不说，最大的问题是无法同时满足大部分学生自习。临近考试周，大部分学生自习，这时候即使加上图书馆和阶梯教室，也供不应求，可见教室桌椅的设定基础，就是不会出现大部分学生同时需要自习的情况。再看食堂，菜品窗口少，菜种少且固定，从北区到东区，几乎那么多年了菜品都没有变样，尽管这样远低于同类大学的供应水平，菜价却远高于北京其他211大学，这个同学们都有亲身体会，这就要问，为什么我们学校价格这么高，为什么其他211学校价格那么低，这个差价去哪了。最后看教学设施，有同学亲身晒出了化工大学的北区化学实验室，设施陈旧，老化破坏，令人寒心。随便在校园走一走，破败的垃圾桶 没有人打扫的角落清晰可见，一句话：没有人管。     回过头来，你去翻看学校的网页，学校领导好像都很忙，他们在忙什么呢？——他们忙着和其他国家的大学签订合作招生协议，因为这样可以扩招名额——意味着教育部给的经费就更多。他们忙着推选两院院士，长江学者，杰出青年，这都是看得见的政治业绩。他们忙着响应国家号召，开展比赛，搞校园活动，什么什么大赛，表面上增长了学生的才干，其实这些比赛通通都与真扎实打的学习知识无关，更多的是拼凑材料应付评审—这些活动和业绩也是学校领导有方。这些都是看得见能写在材料里报在新闻里的，对领导来说是“真实”的业绩，是实打实的上升资本。而学生的教学感受，老师课上的好不好，学生到底学到了多少知识，在学校住的怎么样，吃的好不好，对于领导来说，都是虚的，没有用的，无法写进考评业绩的。就算上级来视察，总能有学生站出来说好，进行一下爱校教育，总会有一帮学生感动的不行。学生嘛，给个芝麻就当西瓜，来看一下你就把人当成母亲，走进一下同学，不知道有多少人会激动。等到一毕业，又会有多少人把学校的坏忘的一干二净（因为毕业后吐槽母校对自己的工作也没好处，一个成熟的毕业生都会使劲夸学校，来表示自己当初的优秀）。既然在关键时刻投入一下就会有丰厚回报，又何必在平时为同学们着想呢。新生每年都有，四年以后流水毕业，你拿毕业证我拿业绩，大家各不相欠。走入社会，互相帮忙，“荣辱与共”，这又变成了校友共同体。   这就是中国大学最坦诚的逻辑。在保住业绩升官的同时，国家已经规定的项目无法插手（比如一本大学的宿舍费已有明文规定），挡不住还有很多国家没有规定的项目啊。食堂菜价是我定，每盘菜的分量多少也是我定，校园网费是我定，谁家网线可以接入也是我定。学生打印四六级成绩单、毕业生回校打印证明，统统都有自主收费定价权。趁着还没法律文件，能多收绝不少收。能早收绝不晚收。那么这些钱究竟去去哪了？学生管不着，学生也不知道。感觉自己思维固化了，再学习以下其他学校，发现了校友会这种神奇的方式。在各地狂组校友会，这样就可以鼓动校友捐钱，又是一笔收入。不信去官网看看，又是喜大普奔某地北化校友会宣告成立。 权力保住了，收入也缓缓驶来了，剩下的就是保持学生的“安静学习”了。怎样保证学生们旺盛的“两耳不闻窗外事，一心只读圣贤书”的状态呢？大搞学生活动，嘿嘿，上上下下学习好的学习差的每个人都有事干，还觉得很充实，学到了为人处世的能力。你想鼓动同学对抗学校？你思想有危险？对不起这个学生会主席还不能给你。——当然学校的学生工作不会这么明显，可能会以团委管理学生会的老师阴晴不定的态度来启发你。你不在学生会？——同学你还有很多事情没有干呐。你看看这个活动要参加，那个比赛要评比，你看看你要有集体荣誉感——这些都让同学们无比的“充实”，“充实”得忘记了他们对真正需要学习的知识一无所学的空虚和恐惧。也无法全身心的分析自己上了一所什么样的大学。     有了这个主旨，其他的校园实况就可以想象了。老师们上课靠道德素质，踏实教学的老师，仅仅比敷衍了事的老师多一个“十佳教师”荣誉称号。这还让更多的不负责任的老师低调快乐的活在其他负责人老师的光环下——学校犯不着为了四年一届的学生约束一辈子干的教职工。校医院的态度可以想象了，说实话现在很多宠物医院的态度跟校医院还是相反的。要是再说校医院是兽医店，把兽医店也黑了。学校领导乃至辅导员处理事情的态度可以想象了，都是息事宁人，反正过了这个坎大家就会忘了。再给你说点好听，想想学校的苦——其实学校不苦，我校的财政拨款和实际花销，在全国的排名，大家可以上网查，很靠前。那么再看看电梯年久失修，热水器或坏或残（13年之前还没有） 图书馆书目陈旧 电脑房的电脑还归属上个世纪等等突出的表现，就见怪不怪了。      更不要提学校的人事管理制度，教务处的“老师”的衙门作风，一些深层次的管理问题了。    我说的都是基于大学管理的一般逻辑来说。不排除有个别好的领导，好的老师，好的辅导员。但是他们也改变不了大的人事任免，在真正危及自身利益时，也很难做出两全其美的选择，大部分还是选择“忠于”学校，毕竟人家等着学校发工资。       我说的这些也不排除学校做出一些改善的小动作，逢年过节发个票券，领导出来鼓励大家几句，等等。    我还要说的是，北区的热水器还是后来加装的，之前都要去水房打。从这个方面来说，是进步了。问题是，在这之前落下多少工作。这些东西，对于21世纪，号称要建设世界有影响力的大学来说，是不是太可笑了一点。还是说，这个影响力就没准备往正面建设。       好了啰嗦这么多，匿名吧。 
如何看待北京化工大学北校区在没通知的情况下取消主教通宵自习室的做法？,不知道为什么，突然就开始断电，而且是未通知的情况下！本来通宵自习室就不够，而且是在期中考试前突然断电锁门。直接打乱了复习节奏！希望学校哪怕可以给个通知，也给个理由，为什么突然在没有通知的情况下断电，而且强行赶人！现在只能去北阶1自习了。人又多又脏乱～真的没有学习的心情了！！！
工科考生，郑州大学和北京化工大学该怎么选？,题主你好，我是北京化工大学的化工专业的大一学生。 我仔细看了你的问题，想首先问一个问题，你弟真的明白化学和化工的区别吗？化学是理科，化工是工科。前者在实验室里摇烧杯，研究反应原理；后者在工厂把实验室中的反应转化为一个个设备中的产品。这个区别非常重要。我身边同学很多人上大学之前，化学都不错，上了大学才知道，化学和化工真的不一样。 其次就是选大学了。我的室友是河南的。我想每一个到北京上大学的人，心里或多或少都有大城市的梦想。我是农村的，不得不承认，这一个学期的收获比我高中三年多得多。这就是北京的城市地位。另一方面，北京化工大学给我的印象是很不错的。学风严谨，谦虚低调，学科实力虽不是顶尖，但可圈可点。 回答一定要有观点，所以，欢迎你的表弟报考北京化工大学！
