目标北京化工大学考研，化工原理和物理化学选择哪一个？,首先看你擅长哪科，初试留给擅长的那科，其次，据我了解，北化的物化初试题型每年都变幻莫测，让人抓不住点，而据初试考化工原理的人说，化原每年的变化不大，最后，化原和物化都是要考的，只不过先后次序由你自己决定
想考北京化工大学的化工专业研究生，有哪些经验分享？,可以关注北化人论坛  http://www.  bucter.com      ，有些考验资料会有分享
北京化工大学的应用化学专业是不是真的很强？,刚出排名全国第一 个人感觉北化的应化专业考研还是不那么容易的
如何评价北京化工大学校徽的设计，校徽内涵是否有些牵强生硬、无中生有、不理性？,其实就是照着这个设计出来的 
为什么在北京化工大学计算化学是工科专业？,根据你的陈述我推测——很明显您考研究生就是为了找工作？您放心吧化工厂基本上是不要女生的——所以我真不知道您有什么可抱怨的，因为看您的陈述，好像您根本就不是为了搞研究读这个研究生的，而读工程学科您又就不了业。——[以下为根据您的评论的补充]很明显我的意思是，既然选择了您就应该努力做下去，13年诺奖就是给了多尺度模型，诺奖评委会也称：从此计算机将成为与试管一样重要的工具。所以我不明白你选了一个这么前沿的方向有什么可抱怨。倘若您的导师是仲cl老师，他更是刚评上长江学者，根本不缺经费。如我开头所说，女生读工程学科工厂几乎就是不要。我匿名就是不想让您知道我id罢了——毕竟一个学校的。有关我的论断你可以去咨询化工学院的刘君腾老师
如何评价北京化工大学发生的70万元诈骗案？,刚看见一遍报道，涉事的王某现身了，并表示自己已经在南方找到了工作，并且不准备还钱，被骗的同学也别想她家里把房卖了还钱。 ------ 其实新闻原文是这样的，然后就是我个人的不负责任的解读，纯属搞笑: "我没有失联，也没有跑。我现在已经在南方找到了工作"----我已经去了南方，有种来抓我. "我不回去，不是因为我怕什么。第一，我现在刚找到工作，刚立住脚，我现在兜里就一百块钱，所以我不能现在买高铁票就回去"----我就是不回去，你们又能拿我怎样. "我现在正在和同学一个一个对，如果金额一致，我就先给他们打欠条"----欠债的都是大爷. "我爸妈也想卖房替我还钱，但我家房产证还没有下来，现在也卖不了，所以卖房还钱不现实。即使现在能卖，我也不能让我父母替我承担，因为这笔钱是我欠的，不管怎么样都应该我来还"-----反正我又还不上. "我已经和我的辅导员说好了，学校开不开除我，我都得认，因为这是我自己做的孽。如果有可能，我也不想放弃我的学业。但现在出问题了，我也不能逃避"-----你们看学校要欺负我这个弱势群众. "现在我表姐帮我找到了一份工作，每个月大概两三千块钱。现在我已经休学一年，我也会努力多找几份工作，多赚点钱还给大家。但我什么也不花，也需要几百块钱的生活费。我也和同学都说了，希望每个月还个三五百"-----是我算术不好吗，两三千一个月的工资生活费几百块然后每个月还三五百，剩下的一两千块去哪里了?
北京化工大学目前哪个专业最有前景？,那必须是计算机科学与技术啊，本校化学研究生都没有这个本校本科生工资高………
北京化工大学的录取分数线为何越来越低？是什么原因导致考生不愿报考该校？,首先是校名儿太难听，给任何人听起来都没有好学校的感觉;其次是在北京的地位很低，属于中等偏下的一本了;最后是因为这个学校很官僚化，社会上本来都没什么人关注这个学校，但是牛气哄哄的，我也是醉。暂时先说这么多
如何提问北化视野的《辛苦了，北京化工大学的大学生们。》？, 哎！    
北京化工大学的材料好，还是？,去北理吧，北化的硬件条件实在是不靠谱。
北京化工大学必修课挂了，大四的成绩单上会有挂科记录吗。？,会
武汉理工大学和北京化工大学选哪个更好？,我也是，可我家在理工大旁边。。。最后报了武理，北化虽有地理优势，可刷了好久知乎感觉相关专业还是武理强一些吧，如果要读研读博选择武理也许会更好。 以上均属个人观点，轻喷。
如何看待北京化工大学某学生返退募捐善款的行为？, 学生募捐救父3年后还款：若不还钱以后你还捐吗？    转载当事人自己的看法：  许涛不愿意自己还钱的事情被报道，理由是“子贡赎人”的故事。  　　3年前，北京化工大学大四学生许涛在微博上借钱救父，承诺3至5年内连本带利还款。今年5月9日，曾经的捐助者曾鹏宇接到了许涛的还款，将此事在微博公布，引发网友关注。  　　“子贡赎回鲁国同胞，没有要国家的补偿和奖励，孔子说他做错了，没有经济能力的人还愿不愿意赎人，长此以往没有人再愿意赎回同胞了？”许涛认真地向新浪网讲述了这个故事。  　　他担心的是，如果自己还钱的事被关注，以后没有能力还钱但也需要帮助的人，大家还会不会捐钱？    在许涛的微博上，至今陆续发布着各种求助信息。他每一次转发，都呼吁大家伸出援手。  　　他说：“我还钱的事情不想再被关注了，(其他求助微博)一开始没关注量时，才是最需要关注的。”  　　许涛有顾虑，他不愿意自己还钱的事情被“传来传去。”他想尽力隐藏自己，这也是在网上能轻易搜索到他的真实信息，却一度要求使用化名报道的原因。  　　“以前我看到过一个故事，鲁国颁布一道告示，如果鲁国人在外国见到同胞遭遇不幸，沦为奴隶，只要把这些人赎回来，就可以从国家获得补偿和奖励。孔子的弟子子贡，把鲁国人从外国赎回来，但是没要求任何回报。你觉得他这么做对吗？”  　　许涛等待着回答，但他心里有特别坚定的答案。  　　他说，如果有能力的人不求回报，那没有经济能力的人还愿不愿意赎回同胞呢？没有能力的人把同胞赎回来，是不是也不能要求回报了？慢慢地，赎人的事就会被淡化，人们都不愿意做这件事了。  　　在这个故事中，孔子说“赐失之矣”，说自贡“你错了！”这样一来，救了奴隶领取赏金会被人嘲笑，不领取赏金自己就要蒙受损失，长此下去，谁愿意再去救人呢？  　　许涛的电话中不时传来风声，他用了很长的时间认真地讲完了这个故事，并且用了更长的时间反复阐述这个道理。  　　他说，“我还钱是挺正常的行为，但是如果有人需要帮助，但是没能力还钱，别人知道我这事以后，不愿意捐助他们，怎么办？” 
北京化工大学北校区附近有哪些美食？,石油大学食堂 
2017高考考生，540位次4480，北京化工大学可能性大吗？,想问问楼主是哪个地区的学生。不过正常来说四千多名是超过了录取分数线
北京化工大学东区边上有哪些便宜又好吃的小吃？,经历了很长一段面包+麦片的早餐，近期早上来得及吃早饭了，突然发现年纪大了以后，门口小哥的粥可能是因为加了糖稀略显稠腻，后来发掘的丑仔包子这学期关门了。嗯。还是早起一食堂 1块钱的粥和油饼+咸菜最养胃。 ========================================  早点类：东门门口卖粥的小哥，有绿豆薏仁燕麦粥、皮蛋瘦肉粥、黑米黑芝麻粥、红豆薏仁粥、南瓜粥……每天早上6点多到9点左右，满满的四五锅粥，三块钱一碗。自助找钱，他负责盛粥和打包，红糖白糖蜂蜜任意加。味道和服务都是5分好评，人多； 东门门外有两家卖烧饼的，一家在还没出去的地方，烧饼、卷饼可以夹鸡蛋、土豆丝、豆皮、肉、鸡柳……，个人不是很喜欢，味道2分吧； 在外面京客隆超市的那家，也有差不多的业务，特点是烧饼很酥，可以夹很多东西，价格公道，一般烧饼夹鸡蛋、豆皮、土豆丝，3块钱。除了给的土豆丝越来越少，味道5分好评，服务4分吧，人多； 以上两家都不仅早上有，一整天都有卖； 东门马路对面老广酒楼，早上卖小笼包，肉包子和素包子貌似都是5块钱一笼，同样人也很多，因为要过马路，需要比买烧饼和粥早起几分钟，特点就是能在店里吃。他家的豆浆比较好喝。是比较热且浓的那种，比在食堂等地方喝到的好很多，味道和服务5分好评； 从北门出去右拐快走出樱花园的时候，路北的那家也卖小笼包，豆浆也很不错，也可以吃完再走，不过只能在室外吃。冬天早上的话应该会比较冷，味道和服务4.5分好评（纯粹因为老广的太好吃了）； 南门的一品三笑，早上也有早点，有多种套餐，豆浆、煎蛋、一个不大的包子差不多6块钱，个人喜欢他们家的蛋花，啧啧，好吃，味道和服务4.8分好评； 另外还有肯德基、麦当劳等也有早饭，就不赘述了；
如何评价北京化工大学本科毕业生平均工资是由计科专业来拉动，而北化的计科就像二本学校的计科这一说法？,然而，去Baidu，Tencent，Google，facebook，microsoft，阿里，华为等大公司的人并不少。  —————越看题目说法越恶心———— 你化工研究生毕业工资平均还不到信息学院工资的2/3，我还想说: 你化工不出化工人才 滴滴公司的程维，领导人hgq，歌手慕容晓晓，都不是干你化工事业的。  你化成天搞活动，以化工学院为中心，以化工为题材，你是否考虑过其他院系？机电，信息，文法，经管？  另：16级学生高考成绩入学时计科仅次于化工排名第二。
北京化工大学材料专业的男生，分专业是选金属好还是无机非好一些？,必须是金属材料。材料，考公务员都没有办法要。
武汉理工大学和北京化工大学哪个好？,武理工科总体不错，非要王牌专业，复材、高分子、机械类（车辆）、海洋工程类，这几个是王牌。 北化，化工二字说明了一切。 看自己喜好了。 （意见不合勿怼）
在北京化工大学国际教育学院就读是怎样的一种体验？,  http://www.  zhihu.com/question/3993  0938    
北京化工大学机电工程，和其他综合性大学的机电区别在哪？,作为一个过来人，对北京化工大学机电工程还是比较了解的，如果真的想学机电工程，千万别选北京化工。整个机械专业真正懂电的老师没几个，机械专业大部分老师一般都是研究注塑机，挤出机的，还有材料的。这几方面做的还不错，英蓝实验室和塑机所都是很不错的，但是机电就很水了，只有几个女老师，还是从自动化调过来的，上课的时候有时候都讲不清楚。没有流体机械专业
如何评价北京化工大学的小学期？,说真的，虽然也有很多学校有小学期，但是，我们的小学期学的东西真的很水啊，一共三个星期的小学期，除了开始两天自学了个dxp和multisim，后来就整天躺在宿舍等第三个的参观活动，然后真的，有一天宿舍风扇坏了，给我妈妈打电话我都委屈哭了，没有空调是真的晚上一直被热醒啊，我是见过北化1.2.3.4.5.6点的人了，人生第一次通宵啊，三点过出去买水看到两个小哥，真是又心疼又想笑 
北京化工大学是北京宿舍条件最差的大学吗？,研究生在读不得不匿 不然100%会被查水表    凡是只提硬件设施 不提管理都是不客观！！      想问问在座的所有朋友，官方上的招生简章有没有告知说本科在昌平读书，据我了解我身边近期去招生的朋友，他们并没有说实情，这几天也有人咨询我考北化的事，当我说大一到大三在南口时，他们都很吃惊。在这里我用骗学生报考可能有点夸张，但是用瞒应该没有错。这是第一点， 部分报考学生缺少了知情权。   第二点， 当本身简陋的硬件设施出现问题的时候，不及时治理 ，并且还要去指责学生。我看了几个辅导员在pyq的洗白文，说热水器不好用是因为学生无节制的使用不当，质量不行怪用户？大一的时候整整一年，主教201旁边的男厕所，只有一个蹲坑有门，这件事我试着去跟相关部门反映，很遗憾的是当时只有学生会生活权益部受理了，又过了大半年，门终于装上了。可以看出北化让人心寒的不仅仅是基础设施的问题。（洗白的朋友注意，我只是举一个例子，类似的事情还有很多。）   北京化工大学是一个小型社会，而且是病态的。 遇到问题的第一件事不是改善，不是校领导表态，而是打压。有人可能说是事情太小没必要，随便提几个我在校六年发生的事， 疫苗事件，双学位事件，免学费事件，清真食堂事件 ，当这些事情发生的时候，无一例外第一时间冲上前线捂住学生嘴的都是辅导员，直到最后纸包不住火，校领导才出面。在这些事件中，共性基本都是学校对学生的欺瞒，这时候用 骗 已经不为过了，尽管校领导的说辞还是不是骗，是误会传达错误，但是换做任何一个有能力判断事物的人，都知道是骗。希望这次招生老师，没有骗你们什么，但也不要轻易相信。  当然，这几年北化也有对学生做得好的地方，不管这些行为是为了招生还是发自内心的，总之确实为学生做了一些事，但是当出现问题的时候，校领导的态度还是让人心寒。  最后，祝愿每一位去南口的学弟学妹辅导员老师们，出门小心，听说周边挺乱的，然后注意身体，一定要小心甲醛中毒，记得检测空气质量。  祝愿每一个毕业生，前程似锦，在北化这么多年都过来了，走向社会也没什么好怕的了，加油。   爱是相互的，你不爱我，别提什么让我爱你。  我等的是你的一句对不起，你却在等我跟你说谢谢。 
北京化工大学西区宿舍如何？,同新北化 已被录取 我是产设的 在群里了解是六人 八人住六人间 有空调 艺术生是这样 不知你是否艺术生 谢
北京化工大学基电的机械怎么样啊?,本人北化机械妹子，(￣▽￣)   我就不说大学还是要靠自己这种话了，虽然我严重同意这一点，毕竟那个大学都有学渣 我就简单说说北化机电的情况吧   大多数老师性格挺好有的超级萌，有的高端黑，专业知识方面，感觉每个老师都有干货！尤其是专业课的老师，简直是大写的赞！另外，高金吉院士是我们院的教授和博导，每年都会给大一新生演讲，，，然而他说机械学生还是应该下车间锻炼一下，我真的不想啊(￣▽￣)北化老师感觉都挺累的，毕竟分区办学，有时候没时间改作业都是在坐校车的时候改的T^T   学风方面，北化的学风真的是超级严，遇到作弊可能就直接开除学籍了，一到考试周，学校大屏幕上滚动播放处罚通告，老师学生都不例外！我们机电院课程相对于别的专业是要多的，所以学习真的不能放松，（然而我并没有资格说=_=）我爸很庆幸把我送到了这么个每次期末都像高考的学校^_^  不过，我想吐槽一下我们院的课程安排和考试安排  首先，课程方面大一相当轻松，看着同宿舍不同专业的妹子累死累活我就很开心，然而，自从大二开始了专业课，我以每天平均十节课的速度奔波在教学楼，经常中午十二点二十下课，一点上课，心累啊……  考试安排，五天连考四门重要专业课，你让我先复习哪一科我都会觉得对不起其他科目，都是重重的学分啊，都是（对于我来说）难破天际的必修啊……  感觉学校硬件设施不太好，我们说说金工实习吧，作为机械的必修课，你可以享受一个月不用在白天上课(不过晚上的课和周末的不算哦)的待遇，不过你也要一个月都面对各种车床，铣床，然而有些设备都是老旧的可以啊……然而按照老师的指导不会有安全问题哟，做物理实验也会有坏机器  总的来说北化适合学习，有缺点有优点，感觉名气不是很大呢，我高考之前都没有听说过，没毕业也不知道就业怎么样，我也只能就现在的经验说说了，欢迎交流讨论
请问燕京理工学院(北京化工大学北方学院)怎么样啊？, 垃圾啊。。。垃圾！哈哈 
北京化工大学本硕博连读和哈工大威海校区车辆工程哪个志愿好 ？,本硕博连读意味着少了进步的空间。单从学校来讲，我是觉得北京化工不如我们哈威的。车辆这几年就业越来越差，企业招的越来越少，过几年不知道咋样，不过如果你足够优秀也没啥，一汽每年都来……建议而已，自己选择……
本科在陕西一所非211院校学材料成型及控制工程，想考取北京化工大学的研究生，有哪些建议？求解答。？,同专业呀。加油
北京化工大学mba怎么样，有过来人么？,三类MBA 院校，不是特别好
北京化工大学在化工领域名声怎么样？,我是中科大学高分子的，每次看到北化工学高分子的我都会另眼相看，因为你们的高物学得比我们好，比我见过或听说过的其他大学高分子专业的学得好。  自黑狗可耻的匿了。
北京某211大学化工专业学生，未来想从事媒体传媒行业，娱乐文化公司节目组一类，考研可以考什么专业？,实习生薪酬不是低。 你可能还要给电视台实习生管理费。  如果真心喜欢传媒行业，去北京和上海。其他大城市都没什么机会。别去电视台实习。
最近北京化工大学是不是出现了学生食物中毒事件？到底什么情况？,因为众所周知的原因，我先承诺一句，我爱北化，我所做的一切都只是想让北化变得更好。  事情经过和真相如何，已经不重要。就像上海女子回江西男子家过年这件事一样，虽然最后说事情是捏造的，但是它成功引起了大家的讨论，更多的人开始关注社会存在的问题。学校的这件事情即使不完全真实，也值得我们重视校园食品安全问题。  现在当然还难以断定到底是不是食堂的食物有问题，毕竟有同学还吃了别的东西，据说水果摊的菠萝也有极大的可能是元凶。但可以确定的是，学校里的水果或其他食物是存在安全隐患的。可能采购的原材料在运输途中就出现了问题，也可能是加工过程有问题。总之，任何一个环节出现问题都会让人吃坏肚子，而出现问题原因往往也是人为的。要知道，餐饮行业从业者整体职业素养还是比较低的，他们大多数都不在乎食物是否干净，简单来说就是他们觉得不干不净吃了没病，认为吃不死人就行，也不是说他们只对顾客如此冷漠，他们对自己也是如此，自己也会吃有隐患的食品。作为一个曾经的餐饮行业从业者（现在的餐饮行业创业者），去年我在黄太吉的后厨工作过十来天，尽管每天都打扫卫生，清理餐具，但这种比较正规的中式餐饮品牌的后厨也还是有蟑螂的，有蟑螂还可以理解，毕竟小强太顽强，自己家的厨房可能也会有。但是厨具不干净，就是不可推卸的人为原因了，比如做煎饼的铲子不小心掉在地上，都不会用水冲一下，而是继续做，这时就有食品安全隐患了。不过黄太吉的冷冻和加热做的还是比较规范的，做好这两点食物中毒的可能性也很低了。而学校食堂工作人员的素养和卫生状况恐怕不如这些企业，黄太吉的问题在食堂只会更严重。  当然了，这一切也不能简单的将原因归结于工作人员素养的问题，食堂的管理，甚至整个学校的系统也都是诱发因素。  这次的事情如果是真的那也很难将过失完全归结于具体某一个人身上，因为学校的整个系统就有问题。北化是一个将近两万人的庞大系统，我们也是这个系统的一部分，可惜这个系统有Bug，丧失了自我修复能力，今天发生一件事情，明天就还可能发生别的事情，事情不一样，但原因都一样。宣传部门永远报喜不报忧，职能部门永远得过且过，而我们自己又经常集体沉默。所以说， 不作为也是一种恶，没有人是无辜的。 包括我们这些弱势群体和每一次的受害者，我们都是现状的帮凶，因为我们不仅不作为，有时候甚至不发声。      等调查结果出来后也许只是某一个厨师的问题，表面上与学校的整个体系没太大关系，我们学生更不用对此负责，但我们真的无辜吗？就像二战中死于原子弹之下的广岛、长崎的普通市民也不是无辜的那样，这些小市民没有参军攻击盟军，更没有去占领区屠杀别人，但他们默许了军国主义者的作死行为，他们没有及时让军国主义者投降，所以，他们明明有机会不死于原子弹，可惜他们还是选择了默许当权者的行动，这样来看普通市民并不无辜，不作为也是一种恶，死于原子弹是自食其果。  今天，我们的不作为，同样会让我们自食其果。  微信公众平台的登录页面有句话，“再小的个体，也有自己的品牌”。其实“品牌”这两个字也可以换成“力量”，很多时候并不是没有机会，没有力量，而是我们明明有却不愿使用。 围观也是一种力量，逼逼也是一种鞭策，转发也是一种态度。   作为一个即将毕业的大四狗，值得我留恋的不是学校，而是学校里的人和事。值得我们捍卫的也不是学校的形象，而是学校里每一个个体的尊严。  现在回到个人可操作的层面，我们在学校怎么吃才安全？ 我的建议是在食堂尽量吃熟食，吃拿种高温加热后的东西。吃水果的话，就买带皮的，自己回去洗干净或者削皮吃。还有一个方法就是点外卖或者去外面吃，但央视315晚会又曝光了外卖的黑作坊，街边小店还不如食堂安全，所以现在的社会需要更多正规的中式餐饮品牌，这样我们以后就不用天天吃食堂和比食堂更危险的外卖了。我们总自以为中华美食全球最好，但餐饮行业全球第一品牌是麦当劳，全球第一餐饮集团是经营肯德基的百胜，中餐在全球来看表现并不突出。口味的成功并没有改变我们在商业上的失败，而我，目前的餐饮行业创业者，并不敢夸下海口要带中式餐饮走向世界，我只是想让口味好的中餐，在国内能更加干净安全，让更多人能够吃到放心的食物，像麦当劳肯德基那样得到大家的信赖。目前我正在筹备自己的创业项目，项目是开中式快餐连锁店，主要卖太和板面（百度百科有介绍），欢迎感兴趣的朋友来当合伙人和天使投资人。我承认，这是一篇软文。 微信号（XXZZHH2012）
普通天津一本跨考材料，在北京化工大学与北京工业大学如何选择？,这就要看你想学啥材料了
北京化工大学的化工专业怎么样？,全国第五吧
北京化工大学文科好还是北京工业大学文科好?,谢邀。 这两所学校的文科都一般，建议去更好的文科类院校。如果非要选一个，北京工业大学，校园基础设施更好。
北京化工大学中外合办软件工程靠谱吗？,不靠谱。 别来。
考北京化工大学的研究生 化工机械 应如何准备？专硕还是学硕好考？,专硕
北京化工大学能源化学工程专业本科，先考研，不垮专业的情况下北京理工好，还是本校好？,我是能源11级的，化工行业都不好就业。行业饱和状态，材料化学也是坑，材料物理咱大北化没背景，化学化工都是坑。出去考公务员，朝九晚五，上班看报下班dota晚上陪媳妇，多好的日子。
2016年吉林省高考报考求助。东北大学，武汉理工，南京河海，北京化工哪个好？,     真的，我不是黑武理，作为这所大学的一名学生，你听我一句劝，别来！！！（微笑脸 ）看看这几天新闻吧，老师、辅导员辛辛苦苦的在宿舍楼下面守着我们，上课提前十五分钟到，请假需要书记审批，细致到请假去哪?怎么去都要一一填写（我在到达方式一栏写的:走路……）         呵呵……学校有这么大的力量你怎么不好好提高一下自己的教学质量，完善一下学生的生活环境呢？！      话说今天我去找武理工防高考替考的问题，没找到，是我手机的问题吗?我再去找找……      不过若想来还是可以的，毕竟在武理工我还在坚强的微笑着。（os:别来，认真脸）
