如何看待华中师范大学从下学期开始实行全天 14 节课的排课规定？,武大也是每天排14节，但授课单元内休5分钟，单元间休15分钟。 具体划分如下： 上午：1-2[8:00-9:35] 3-4/5[9:50-11:25/ 12:15 ] 下午：6/7-8[ 13:15 /13:55-15:30] 9-10[15:45- 17:30 ] 晚间：11[ 18:10 -18:55] 12-13/14[19:00-20:35/21:25]  按照这个方案，即使排满，学生在中午也有1小时[12:15-13:15]的休息时间，晚间则有40分钟[17:30-18:10]。  华中师大的方案 课间休息太长 了， 吃饭时间 被迫 压缩 。
学科语文专硕，去华中师范大学好，还是应该选浙江师范大学？,杭师大中文系师范学生，表示可以选择华东师范大学或者南京师范大学呀 。关于教师招聘你可以去看各地教育局的招聘信息，里面什么学校有什么要求都可以看看。
南师大，苏大和华中师范大学的学科语文选择哪一个比较好？,建议留在南京，南大招研会偏向江苏。
华中师范大学这次开运动会晚会(2016.11.3)你感觉怎么样？,作为一只即将毕业的大四老学姐，发自内心的说这是我在我师看到的最high的运动会  感想就是，我为我师自豪，还有呢，年轻真好，哎古
华中师范大学文学专业辅修历史好吗？,作为历院12级学渣一枚，愿意说道说道自己的陋见。上大一大二的时候，专业课上我和几个来自不同院系的同学曾经接触很多，令人失望的是他们大多是抱着一种得过且过的态度来辅修的，基本上不怎么来听课，考前问我要重点，我曾经一度怀疑他们是混证来的。题主若是对历史感兴趣并打算往这方面发展，建议辅修（你知道历院还是有很多大神老师的）。但若是单纯地喜欢，建议马上打消这个想法，因为文院的课业任务远比历院多的多的多！！！我几个辅修中文的同学已经被累成狗两年了。所以，建议考虑长远一些，就酱紫。
华中师范大学和湖南大学怎么选？,理想与现实的利与弊你已经分得很清楚了，如果你家不愁钱，学心理吧，愁钱，学金融。这还不好选择吗！心理学起来很有意思，但学的人太多了！转系不难，看个人能力。辅修双学位也没多难的要求，你也可以辅修武大金融，比湖大的好！
备选：兰州大学 ，北京林业大学 华中师范 中国海洋大学 成绩高出一本104 ，那么哪个大学更好一点呢？, 文科果断华师，中海北林看专业，兰大的优势在于是比较好考的985，保研名额多，考研出国也占优势。综上，文科华师，毫无疑问。理科中海洋，985而且地段还不错。想去北京的话北林，求稳的话兰大。 
【考研选学校纠结】本科不出名211，信息管理。想考情报学的研究生。1.中山大学2.华中师范大学？情况见下：,大家都没答在点子上~~~我先留个位，等晚上有空再来细讲。  一年以前考过华师，算是没怎么背书复习就去考的吧，我是一直到了大四开学才正式把专业课提上日程的。大三下都在“假装看英语”为了过六级。（后来低空飘过）最后就因为信息管理学实在太渣连100分都没有，国家线因此少了几分连调剂都不行收场（我英语当时没怎么做真题，只做过之前一年的真题，作文还没看，最后成绩还过线几分，真的觉得挺好笑）。相比之下情报分析方法那门，刚好我大三遇到了我们信管专业的一名老师（硕士华师信管系，当时还是系不是学院，他是信息经济学的，博士武大信管的管科），他刚好用了华师那本分析方法作为信息分析的课本（后来他还提到编者有一个是他老师），是他让我尽量考更好的（我当时只想考华南师范，因为广东的话还有中大但是太难考了所以只求有书读有学问继续做的机会而已）我就当时自己看书然后抄抄写写，记住一些重点。最后那门课，这么说吧，我当时有一些连书都没看完，空掉的那些都有二十分出头了，最后也有一百二十多。情报分析这门课吧，如果你有看过这些年的试题，真的大题都“都跟书本有关，但都不全，甚至只是字眼来自书本”这样的局面。我觉得这是一个好事，至少让你如果真的有关注的话，会有很好的发挥余地（碰巧情报的东西，如果是真的写起来看得出你是有看过别的东西的话很明显的，因为一般来说，不是对情报学很醉心的人不会整天去看那些情报学论文，观点）。刚好大三下学期开始跟着另外一位老师做实证研究的项目，就是要搜集各种数据放到SPSS分析，可以说情报类以后你不编代码都是这个路子（当然用AMOS更好，只是模型要做的很好，否则结果出不来你就等着论文没办法完结或者推倒重做），所以当时对于做综述是有一个过程的，因此答论述题写起来比较得心应手（虽然现场发挥可能逻辑不是很完善）。因为我没过初试，没去复试，华师只要过线都能去复试，但是会刷掉很多，因为情报名额相比图书馆或者档案会多一点，但是也不可能全收的。  再说到学校选择，情报学，你本科信管吗？如果不是，或者是，如果你以后确定要考专业技能找工作，情报真的很难给你带来很直接的就业机会（图书馆这种需要考事业单位的我暂时不在这里提及）：你会编代码吗？或者你以后愿意从事码农工作吗？不愿意的话就只有一条路了：去互联网公司做那些用户调研或者数据运营这一类，看公司，有的测重算法，那么还是码农，有的测重业务运营，那么就算对路。你说到985+博士点+不考数学，我记得好像是没有的。中大情报没有博士点并且要考数学，华师反而有博士点。但是说真的，这个小众学科，也就那么几个学校可能读起来会好些，哪几个比较好的我想你自己可以去搜一下。图情人对于中国图情现状，至少学校的现状要有所了解。  所以，与其说学校的名头，你最好想一下，你以后如果要靠情报学就业，那么你要学到的有哪些，情报太小众，又不算“显学”（比起图书馆学还是好一些的）。如果只是为了学校名头，那么只能考那几个985了。有人提到华科，明显就不是咱们这一行的。武大我记得好像刷过分很高的。暂时就想到这些，想到我毕业运回家里那一堆情报学的论丛类书现在很少派上用场也真觉得罪过~~~
如何看待范冰冰在武汉华中师范大学宣传新片被劝离？,华中师范大学位于桂子山下，与武大珞珈山隔珞瑜路相望，乃百年名校。“学为人师行为世范”，冯小刚借百年师范名校炒作，实乃下作之至。
有华中师范大学的教育类专业的硕士研究生吗，本人想考17年华师的教育类专业，有很多不懂的地方?,加油~加油~ 我也是打算考华中师范大学的研究生的，专业…教育类，具体方向待定吧(ㅍ_ㅍ) ヾ|≧_≦|〃不过我是2018年考研的o(●´ω｀●)o
华中师范大学的中外合办专业是怎么回事？,华师中外合作办学是教育部认可的，有2+2和4+0两种模式，分别是学前教育、生物科技、社会工作三个专业，如果选择4+0模式，在国内四年由本校教师授课，也有外方教师来校授课，大学毕业只能取得华师毕业证与学位证，而2+2模式除此之外还可获得合作大学的毕业证与学位证（前提是通过相应的雅思考试并在大三和大四在国外学习两年达到外方毕业要求）。   有问题的记得私信我，评论有时侯不提醒！有时候私信太多，只能回复排在前面的，不能一一回复哈！但是尽量！  啦啦啦，这就是本部毕业证啦！所有本部人毕业证都一样！ 
华中师范大学专业课挂了一科还能去武大辅修吗？,专业课挂科是不能辅修的呦同学，最起码大二是别想了，你可以大三试试，不过机率不高，还有，从北门到武大教五可有段路要走，每个周末早上七点起床想想脑袋都要炸
有一个华中师范大学的女朋友是一种怎样的体验？,华中师范大学相传着“爱在华师”的不朽传说，因而里面的妹子也算是当之无愧的主角，我是14年毕业于这里的研究生，很怀念学校的烂漫时光。  华师的男女比例达到3:7，也就是美女遍地开花，而且华师是一所师范类全国一流大学（目前第三），妹子的质量相当高。华师9月份的校园主干道上到处都是桂花的飘香，每年6月左右到处都是妹子拍照毕业的美景，华师的文化因素包含桂花，是它的校花，内设建筑都很有文化氛围（桂苑宾馆、桂香园食堂、桂苑之声等等）  华师是百年老校，时刻散发着古老的学术气息，有“仙气”的校园文化，那里三个校门都有地铁（广阜屯），来去都很方便，因而想认识那里的妹子，大门也总是敞开着，至于你是否有能力征服她们，就见仁见智了。  如果你的女友是华师的，你一定很幸福，而且你很有面子！
西安交通大学的文科和华中师范大学相比怎么样？应该选学校还是选专业？,你是相当大学老师还是中小学老师？前者去西交，要博士学位和海外经历，很难。后者去华师读师范就好。
华中师范大学的教育学研究生怎么样？,本人即将去学，好奇观望中
中央民族大学和华中师范大学 新闻与传播专业考研选哪个？,都不要选，考新闻做啥
华中师范大学中国农村研究院？,感觉就业面不是很大。
华中科技大学、华中师范大学、中国地质大学(武汉)和武汉理工大学MBA差异？, 谢谢邀请  武汉MBA 前三甲 武汉大学 中南财经政法大学 华中科技大学。 
如何评价华中师范大学圣诞节强制查寝不允许学生外出，这是否属于限制人生自由？,我们学校也是，简直奇葩的让人意外！
如何看待华中师范大学某社团关于发放作家大冰赠送苹果一事?,谢邀，我爷爷活了93岁，
如何评价华中师范大学的学生选课系统?,闪电般的系统 
考研想考华中师范大学思政，想问武汉和华师怎样？本科普通二本，三跨！理想当老师。请各位大神给点建议。？,楼楼有经验了嘛，求分享
华中师范大学到底是不是985？求求求大神！?,这个需要问？？不是。985创新平台≠985，锻炼下信息搜集能力吧。。
本人想考华中师范大学历史专业的硕士研究生，有什么好的建议吗?,华东师范大学近代史硕士研究生专业课指定用书，请大咖们指教！
我是湖北美术生想考华中师范大学教育学需要多少分？,呃，虽然我是华师大的，但我是华东师大啊！
每年华中师范大学文学院有夏令营活动吗？,没有
华中师范大学的347应用心理学书目是什么？, 应用心理专业为347心理学综合；   张老师推荐   【重点科目】  1．《普通心理学》，彭聃龄，北京师范大学出版社。【第四版，全部14章】  [美]理查德·格里格，[美]菲利普·津巴多 著；王垒，王甦 等译《心理学与生活》，人民邮电出版社，2003年版  2．《实验心理学》，郭秀艳、杨治良，人民教育出版社。【结合其他科目出设计题】  3．《社会心理学》（第三版），侯玉波，北大出版社。【金盛华老师的书作补充】  4．《现代管理心理学》（第四版），程正方，北京师范大学出版社。  5．《发展心理学》，林崇德，北京师范大学出版社。  6．《变态心理学》，钱铭怡主编，北京大学出版社。  7．《心理咨询与治疗》，钱铭怡，北京大学出版社。  【次重点科目】  1．《人格心理学》，美Jerry M.Burger著；陈会昌[等]，中国轻工业出版社。  2．《现代心理与教育统计学》（第三版），张厚粲，北京师范大学出版社。  3．《心理与教育测量学》，郑日昌，人民教育出版社。  4．《临床心理学》，王登峰，人民教育出版社。   距离17年考研90多天倒计时，需要模拟测评和大纲的同学可以私信张老师~     
中国政法大学和华中师范大学哪个好？, 中国政法大学。  法学走遍全国都不怕。 
上海大学与华中师范大学的比较?,顺着过来的  从名气上看，华中师范大学，211工程，985平台，教育部直属师范大学。到问题就在于他挂了个师范两个字，非师范专业就有点尴尬。上海大学是新兴211院校，势头很猛。  从资源上看，上海大学，地处上海，社会资源充足，而且最近几年上海大有倾其所有发展上海大学的意思。听说二军医都要给上海大学了。华中师范，教育部直属大学，资源充足，城市相对差点，但也不多。发展的话，无功无过吧。  从专业上看，华中师范大学，9大基础学科加上教育学，都比上海大学好，没什么可说的。其他的发展一般。上海大学偏应用，属于应用类大学，而非学术类大学。  从学校风气上看，华师传统，守旧。上海大学，活跃一些。  综上，报考教育相关和师范类专业，华中师大肯定好于上海大学。报考其他专业，综合城市与具体专业发展进行选择。  【个人意见仅供参考】 利息相关：寡(华)妇(中)屯师大在读。
是考研本校华中师范大学好还是保研去东北师范大学好，教育技术学专业？,东北师大是不错的，如果对考研感到比较焦虑，保研也是很好的选择啊，可以感受几年北方的生活。但如果想在华中师大那边就业的话，还是要选择本校读研，为了以后吧。个人意见。
华中师范大学金融硕士毕业之后一般去了哪里发展？,  经济管理学院2010届硕士毕业生就业工作汇报-华中师范大学经济与工商管理学院     我也在找，目前只看到这个~~ 
想报免费师范，华中师范与西南大学的哪个好？,谢邀 这两个学校我都不了解，所以没有办法帮你。 但是我可以给你一个建议，大胆走自己想走的路，年轻就有无限的可能，就算本科不满意，还有考研呢。
北师大研究生院珠海分院和华中师范大学，选哪一个？,来珠海吧。毕竟北师大。招生时间不长 所以分数不高。性价比很高的。
加入华中师范大学科幻协会是怎样一种体验？,       我是华师10级的，我没加入过科幻协会，不过我大一大二的室友兼死党黄皓是科幻协会的，好像还当过副会长，在他的带领下，我成了一个伪科幻迷，所以算是有一定了解，这里便来谈谈我对科幻协会的看法和一点设想。        与九州、奇幻类似，科幻也是属于一小部分人的，“铁甲依然在、天驱永不灭”、“生生不息、繁荣昌盛”，如果你会心一笑，说明便是同道中人。        上大学前，我没看过科幻小说，感觉最瑰丽烂漫的大概是《诛仙》中的奇幻世界了，什么青云山、滴血洞、天琊剑、痴情咒……后来看到黄皓的藏书中有一套《三体》，便拿起来一翻，这一翻就翻出了一个更加光陆怪离、天马行空的科幻世界。      《三体》带给我的震撼是不亚于《诛仙》的，不过话说回来，看《诛仙》时我才初二，知识匮乏，眼光狭窄，连摩天大楼都没见过，所以《诛仙》才印象深刻，它就像一面镶嵌着钻石的华美镜子，将惨绿少年荒凉的童年照射得纤毫毕现，所以才疯狂地爱上里面的人物。而看《三体》时，毕竟十九岁了，各方面还是提高了不少，所以那种震撼才更加深入灵魂，仰望星空，似乎那里不再是冰冷冷的一片苍茫，而是有着无数的文明在孕育、发展、繁荣、湮灭……        还是转入正题，谈谈科幻协会吧！        前面说了，我没加入过，当时我虽然看了《三体》，但更多的时间精力被足球、实况、奇幻、课本所占据，加了个文学社团，去了两会就没去了，因此当时也没想过加入科幻协会。因此，我只能谈谈我设想中的科幻协会。      1、志同道合、兴趣为王。小众，很大程度上意味着忠诚，凝聚力强，这一点要大力发挥出来。比如可以效仿玫瑰十字会、共济会之类的组织建立纲领、暗号之类的。      2、拥抱想象力，激发创意。想想一群人围坐在屋顶上，面对浩淼的星空，畅想未来的场景吧。      3、主题研究。科幻下有很多次级标签，比如“机器人”、“人工智能”、“星际迷航”、“三体”、“基地”、“蒸汽朋克”、“赛博朋克”、“环形世界”等，可以围绕这些主题展开活动，比如研讨会、小说及插图征集比赛、小型沙龙等。      4、协会会刊。这一点我认为是很有必要的，即使无法做到一周出一刊，一月一刊，甚至两月一刊也是可以的，里面可以收录会员的科幻随笔、随想、短篇小说、科幻插图、电影及小说鉴赏或者读后感、会员感悟，甚至是会员中的八卦，诸如此类。      以上就是笔者对科幻协会的一点设想，一家之言，仅供参考。      最后推荐一些本人看过或者想看的科幻小说：    《流浪地球》、《北京折叠》、《发条女孩》。 
对文科女而言，东北师范大学，华中师范大学，中国海洋大学，南京师范大学，山东大学威海分校对比如何?,保研率有11％，是山大从济南那边划过来的名额，但是比例还是比济南低一些的，不过保去的都是很好的985/211大学
华中师范大学对外汉语考研的相关问题？,呵呵，考研是为了更高的眼界，能过硬的专业知识，人越往上走，境界就不一样，结识的人也会不一样。绝不会停留在有没有人要这等俗的问题之上。我若盛开，清风自来。
本人，大三，女生，普通二本师范大学，想考华中师范研究生，家庭条件不好，应不应该继续考研？,针对问题 1能贷款就贷款，现在投资自己，回报绝对不是这几年花费10w左右能替代的 2能有饭吃有衣服穿就够了，不要眼光太短，愧疚一阵子总比愧疚一辈子好，我觉得还是多读点书以后日子肯定好过很多。 3读研之后，还可以留在华师当大学老师。不一定必须是高中老师。更高的平台才有更多的机会，更高的山峰才能见到更多的风景 4我觉得，真的努力到了，还是应该能考上的，不过，我也不能确定，因为，不可能你每天都是最佳状态的学习，还有其他很多原因，反正最后你自己负责你自己。讲道理，最重要的东西是未得到和已失去。我觉得，未得到给人的遗憾比已失去还要让人不甘心。  我还是建议你去考研的，如果你心里是想考研的话。 因为就算失败，也是为自己的理想而奋斗，不算遗憾， 假如成功了，就是到另一个平台，给你带来的好处，绝对不止是求职时候多的那几百块钱工资，带给你眼界什么的好处简直说不清楚，有些东西，你不进一个圈子是不会知道的，能进入一个好的平台，会带给你很多机会，真的。人生的选择还有很多。谁说就一定要当老师了？世界这么大？不想去其他国家看看？还有这么多语言？你会几门？以后有孩子了，你是难道不希望自己知识素质经济 越高越好么，这样才能提供更好的教育。 退一万步，就算研究生出来工资高不了多少，甚至研究生期间也没有好好努力奋斗，但是，光是这个圈子对你的影响，就已经能够给你带来很多好处了。 不要想着打工挣钱，以后几十年都得打工呢，急什么，不差这几年，你研究生期间课很少，自己可以去做很多工作的，也是很挣钱的。  读了大学的人应该知道读大学带来的好处，读了研究生的才知道研究生的好处，。 不要去想能不能考上，不自信的人，做什么事情都不会全力以赴，谈何成功呢呢呢呢呢呢呢呢呢呢呢呢呢？？？？？？？？？
想跨考华中师范大学的心理学研究生？, 不知道你英语四六级都过了吗？如果没有的话，趁着刚大二还来的及那就好好学学英语，而且英语好真的是一件终身受益的事儿。  其次就是先买一本普通心理学看看自己能不能读的进去，书本上的知识能不能理解。  如果自己之前学过心理学的一些知识，那么理解起来应该没有太大问题。  其次把华中的书单给你：  1．《普通心理学》，彭聃龄，北京师范大学出版社。【第四版，全部14章】  2．《实验心理学》，郭秀艳、杨治良，人民教育出版社。【结合其他科目出设计题】  3．《社会心理学》（第三版），侯玉波，北大出版社。【金盛华老师的书作补充】  4．《现代管理心理学》（第四版），程正方，北京师范大学出版社。  5．《发展心理学》，林崇德，人民教育出版社（第二版）。  6．《变态心理学》，钱铭怡主编，北京大学出版社。  7．《心理咨询与治疗》，钱铭怡，北京大学出版社。  8．《人格心理学》，美Jerry M.Burger著；陈会昌[等]，中国轻工业出版社。  9．《现代心理与教育统计学》（第四版），张厚粲，北京师范大学出版社。  10．《心理与教育测量学》，郑日昌，人民教育出版社（第三版）。  11. [美]理查德·格里格，[美]菲利普·津巴多 著；王垒，王甦 等译《心理学与生活》，人民邮电出版社，2003年版  有的书是学校没有给的，但是它的真题有涉及的，所以还是要看看，  有什么问题可以在评论区问我，也可以直接给我私信 
华中师范大学为什么赶走范冰冰?,我信我师，被拉去炒作也就罢了，还要背锅被骂。 
华中师范大学的寝室是自己选择还是学校安排？,不完全由自己选择，每个院先从宿管中心分配到具体楼栋和房间范围（一个院的一般都在一起），然后院里再按照专业分配房间和床位。你所能选择的宿舍也就只是在本专业可选范围内的房间和床位。
华南师范大学与华中师范大学哪一个好？,首先从中国师范大学的排名来说，第一是北师，第二是华东师大，第三应该是华中师大   艾瑞深中国校友会网编制完成《2015中国大学评价研究报告》 中国师范大学20强     排名仅供参考  不知道题主所在地区，如果在广东，根据地域优势，华南师范的就业影响力并不会比华中师大小多少。 一般来说，华南师范的录取分数要略低于华中师大。  华中师大排名最好的专业是思想政治教育。  本人是华中师大马克思主义学院的大一学生， 入学将近一年，对华中师大的印象还是很好的。 当初理想志愿是东北师大，但因为自己在东北地区，东师较热门，分数差了几分，华中师大则因为距离较远，所以分数有了优待，后来也很庆幸，毕竟华师的整体实力要强于东师，自己现在学得专业也很好。  希望对你有帮助。  Ps:华中师大为教育部直属，华南师大为广东省直属，这点在就业时还是有点区别的。
华中师范还是东北大学？,华师的全国排名可是排在东北大学前面，一个是一流大学—华中师范大学、师范类排名第三、211；另一个是知名大学—东北师范，师范类排名第四，还不知道是不是211，你说选哪个？ 正常人你说选哪个？
18考研想知道华中师范大学学科数学往年的录取比例 ？还有333教育综合是学校自命题吗？, 同学，报录比学校是不公布的，这个哪里都查不到。333的话，是自命题，不会完全依据考试大纲来~  如果有更多的问题，可以咨询优加考研，官方QQ1422321743。优加考研在华师师大教育学方面的资源还是很丰富的，包括和华师的教授也有合作~ 
如何进华中师范大学历史基地班？,只要高考压线基本就能进基地班，班是好的，但从不被人看好……
心理学考研，哪些学校是自主命题，特别是天津师范大学，首都师范大学，西南大学，华中师范大学这几个学校。？,目前来看，除天津师范大学是统考其他都是自命题的。 西南大学和华中师范大学是15年刚刚退出统考的。除此北京地区已全部退出统考。 参考书目上来看华中师范大学复习参考书还包括《心理学报》 西南大学基本和统考一致，但是要看黄希庭的《心理学导论》 至于首都师范大学不指定参考书，考试内容包括：普心、实验、人格、统计、测量、发展。 
华中师范大学宿舍的长相？求图。？,  室友书桌  寝室小阳台  当然刚入学时肯定都是这个样子的 军训时检查卫生的一个标准就是看起来没有人住^_^   对面宿舍楼 有空调 感动的泪水T_T  补图 
