报考重庆的大学之前应该了解什么?,同为广东的学子，重庆大二在读。  强烈推荐大家来重庆读书！！！     最近读的一本书《理性的繁荣》:生活质量才是经济发展的重要因素，因为适宜居住之地，才能吸引生产效率更高的人群。   重庆，这个地方。  1.地质安全，治安稳定  地质专家曾经来看过重庆的地质，地址结构非常稳定，所以比四川会安全。   治安也不错，虽说没有前几年前任的薄市委书记在的时候那么好，但我们喝个酒半夜还是敢在大街上走的。    2.立体  山城，楼梯多，长坡多，但作为一个现代化城市，电梯自然也多。来了这边，你会慢慢习惯走坡的惬意~ (哥们来玩，发个朋友圈，你问我来重庆的第一印象是什么。。。楼梯，楼梯，楼梯    重庆的公路修建受到诸多限制，修建难度大，路都比较窄，。所以很容易堵车！  重庆不太适合坐公交车，城市太立体了，起伏比较大，而且比较堵。(别人学校的重大电瓶车叫小绿，我们学校叫小飞车，那起伏，吓死宝宝了，2333)  所以只要目的地不是距离轻轨太远(三站路都不远，走路习惯了)，绝对首选轻轨！绝对！ 重庆的轻轨设计还是很人性化很方便的，连接各大商圈和重要城市景观，以及居民区。 （校门口的轻轨）        3.遍地是美食  辣椒和花椒是主角。 高中校友就读于西政，完全不吃辣椒，大二寒假回家，默默发条朋友圈好想吃辣椒。      校外，小面  ，酸辣粉，串串，火锅，冒菜，口水鸡，两江双椒鸡，麻辣干锅。。。各种美食    校内，每个高校辣的不辣的都有，石锅拌饭，鸡排牛排也有，基本可以满足你的需求。(我觉得这边吃饭不便宜，可能是因为辣椒，花椒，油调料比较多吧。) (放两张我们学校的异国风情美食，呵呵，石锅拌饭，真的只有饭)    喝酒，这边山城的国宾啤酒基本是垄断的，也比较贵，6块一瓶。出去吃饭基本是喝酒，而且这边喝酒会比较凶~这不是开玩笑，这边出来聚个会不喝酒，简直就是开玩笑，而且喝啤酒的氛围比较浓。(像我们这种大学上来才喝酒的人，真的是被这边的同学吊打。。。)    4.发展前景  很多的新闻都报道，重庆未来的发展会越来越好，和新加坡合办的工业区，江北嘴金融中心，两江新区的发展，重庆机场的扩大。。。国家会越来约重视西部的发展，毕竟重庆是唯一在西部的直辖市。      5.人文素养  很多人说重庆不够干净，街道脏。私以为这评论过于片面。 中心城区一大部分都保留着山城的原貌，固有的民风，老一辈的人生活习惯上会有着不尽如人意的地方，这是城市发展的必经过程。 不能因为上海繁荣就嫌弃重庆落后，谁没有个过去。  重庆这个城市像个暴发户，经济上来了，但是人文精神方面还有很多的缺失。 这个城市缺少点文化的底蕴。 市民会很直爽，也会很大大咧咧。但这都是一段过程，我们更要看着这座城市的生机与活力。若城市更重视一个城市的文化建设，引导市民多读书，提升文化修养会更好。(别吐槽我，我知道这个叫通病)  说这边人脾气比较暴躁，呵呵，也不看看这边的娃吃什么长大的。(hhh....)   6.天气  夏天会比较热，有的时候38℃走在外面很闷，很热  冬天，没有暖气，也不会下雪(表示很不开心，我22号离开重庆的第二天，主城区20年一遇的雪下了，今年太冷了)。 冬日里比较少见阳光，宿舍买个烘干机比较好，否则衣服难干。  这年头宿舍，课室，商场都有冷暖空调，怕冷怕热都不再是问题，所以被子要不要买那么厚，去学校看看宿舍什么样再决定。  很多人来了重庆会养白(上了大学的我变白了) 古有成语，蜀犬吠日(字面理解是蜀地阴雨天多，晴天少)。重庆雾气比较大，紫外线会被削弱，不容易晒黑(自己作死我管不了)。   7.重庆的大学  (高校排名别太信，也没什么意义。 举个例子，并没有要黑别人。上海对外经贸学院原本只是个财经类排名中等的院校，近年来，改名大学。2015在广东收分立马比肩其他前五财经类院校，于是乎，其排名随即杀进财经类院校排名前二十。院校分数会出现大小年现象，所以院校的排名也每年有变动。 当然提升院校实力才是王道。排名还看院校规模 综合类院校规模＞理工科＞文科，上一张今年的)   (1)去哪都是靠自己，我舍友都打游戏，但我照样在宿舍可以自习看书。 (2)好的学校给的是好的环境，好的人脉，就是资源比较好，平台比较好。去好的学校，就相当于站在巨人的肩膀上。   个人觉得普遍投入不足。和东部比很吃亏，毕竟穷。 只要有钱，重庆的高校都！可！以！被砸成全国重点，就看政府，教育部愿不愿意加大投入。   重大211 985，资料太多，一个好字贯穿一身。  西南大学(位置比较偏远，但也有轻轨站，到市中心要一个小时，和重大一样，但是到区里的商业中心也就一个站，北碚区可以满足你的所有需求)211。   西政 (法律界的黄埔军校，现在的高院院长周强就是来自这)      第三军医大，重庆医科大  医科很强，不行的可以自行百度医科类大学排名。  川外 外语很强，妹子很多，很多语言考试的唯一考点 靠近白公馆，渣滓洞红色旅游点，老校区西政在一起。  川美 美术学院，漂亮，美术界很多老教授在此。   重庆工商(重庆唯一财经类大学，发展速度很快，学风建设越来越好，妹子也很多，质量的话因人而异吧。重庆金融学院，长江中上游经济研究中心在这)轻轨站就在校门口，两站轻轨就是万达广场，七八站轻轨站就是解放碑。 都是女生很多的地方。 (工商的山上看下去)     重庆交通大学(交通建筑很强，来了重庆你就会感慨，为啥重大，交大建筑这这么牛。这些桥梁设计，建筑设计，轻轨设计打洞穿山，你当开玩笑的呀！)校门口也是轻轨站，比工商到商圈多两站。   重邮，有些学科还是很强的，计算机，大数据实验室很强，但是交通很不便利，在山上，和尚下山不容易。 (距离南山一棵树观景台很近，是个拍照装逼的好地方，这张照片把后面P了一丢丢，哈哈哈，后面是渝中区做背景，脚下是长江)    重理工，理工科学校，很费解其会计很牛而且还强过工商。位于巴南区，交通也不怎么方便。   重师，学科很全，也挺好的，女生也多。    8.交通  可以自行查看广州到成都和广州到重庆的票价。 去重庆和回广州坐飞机都是逆着人流每逢放假的时候基本都是打折的。这个寒假我从重庆回来，机票！290，过完年回重庆430。还是相当划算的”     9.旅游  重庆市内解放碑，朝天门，洋人街(我觉得只是个重庆很有良心，很有特色的游乐场，不用门票却很有规模)，十八梯，湖广会馆，磁器口，洪崖洞。。。   重庆周边，武隆天坑(爸爸去哪，满城尽带黄金甲，变形金刚取景地)，大足石刻，仙女山(冬天可以滑雪)，钓鱼城。。。  西去成都，高铁(G字头)154，只要一个半小时，觉得贵了可以坐动车(D字头)98。 在学校可以报名九寨沟的旅行团，600三天。 东去武汉，轮船可以游三峡，一直坐到宜昌的三峡大坝。 西部的高铁和高速公路网愈发完善，去各地游玩都会很方便。   10.LOVE  放在最后写，有种彩蛋的赶脚，哈哈哈。  重庆美女多，全国有名。 当然也别想着满大街都是长腿白嫩的美女，那不是重庆，那是妓院。 我说的是平均颜值，谢谢。 起初不觉得，后来回了广东确实觉得，两地的颜值不是一个档次。  GAY都   这个图不知各位是否满意。。。  帅哥，也多，没错，重庆就是三多！哈哈！  你是什么，重庆便是什么。 你有光明，重庆便不黑暗！  重庆延时拍摄《韵律重庆》，这个地方，值得你爱   http://  v.youku.com/v_show/id_X  ODQ1MDYzNDA0.html?x      
四川大学经济还是重庆大学建筑？？,重大有空调，自己选吧
如何评价重庆大学 4.29 学生砍人事件？,我不知道该说些什么，在准备写下这篇回答的时候就已经做好了被折叠或者被和谐的准备。   两名受害者已经确定一死一伤，死者是我从小一直玩到大的同学，关系最好的基友之一，大家的父母也都是很好的朋友。早上在父母那里得知这个消息时，最开始我仍处于半梦半醒的迷糊状态，直至听见电话那头父母用近乎颤抖地声音告诉我他被人在寝室行凶刺伤之后，一下就从床上弹了起来，然后匆忙打电话向我们共同的好友，同样在重大就读的另一名同学询问情况，最终获悉：行凶者挥刀砍向两人，其中一人受重伤，另一人，也便是我的好友，当场死亡。   我哽咽了很久，不知道该和电话另一头的同学说些什么，心中除了对好友的悲痛和对行凶者的愤怒，同样也充满了后悔，后悔自己五一没有选择去重庆找好友而是选择了留在学校。如果时光可以倒流的话，我说什么都会选择去重庆找他，把他带离寝室，无论是去图书馆，是去聚餐，是去网吧，甚至于去学校操场上闲逛，只要能在那个时间将他带离那个成为梦魇的地狱，可能好友现在依旧会和我像往日一样在互相吐槽和扯淡。   学校的通稿和官方发布的讯息我都看了，很遗憾，目前为止，贵校选择压事实，将真相闭而不发的做法很令人寒心。事后有人可能会说是消息滞后和工作时间的原因，但是事发时间是二十九日上午，到现如今差不多已过去三十几个小时了，然而贵校和相关机构却一直将消息发布仅限于受伤和医治，对外宣传统一口径的做法让人误以为两名伤者都已被抢救回来了（评论区有人说学校官方没有明确说明此事，但是就我写回答时的情况，微博，贴吧还有知乎上很多人都说两名受害者被抢救回来了。如果说当时的这种舆论情况也要被予以否认的话，那抱歉我只能说我可能上了假的社交媒体）。然而我个人亲身经历的情况是： 受害者的父母家人和亲朋好友已经陆续赶赴重庆，在冷棺中见到了已经和我们阴阳两隔的他。  今天一整天完全都陷在了这件事当中，即使闭眼脑海中也全是过去和好友共同经历过的画面。在我的印象里，知乎大体上算是一个追求客观，理性和公正的平台。抱着尊重逝者的态度，我无意去推波助澜整件事，但是，有关方面对此事的处理态度和方式，实在是让人愤懑不平。贵校选择冷处理有贵校自己的想法，想必是不希望学校声誉因此受到损害。但是这样做能否不要以牺牲受害者家属和亲朋好友的感受为代价？能否不以瞒报或缓报事实的做法来实现目的？能否最终给所有关心这件事的人一个完完全全还原事实的交待？  如果凶手不是精神病，希望法律能将他绳之以法，让他得到应有的惩罚；如果真的是精神病患者，鉴于这样的人对社会危害程度过于巨大，希望能让他在有关机构生活一辈子，谢谢！CQU贵为985和老牌名校，一直久仰盛名，但如今的种种做法却真的令人感到遗憾。今日借知乎这个平台，真心希望校方和有关部门最终能将整件事妥善处理，不要让广大仰慕贵校和关心贵校的人心寒。
重庆大学专业？,泻药！重庆大学。。。很不错呀！ 理论上工科是比较好找工作的，重庆那边不是特别熟悉，不清楚重庆大学最厉害的是什么。现在大环境下的互联网和金融还是很不错的！
上海工程技术大学和重庆科技学院哪个好？,看以后发展在哪里。 毕竟都不是具有全国影响力的学校，所以。。。选以后想留下的城市的学校吧
北京考生，有机会上吉林大学和重庆大学，但在北京选学校只能选首师大等学校。是否应该走出北京？,看情况，如果你想出国  深造  建议出京读985 如果仅仅想将来在北京找个过得去的工作，可以考虑北京普通一本。  说说志愿填报和职业规划的心得  一般来说决定专业（职业）“含金量”有5点  1、学校：同样的专业不同的学校差别是天上地下的  2、地域：同样的专业就业地域不同差别也是天上地下  3、个人综合素质  4、学历 整体来看  学历越高收入越高  5、行业 比如同样学中文的  进互联网行业做编辑和去传统媒体做编辑待遇差别也很大  所以不是选个“好专业”就万事大吉  选学校选专业这事说简单也简单（半小时都不用），说复杂也复杂（可以是一门课）  这个问题和跟很多因素都有关系，就看你看重哪个因素了。一般来说填报志愿最要注意三点，重要程度不分先后，因人而异。  1、城市（地域）：学校所在地城市对视野开阔，提高综合素质，特别是就业和保研有着重要的决定因素。为什么北上广成为就业地首选？为什么北上广部分211甚至一本也比部分外地985录取线还高，不就是地域优势吗。在北上广你可以获取更先进的理念，更广阔的视野，尤其是更多更方便的实习和保研机会。学IT就业地首选北京（其次是深广杭），学金融就业地首选上海（其次是京深）。  2、专业（地域）：如果你以读个好专业为第一目标，那么就不一定把目光放在北上广了。比如吉林大学的车辆工程，电子科技大学的信息工程，西南财经大学的金融学，山东大学的数学等专业都名列前茅，且分数不是太高，可以成为非北上广的选择。  3、毕业后的打算（未来规划）：这个容易被忽略，如果你毕业后考虑保研、出国、考研等，考虑综合类大学，偏远地区的985考研成为选择之一，比如兰大吉大川大等学校，这些学校的保研率和国外的知名度和认可度肯定比录取线超高的上财央财外经贸高很多。当然也要注意专业选择，理学基础类专业出国相对容易（数学 物理 化学 生化等）。如果想本科就业，那就选择专业性学校，比如财经类，工科类（特别是电子信息类）。两财一贸（上财央财外经贸）甚至南审、东财、江财、天财。两电一邮（成电西电北邮）甚至杭电，这类学校目前就业形势不错，起薪也挺高。  特别注意（理性看大学排名）：现在学校排名基本依据综合实力和学术能力等，有时候对部分本科就想就业的同学参考意义不是特别大。比如中南大学、吉林大学、山东大学、四川大学等排名很靠前（10—15），但是录取线却在25—35之间，为什么呢？因为这些学校门类齐全，比如文理法工农医都有，综合实力比较强，因此得分较高。但这些专业很多都是冷门，就业不太有优势，因此录取线不是特别高但排名很高。不过有一点害的还要注意，虽然这些学校录取线不太高，但优势专业录取线却依然很高，比如电气工程录取线为380分（江苏），机械工程可能才359分（江苏），所以不能因为最低录取线而轻视优势专业的录取线。  选专业这事说大可大（可以算是一门学问），说小可小（比如听邻居说谁学了什么专业不错就填了）。个人觉得虽然有那么一点点的运气成分，但如果想把握精确一些还是需要做一些功课的，可以划分步骤。  第一步就是了解有哪些专业（不一定都要了解，可以缩小范围在你感兴趣的范围内查询），这些专业大致学什么，干什么的。这里有个资料讲的有点参考价值。注意区分名字相近但其实差别很大的专业。   【选择专业】大学专业分类详解（非常非常重要！）（已发）     第二步就是确定方向（比如是财经 法学 管理等），确定这个主要依据几个因素  1、 本科是否就业：如果想本科就业，可以考虑实用性比较强的专业，比如会计、车辆工程、电气工程。如果是想深造和出国，可以考虑理学（指基础学科数学 物理等自然科学，大气科学等）这些专业相对来说申请学校容易些。  2、 个人秉性：比如如果热情活泼开放能吃苦可以考虑销售、管理类专业，如果内向，热爱技术可以考虑计算机 软工 电子类专业。女孩一般适合文科类专业，语言类也不错。  3、发展方向：比如将来想进高校研究所等，可以考虑理学类。  第三步了解具体专业（行业）  可以看看类似这种资料（知乎：不同行业的真实工作是怎样的）   不同行业的真实工作是怎样的？ - 调查类问题   我觉得做完这功课可以基本上对专业有个把握了，避免读了大坑专业，或者孩子完全不喜欢的学起来很痛苦还要转专业的专业（转专业也不容易的，不同学校要求不同）  专业选择铁律15条  人们常说一个人只有做自己爱做的事，才能发挥出真正的创造力，做自己不喜欢的事，学习成本和代价都是很高很高的。应该说，没有学不会的东西，只有学会这个东西付出的代价大小有区别。而人的精力和时间有限，选择好专业所以才显得特别重要。  (1)先排除你绝对不会想学的。你可以不知道自己特别喜欢什么，但一定得知道自己不喜欢什么，一定不要选择自己完全不感兴趣的学不下去的所谓热门专业，不要相信什么“不感兴趣无所谓，努力就好”这种鬼话。  (2)没有明确兴趣爱好，但是潜意识里想要赚钱，只想要毕业后赚大钱，那么从商这条路比较适合。分数理想自然想选什么选什么；分数不理想的话，选学校不如选地点，尽可能选择北京、深圳、广州和长三角地区。  (3)依据秉性选择专业，如果热情活泼开放能吃苦，可以考虑销售、管理类专业；如果内向、热爱技术可以考虑机械类、计算机、软件工程、电子类。  (4)注意专业的不可替代性：不可替代性越强，进入门槛越高，工资相对越高（比如技术类岗位，金融行业门槛比文职工作门槛高一些）。  (5)注意专业的就业面：技术性越强，就业岗位越窄，比如本人本科专业是发电方向，多数本科同学去了发电厂电建，有利有弊。  (6)注意专业的前景：现阶段与互联网+行业相关联的专业都有市场需求。比如技术岗（IT码农、物流专业、市场营销、策划设计类工作）以及嫁接在互联网上的传统行业等。  (7)要选择行业院校的对口专业，在一个农业工程学院你去读经济，在一个医科大学你去读金融，可想而知师资力量。有些学校就是为了吸引生源开设专业的，选择需谨慎。  (8)千万别因为一所工科院校是985或211就想着它文科肯定也不会差到哪去。差的很远，师资力量可能不差，但是氛围会和你格格不入。  (9)认清不同专业拼的是什么，看清自己。比如金融，拼的真不是基础知识，而是综合能力。家庭条件不好自己又比较内向的慎选。  (10)本科不要学太虚的专业。市场营销，人力资源，企业管理等等，没有会计实用好找工作。  (11)如果家里条件不是很好，打算一毕业就能找个好工作的，尽可能不要选择基础学科，大部分理科专业就别选了，太基础的就别选。  (12)家庭经济不是很好的可以优先选择能迅速回现改善生活的专业。  (13)如果学计算机，一定要去北上广深杭成！二线三线城市资源少，要啥没啥，几乎是互联网荒漠，很多大公司连宣讲会都不来，实习找工作还得去一线城市找。  (14)如果本科想就业，选择实用性比较强的专业，比如会计、车辆工程、电气工程。  (15)如果想深造出国，可以考虑理学（数学、物理、大气科学等），这些专业相对来说申请学校容易些。  以上为个人见解 仅供参考   
软件工程是重庆大学好还是电子科大的好？, 学校都不错，关键看自己学不学，顺便打听下考试就行； 
我想考入重庆大学 我应该做些什么？,竟然有文科生以重大为目标院校，太秀逗了。 西政哭晕在渝北大峡谷。
重庆大学研究生期间可以申请出国留学么？,那你直接出国读研不就行了 干嘛还要浪费时间在国内读研
请问你对重庆 邮电 大学的上网套餐和WIFI怎么看？,现在学校的套餐越来越丰富了，移动卡也可以购买无线网卡的套餐了，用联通卡流量管够，总的来说竞争加大了，电信虽然没有降价不过套餐的设置也够用了，虽然觉得价格还有点贵，但是还行吧。 首先现在可以不用买299手机，算是学生抗争胜利了吧 2.还是有合约期，提前取消会损害信誉，这个有点坑。 3.办电信卡可以通内网，内网ip上知网可以免费下论文，所以相对于其他网络还是电信划算方便点 4.流量较少，电信自带流量远远低于联通和移动，59的套餐只有5G的流量，而且大部分校园流量，对于用流量大而且经常下山的孩子来说就远远不够用了。寒暑假就更加不够用了！！！ 5.电信wifi，感觉只有在网上断网的时候比较有用，但是很多宿舍连不上wifi啊。平时上课有cquptfree，所以没啥用，反正从来没用超过。 6.话费，59套餐现在是有30块钱的通话费用，看个人情况吧，在寝室开wifi微信电话的情况下，长途的应用场景也变少了。 7.短信，电信基本没有短信额度，所以都是超的。 总的看，电信网还可以，就是什么时候可以降个价啊(ಥ_ಥ)
女生报考重庆大学什么专业好些？（专业实力和就业前景方面）?,经管&gt;电气&gt;建筑&gt;土木&gt;软件&gt;机械&gt;光电&gt;文新&gt;公管   个人排名，自行斟酌。
重庆大学工程管理专业的女生就业好吗？,好坏得看和谁比。 和本院男生比确实就业要麻烦点。 一般情况： 大四上找工作的时候，班上男生四年天天宿舍打游戏的那种，稀里糊涂去面几个中字头施工单位就招了。女生则找工作比较费劲，但最后都找的还可以。 特别情况： 房企一般招人偏爱男生一点，但跟施工单位比，男女比例协调一些。 但首先能保证在学院本科、硕士一起竞争的情况下胜出。  和全国范围比。大家都一样。
重庆哪个大学外语专业更好？,川外 這是一道送分題
中山大学和重庆大学的博雅学院学生的就业情况怎么样？,重庆大学排名应在11名左右，西南大学应在20名左右
