在中国地质大学(北京)就读是一种怎样的体验？,作为在地大北京待了四年并且将会再待三年的同学来试着回答一下。将从学习和生活两个方面阐述一下在地大北京就读的感受。 首先是学习方面。地大北京主流专业是地质及地质相关专业（露珠学的是土地资源管理，跟地质听起来还是有点关系）。整体而言，地大学习氛围挺好的。什么，你问我怎么感觉到学习氛围比较好！我是不会乱讲每到期末，自习室人满为患的盛况的，而且地大同学已经完全占领了旁边的麦当劳好么，考试前，你会看到旁边麦当劳全是拿着书复习的地大同学。就学术水平而言，地大强势专业如：地质学、资勘等师资力量非常强，国内首屈一指，当然，其他的如土地资源管理专业也很不错，据说全国排名第四。关于专业，不得不说的还有暑期实习。大部分地大的学生会经历一次北戴河实习和两次周口店实习，北戴河实习就是跟着带队老师看各种地形地貌，我不乱讲我们带队老师迷路的，哈哈。周口店实习参见夏新同学发的那个漫画，很经典。ps，实习的时候蚊子很多，太阳很大，学校会发一顶草帽，但还是要记得带花露水和防晒物品。 然后是生活方面。生活分为衣食住行四个方面。   衣  地大坐落于宇宙中心五道口，旁边有华联、易初莲花等，还有一些卖衣服的店面，比如地大西北门对面，挨着北语的地方开过一家衫国演义，不过现在没有了。总之，在地大，就算你不喜欢网购，也能在周边买到称心如意的衣服。  食 说到吃，首先肯定是要说食堂了。地大有学生食堂、教工食堂、清真食堂及家乡菜。学生食堂总共分三层，一二层是普通的食堂，价格算便宜的了，味道可以接受，露珠上学期特别偏爱二层食堂的拌牛肉和拌猪头肉，想到就流口水！三层食堂去年改成风味餐厅了，有麻辣香锅、米线、石锅拌饭、披萨等，露珠只觉得三层的披萨还可以，其他的···想到食堂三层我都不知道吃什么。接下来介绍教工食堂，教工食堂的周一到周五午饭不让学生消费，其他时间都可以，露珠强烈推荐教工食堂的早餐，真心不错，以前考研的时候，就盼着每天早上去教工食堂吃早饭了！大四下的时候，露珠还坚持每天早起，就为了去教工食堂吃早饭，去晚了就没了啊，衰，可惜只坚持了大概两个月，后来改在宿舍吃面包牛奶当早餐了。至于清真食堂，以前老的清真食堂露珠去过，新修了清真食堂之后我就没去过了，期待去吃过的同学来做回答。还有家乡菜啊，家乡菜一般社团或者班级聚餐的时候去，味道一般，那上菜速度，实在不敢恭维。然后是地大周边的美食。在地大北门往东走，有表里如一、西部马华、麦当劳和旺德福，露珠比较偏爱表里如一，大四下的时候，健完身经常和宿舍的小伙伴们去表里如一吃饭，值得怀念的日子。 在马路对面有一个成都美食，味道不错，价钱亦可，每到夏天的夜晚，总能见到地大同学和北语同学在喝酒撸串的身影。再往东走，就是到了小码头和雅嘉川菜了，有点远了，这里不再赘述，不过还是要提一句，雅嘉川菜的烤鱼买一斤送一斤，味道超赞！介绍完北门往东走，就该介绍北门往西走了，往西边有禾地饭店以及五道口的一大波美食！五道口的美食细数起来，一天都不够用的，露珠就说经常去吃的，有嘉和一品粥，没名生煎、华联楼上的一家米线，还有呷哺！当然，还有麻辣诱惑什么的，不过露珠不怎么吃辣，所以没去吃过。总之，不管你是什么口味，不管你吃甜粽子还是咸粽子，不管你吃咸豆腐脑还是甜豆腐脑，你总能在地大和地大周边找到你爱吃的美食！发现写了这么多，竟然没有提北语食堂，作为一个经常和小伙伴们去北语食堂三层吃饭的人，实在应该推荐一下北语食堂。北语食堂三层可以办临时卡，有各种套餐、米线、小火锅和麻辣香锅什么的，味道不错，比地大食堂三楼的风味餐厅好多了！北语食堂四楼还有漫咖啡，环境不错，具体可查找类似问题“在北京语言大学就读是什么感受”。  住  关于宿舍，本科宿舍是八人间，但也有更加苦逼的十人间，比方说2011届住在19楼的男生（还好露珠早一年上大学！）研究生宿舍是六人间。热水的话，除了学19楼和学18楼有自动开水器，其他的宿舍都需要自己去打热水。不过学17楼据说今年九月份就要投入使用了，给女生住，地大女生有福啦。另，地大旁边的宾馆不便宜，有汉庭、格林豪泰、如家、东源快捷、五道口宾馆、梦溪宾馆、如天霞、地大会议中心、北语会议中心等，如果有同学来玩，需要短租的话，还可以找小熊之家。  行  关于行，地大东门挨着城府路口南站，地大中北门距北京语言大学站约500米、距离城府路口西站约300米，地铁的话，当然是城铁13号线五道口站。总之，去哪里都还是很方便的。   第一次在知乎写这么长的答案，条理有点混乱，见谅。在地大生活了四年，发现已经深深爱上了地大，爱上了五道口，希望新学期读研的时候能更多的了解地大。 谨以此回答来缅怀四年大学生活，缅怀四年的小伙伴们。
中国地质大学北京转专业好不好转啊？,算是比较好转的 成绩能有中等的话，很多专业都能转成功。
中国地质大学(北京)的研究生好不好考啊？,医学类的学生考地质类的研究生几率有吗？
中国石油大学北京预科，哪些专业前景较好适合女生？,哈哈哈哈是学妹嘛～我现在应该是石油大学北京的大三，通过石大二加二的项目在加拿大滑铁卢大学，我在石大的专业是地质工程也就是现在的资源勘查工程（我也并不知道为何改名.... 首先亲爱的你要知道自己擅长什么啦，其实也并不是来了石油类院校以后就只能做石油工作，咱们大学还是挺流弊的... 如果是物理数学方面不错的话石油工程真的是很好的专业，但是石工唯一的问题就是以后研究生转别的非石油专业比较困难，如果是化学不错当然是化学工程啦（为何我没看到化学工程这个专业在图上 ... 然后因为我是物理数学残废所以上了地质，也就是资源勘查，这个专业除了实习要在野外看看大山大河和石头...，其余的真的很适合女生，因为有些偏文科和分析类的，不用太多数理化...（矿物学得好的话还可以向宝石鉴定发展发展哈哈哈哈哈 因为我家里就是石油大学的所以比较清楚咱们学校...有撒不明白的可以问哈石大欢迎你～！
中国地质大学（北京）创新实验班怎样？, 希望你没去，就是把你框在地大的一个垃圾班集体。 
中国地质大学分武汉和北京两地办学，有没有一个占主导地位？中国地质大学（武汉）的MBA专业如何？单证硕士跟双证硕士差别在哪儿？, 中国地质大学的前身是北京地质学院，成立于1952年，由清华大学，北京大学等几个学校的地质系合并而来的，地点就是现在的中国地质大学（北京）校区。到60年代中期，为响应国家领导人的号召，学校的部分师资，设备迁至武汉办学，而北京仅保留了一部分研究生教学工作。1978年北京校区恢复办学（但仅恢复研究生的办学，80年代末才恢复本科办学），更名中国地质大学（北京），武汉校区更名中国地质大学，两者均为独立办学实体，无从属关系。由于中国地质大学（北京）有十多年的办学断层（本科断层20年），而现在7，80年代毕业的基本上已成为行业精英，所以影响力不如武汉。  单证就是只有学位证无研究生毕业证，双证就是有毕业证和学位证，只有单证的话有的单位不承认研究生学历。 
为什么华中科技大学不和中国地质大学(武汉)合并？, 原因有这几点：  1、当年华科合并的时候曾经找过地大，但是当时地大是有两个校区，北京和武汉，合并的话势必造成大学的分割。  2、当年华科合并的时候，地大还是当年国土资源部下的第一大学，各种资源都倾向，自给自足。所以当时谈的时候就没谈拢。  3、最重要的一点，当年的华工牛逼哄哄，但是地大也是牛逼哄哄，在某些领域都是第一。所以谁也不服谁。合并后领导还不好安排。而且地大还有国字头，更不想放弃。  4、次要的就是地大已经向综合性大学发展，合并也就没意义了。华工当年合并的另外几所学校都是单一学科大学。 
北京大学地质系的科研学术水平如何？,石油方面和石勘院有联合培养，估计水平不低，不过也高不到哪去。 北大本校的本科，也就是靠着自己高考的先天优势了，后天的培养简直了…北大本科的教学水平在我老师眼里只有“呵呵”二字，还有他那些学生，仅从地质上讲，完全比不上两所地大中上等水平的人，白瞎了高考那么厉害。当然了，北大本校的人英语好厉害，还有他们的视野，远远地把地大这帮人甩在了后面。
我是地质工程专业的学生，想报考中国地质大学（北京）的研究生，哪位学长学姐能介绍介绍地大嘛?,据我在澡堂偷听研究生们聊天的内容哈，别来！有啥想不开的来地大北京啊，研究生工资低到接近没有了都，虽然每个专业不一样但是有的专业更可怕，第一年直接不发，第二年发了还要回去(这是我跟研究生聊天听说的)我跟你不是一个专业，反正我们专业的学霸们，特有理想的不是出国就是保外或者考，不知道你本科学校是哪儿，如果是一本及以上，能去好的就别来！你要是想以后读博什么的来来还是可以的，反正在哪儿都是做研究，要是有你看上的老师也行，反正有更好的选择就别来！ by一个无限后悔的本科生(可能因为是女生)
北京的三所大学，中国地质大学、中国石油大学、中国矿业大学哪个好？,真心建议石大……虽不怎么懂……但地大和矿大的痛看在眼里
中国地质大学 中国矿业大学 中国石油大学 北京三所学非特色专业，南方女生，哪个比较好？, 一个女生报这三个学校，上了大学你会后悔的，石大大三老学姐   
如何评价中国地质大学(北京)的褚宝增老师？,这是我在图书服务中心拍的。  
中国石油大学（北京）地质工程 硕士研究生，整个石油行业低迷，就业成了大问题，我想找大家帮忙，出主意？,我去年找工作的时候发现北京有好多事业单位，研究生不限专业，不限户口都能考或者招聘进去，甚至有些单位进去有分房子的，比如中办下属的一些事业单位。当然有人可能不喜欢事业单位，反正就是多刷招聘信息，总会有机会的。
中国地质大学（北京）的计算机类专业和电子类专业怎么样？,学生中厉害的人还是蛮多的，比很多老师都强。好好学出路都很不错，保研清华北大的每年也都有。
中国地质大学（北京） 信息工程学院 地理信息专业考研复试一般考些什么？,去教三3楼说你会踢球就行！
请问中国地质大学的珠宝设计系是否值得考呢？,其实也并不是→_→ 冷门的专业对于学生的各个方面的要求也就越高 当然赚钱也不少 对于磨练你自己也挺好  我学长是北京地大的  学的宝石设计   这个出来如果你做的并不是很好没有找到好的实习公司出来还是美术老师 
中国地质大学（北京）的地质地球物理复合专业怎么样?,你可能从未见过这么多课量以及难度  你会被其他专业的人耻笑，他们睡觉的时候你们走了，你们考试的时候他们在游戏。 这不是大学生自由的生活，这是劳改。  每个人都会异常努力，我就是刚自习完，现在凌晨一点，这是常态。   所有老师都会花式点名，上课玩手机睡觉等与学习无关根本没戏。 大三未翘过课，不是不想，节节点名。    但是你可以获得别人得不到的，更好的机会途径，一分耕耘一分收获，很累很值。仅此而已，致自己，也祝你顺利。    我就是想说出这些话，有点痛苦，但是很舒服。
中国地质大学（北京）海洋科学考研去中国海洋大学或者出国难度大么？,不，看自己学习
北京化工大学是北京宿舍条件最差的大学吗？,「多图预警」不请自来  是不是最差的我不敢说 但肯定是很差了 （别的答案那么正经 我也得严肃一点儿 哼 (⁎⁍̴̛ᴗ⁍̴̛⁎) 最近被吐槽最多的是宿舍没有空调还学别的学校搞什么小学期  学生都被热爆  不过 很多事情让人心寒的不是说硬件有多么差 而是校方的态度让人看不到希望  关于别的答案说的 目前中国高校官僚化和学校侵犯知情权的问题都叙述的很详尽  我就做贴贴图的咸鱼吧  一个是大学通病一个是帮助大家在报考时考量的（都怪自己当年懒 觉得北京的学校能差到哪儿去 哭唧唧 (･᷄ὢ･᷅) 在被骗来北化后我感受到最大的问题在于不认错   认错哭穷   转嫁矛盾挑拨同学关系     官僚化的问题哪儿都有 甚至中学小学都有  北化目前显著的问题也不完全因为官僚化  说白了我们争取的不是改观得必须多好  而是身为一个北京211大学生最起码的权利  和 学校打算改观的态度  （既然标榜自己全国先进 请至少做出点儿样子 可能也是我自己娇气  有些课教室挤爆进去喘不过气  再加上生病了校医院和给转诊的二甲中医院一直没治好  所以在北区根本无心学习   而新校区又是未知数  开学更新吧 18级可以到时候再考虑  目前建议小朋友们考虑北林等同档学校  如果是真正的粉丝 也可以浪费点儿分数去地质大学呀 ヾ(*Ő౪Ő*)  先来几张关于空调的图 侵删           然后来说说态度这个事儿  据学长学姐说去年虽然宿舍也没有空调 但是有空调的主教晚上是不断电不封楼的   所以至少可以去主教刷夜 而不是像今年这样把周围的咖啡馆挤爆 至于为什么封楼   因为之前出现了有校外人员袭击学生的恶性事件（好在后果不严重     考虑到增强安保的成本问题  学校愉快地选择了这种简单粗暴的方式  这种态度 从很多事上可见一斑    明明浴室一个月至少坏一次 同学们不得不打水洗澡 却在水房贴出这种告示     夸了他们两句怎么还被禁言了呢 委屈(･᷄ὢ･᷅)        emmmmmmmm  更新关于实验室的新消息        (･᷄ὢ･᷅)(･᷄ὢ･᷅)(･᷄ὢ･᷅)   关于新校区    为数不多能好好说话的一位老师  目前确认有空调 但是    最后老师无奈说了一句“我都不知道这课怎么上”  怎么样大家自行判断吧    我个人非常讨厌跟学生哭穷的学校   没钱又不是学生造成的  自己要不来钱 自己的工作干不好 还好意思跟学生提要求 可以说是厚颜无耻了  最后希望他们说到的都能做到    分割分割分割分割分割分割分割线( ´•̥̥̥ω•̥̥̥` )  有些疑问不想重复回答 贴图         最后 欢迎大家加入我天天洗澡邪教 ヾ(*Ő౪Ő*) 手机发帖格式简陋 谢谢大家的包容   分割分割分割分割分割分割分割线 宝宝有小情绪了   原来现在只要骂别人键盘侠和圣母就是自己赢了 和这种人一个学校真烦  （╯' - ')╯︵ ┻━┻           
中国地质大学(北京)女生上怎么样，专业选择如何 ?,看你的兴趣，没兴趣别来。除了非地质专业外，其他挺辛苦。但来了地大不就是为了地质吗？
杭州电子科技大学，上海理工大学，中国地质大学（北京）哪个更好一点？（女生）？, 考研选211比较好。   具体要综合你是哪里的考生，以及个人兴趣，能力， 这3点才能讨论啊。 
如何评价12月4日中国地质大学(北京)某研二学生的自杀？,谁知道呢 学校也封闭了这个事 我也只是从朋友那里听到的 大早上的一起来就听到这种噩耗 尸体就放在我们每天都走的路上 救护车来了就走了 多半是也没有救的希望了 人各有命吧 也不知道学长受了什么打击 其实不管是什么打击吧 我觉得都是可以好好生活下去的 人嘛 还是要生活的
中国地质大学(北京)的游泳馆内部如何？,地大的游泳馆，自我感觉是真心不错的，本人每周都去游两次。对于本校人员收费也很实在，周一至周五10元，但周末就20。里面的设施也不错，分浅水区和深水区，但每次浅水区人比较多，只要你考了深水证就可以去深水区游，那里人比较少。水质也不错，很干净，让人很舒心。游玩之后，澡堂洗澡真心bu错，虽然只有10分钟，但也够了。总而言之，地大游泳馆很不错，值得游玩。
中国地质大学(武汉)宿舍条件怎么样？,迁往武汉的有两所北京地质学院中国地质大学武汉；北京建筑工业学院武汉理工大学。这两所学校都是211工程大学，发展得都不错！
中国石油大学北京油气田开发的准研究生，无石油背景。考上研但不太想上，导师已经联系好了？,果断不上，上也白上，坑蒙拐骗，没有一点点意思，基础地质有意思，问题是愿意呆在山里么
在中国地质大学（北京）学英语是一种怎么样的体会？,问问在武汉的
