云南大学、广西大学、海南大学、贵州大学、贵州财经大学、云南财经大学研究生的经济类研究生哪个更好一些？,贵州人，本科海大，研究生云大，住在云南财经。 貌似很适合答此题啊。 然而现在已经录取完了，真可惜。。。 回头比较一下。  ————时隔一年之后的比较———— 学科排名之类的，网上随手一搜就有，就不用多说了吧。  先说个人的整体感受的，再说经济学。  学校名声的覆盖范围，和学校牌子的认可度。  云大在整个西南地区的认可度都很高。 已经博士毕业的师兄师姐们广泛分布于贵师大，西南大学等高校，部分分布于遵义师范这样的地方高校。有一个硕士师姐在六盘水师范，现在又回云大读博。 来自华东地区的同学有三个，据他们的说法，云大的牌子在华东地区，没人当一回事。  海大在海南内部认可度很高，我本科毕业时用人单位对往届学长学姐一致好评，以至于我去应聘时有些本地公司不看简历直接要（这些公司包括天涯社区这样的）。前辈的成绩让我们这些后来的人沾光不少。甚至有来自湖南的公司说“我们来海大也是因为觉得你们海大的学生不错。” 需要较严格筛选才能进入的公司一个是深圳的诺普信，一个是泰国的正大，还有中信建投。 当然可能是因为专业的特殊性，但至少可以管窥海大的声誉，至少在海南非常不错。 当然到了各发达地区，连云大都不算什么，海大肯定更不算啥。  贵大就比较尴尬了，在贵州内部名声都很感人。我学车时有个同学是小学老师，居然也敢对贵大嗤之以鼻，贵大再怎么也是贵州唯一的211，也不知她个中专生哪来自信。。。  贵州内部，贵财的财经类专业毕业生布满了贵州相应行业。 有个亲戚毕业于贵财，本科出来就去市里银行工作。还有个高中同学也是贵财的，现在混得很不错，在贵阳车房都有了。 贵财近来的强势和生源的强势应该有很大关系。上面提到的这两个人，一个来自贵阳一中，一个来自遵义四中，这应该能说明一些问题。 但贵财的影响力也就在贵州内部而已了。  云南财大认识的人少，不谈。   综上，名声覆盖范围云大&gt;海大&gt;贵大≈贵财。 牌子认可度云大≈海大&gt;贵大≈贵财。  当然，拿到发达地区去都一样，反正都是辣鸡。。。最多分个211、非211。  接着说，明明网上排名云大大致50、60左右浮动，海大贵大都100左右，其他学校更远了， 按理应该云大&gt;海大≈贵大&gt;其他。 为何外界观感差那么多呢。  我想可能是专业原因。学校的强势专业和当地经济发展不匹配。 贵大强势的方向主要是理工，蛋疼的是贵州工业落后，没那么多对口就业岗位。好多贵大毕业的同学要么跑去四川，要么做非本专业的工作，体现不出竞争力。 不过贵州这几年发展很快，前几年终于摆脱了人均GDP倒数第一，特别是县县通高速之后，各方面都能感受到日新月异的变化。随着贵州的发展，贵大必然也会更进一步。  海南同样也是个工业落后的省，几乎没有什么大工业。而排名和贵大差不多的海大，强势学科却是农学、法学、旅游管理、金融财会，高度契合海南的主要产业。海南省经济说白了就是农业、旅游、金融、房地产四支柱撑起来的。那么体现在学生就业、学校名声上自然会好看很多。 但海南省太小了，人口介于遵义和毕节之间，经济发展的上升空间有限。  甚至于海大在我个人感觉上居然能和云大差不多，这又要说说云大了。 云大最强的民族学、生态学、专门史，全国都能进前十（特别是民族学，全国第二，第一是中央民大），这些超强专业极大拉高了云大的排名。但是，又都是一些研究型非生产型的专业。虽然很符合云南特色，却难以像理工、财会等提供大量岗位，人少影响力自然就小。而且离人们的生活太远，不然为什么上面说的地市级医学院有那么大影响力。。。   谈完了对学校影响力的感受，第二个感受是学风方面的。 贵州俩学校没在里面读过书，不谈。  云大，云南财大和海大我都是在里面生活学习过的。 对各校学风的感受是:云大远好于海大远好于财大，非常符合三个学校的排名。  云大，任何时候教学楼的自习室都是爆满的，以至于我直接放弃去教学楼自习。图书馆也长年满座，本专业十个人里起码有五个人近乎于把家安在图书馆了。 最终，厌恶人多拥挤的我果断常驻宿舍楼下的自习室。没错，云大连宿舍楼都有自习室，海大财大都无。  海大教学楼和图书馆也很拥挤，但我的感受是，他这种拥挤就是典型的考前节奏:每逢大考人满为患，平时却冷清许多。  至于财大，我就举个例子。考研复试之前的第一天，我跑去云大复习，没座位，搞得我只好在公园石凳上看书。当天下午我就回财大去，伸手那么一数，自习室里一个两个三个人，加我一共三个。。。 复试前一个周我天天去财大自习室，就没哪次教室里的人超过五个。 这种环境学习起来真爽啊，再也不用蛋疼地抢座位了。   然后经济学这个专业。 由于此专业牛校太多，题主提的这几个学校在此领域根本就是。。。不入流。。。 别说全国前20，前30，前40也看不到这些学校的名字。  但如果硬要比个高低。我认为比较好的一个标准是博士点。 因为这些学校没有一个经济类的国家重点专业，而省级重点标准又难统一，博士学位授权点相对好比较。  云大有个理论经济学博士点，云南财大有个应用经济学博士点，而其他三所学校在这个领域都是无。  这只是粗略比较，真有志向选这些学校的，肯定自己还要深入了解各校师资等各方面信息。  无论怎样，贵大虽然尴尬，也毕竟是211，这恐怕是必须要考虑的。现在好的岗位动不动就要求211、985的背景下，这是一个门槛，有时候，如果跨不过这个门槛，就连进场机会都没有。 去非211学校读研，这个风险只能根据自己情况考虑了。   综合之后，我认为经济学调剂优先度云大&gt;海大&gt;贵大≈云南财大&gt;贵财。 个人观点，仅供参考。
在贵州财经大学就读是一种怎样的体验？,宿舍很棒，完。
怎么看近日贵州师范大学教育科学学院印发了文明礼仪规范手册这个事情？,由于没有阅读过全册，仅对截图中的内容做出讨论。  首先，我不认为截图中的内容有任何不妥的成分，相反，我认为不止是对女生，对于男生来说，对于全体社会公民来说，不乱扔垃圾、在卫生间整理仪容、不在公共场所大声喧哗、不在他人背后说三道四、诚实守信等，都是一种基本的公民素质，诚不知有何争议可言。实际上在欧美日等发达社会和地区，这些“文明礼仪”早在几十年甚至百年以前就已是社会对“绅士”和“淑女”的基本要求，而随着教育和生活水平的提高，这些素质更是早已在主流社会的全体公民间推行开来，这也是我们对于民族传统中“去其糟粕，取其精华”的“精华”部分。我不明白自尊和尊重他人这么基本的事情为什么会让一些人感到别扭和抵制。  我认为大多数的调侃也好、嘲讽也罢，其实都是集中在第（12）条“看电影血腥镜头，不得有兴致勃勃之行为；推荐动作：闭眼，小声说，天，好怕！”很多人认为这是一种社会退步，要求女性顺从于男性，甚至将其与“裹足”相提并论，我觉得大家似乎get错了点，我先说一下我的结论“ 示弱是女性征服男性和世界独享的武器 ”。  这是《黑执事》第58话的封面，注意左上角的文字“ 为了被爱而示弱，为了守护而变强，全部都是为留在那人身边 ”。 在之前的57话中，伊丽莎白是一个怎样的角色呢？英国骑士团团长之女、女王的番犬之妻，蕾丝裙不离身，就会不分场合和时间的撒娇卖萌，除了腻歪夏尔之外，在整个剧情中几乎是零作用，典型的旧时代封建社会中上流家族出身的无脑大小姐。官方是这么描述的：  而在第47话中，莉兹（伊丽莎白的昵称）被丧尸围困，当时夏尔扭伤了脚，而塞巴斯蒂安无法从两个死神的围攻中抽身。  眼看着就要领便当了，大小姐还在作。  接下来发生的事情是这样的：  这样的：  还有这样的：  以及这样的：  为什么伊丽莎白会展现出这种软弱和强力矛盾属性呢，稍微了解《黑执事》剧情的人都知道，夏尔所在的凡多伍海姆家族是被灭门了的。凡多伍海姆家族被灭门前的伊丽莎白是这样想的：   凡多伍海姆家族被灭门后的伊丽莎白是这样想的：  但是伊丽莎白对夏尔的爱从来都没有变过。 后来的内容都交代的很清楚了，幼时的伊丽莎白就已经在剑术上远超同龄人，但由于那时的夏尔被严厉的姑母（伊丽莎白之母）教训出了心理阴影而说出“弗朗西斯姑母虽然是个美人，可是那么强的新娘，我可是很怕的啊，我的新娘是莉兹真是太好了”，伊丽莎白便瞒下了自己受训的事实，而因为心爱之人个子比自己低，伊丽莎白也从来不穿高跟鞋（现实生活中这样的姑娘也有很多）。在二次元中，与伊丽莎白类似定位的女性角色还有《伪恋》中的橘万里花，外表柔弱，而内心却无比坚韧刚强。  所以说，示弱是什么？对很多人而言，示弱即是顺从。而事实似乎并不是这样，生活中总是有很多这样的女生，和心仪的男生在一起时，永远是一副傻白甜的样子，不认识路，拧不开瓶盖，算不清钱，而一到自己生活时，却依旧有模有样，风生水起，当然可能依旧不认识路，拧不开瓶盖，算不清钱...这些女生有时甚至会被同性所排斥，以“XX婊”称呼，但总的来说，在男性面前“示弱”，和化妆、美容这样被大多数女性喜爱和接受的行为并没有任何区别，都是为了达成某些目的的手段罢了。  这世界上只有男人和女人，而男人有时在女人面前简直单纯的可怕，所以说啊，“示弱”几乎就是一种性别天赋，利用好了，世界的一半就是你们的了，姑娘们。  *截图来源：《黑执事》第57、58话。
在贵州什么大学比较好呢？, 看你学什么专业，再来选择学校比较好。 
如何看待恒大集团抽调300个中层和1500个大学生去贵州扶贫？,编制是否留在原地区公司，社保公积金是否还能在原籍缴纳，最最重要的是返回后很可能已经没有适合的岗位了。这些问题都是这几天陆续被问到的。
本人浙江考生，如果要在广西大学和贵州大学里面选一个，哪个更好?,你怎么也不说专业和分数啊  单从学校来看，广西大学比贵州大学好  贵州大学很坑的，我当年就是从那违约走的
贵州大学有哪些不好？,对省外的学生分数线顶的很高，我就算被骗的一个，然而这的老师教的真不咋的，特别是英语，或许是本地人本身英语差的原因吧。    还有就是，学生整体看，形体打扮水平很low！说简单点就是穿着打扮很怂。   设备来说，先不说教学，就说体育吧。没有健身房，没有游泳池，操场烂的一b.   学校太穷了，太穷了。   极度不方便，物价贼高。   还有，m.mp..你和他们很认真的说着话，马丹大多数人就是不会说普通话，也不管你听不懂否，就像没开化的原始部落。      怎么说呢，外省的，最好去沿海地区读书吧，不然重庆四川也行。
2017贵州文科考生647分，省排350，是选中山大学好还是中传好？,想问问你有没有中传的招生老师的联系方式 同为17届考生 帮帮忙？  
贵州财经大学同学错过四级考试报名时间可不可以在哪里可以自考，四级英语考试还可以怎么补报？,等下次报名吧
在贵州医科大学上学是一种什么样的体验?,13级老人家来回答~~ 反正就是很一般朴实的医科类大学啦 贵州省重点高校  新校区挺不错的大多数都是四人间有阳台独卫洗澡间，就是花溪大学城周围商业气氛不浓厚没啥可玩的，是个静下心读书但不适合social的地方。老师们对我都挺好的（答主专业四年制今年毕业）。 但是如果你要学医的话你就要想好是不是喜欢学医，虽然我不是学医的但感觉学医性价比不高…等你在规培的时候人家金融设计计算机专业的人都已经月薪过万了… 总体而言贵医环境舒适，适合学习，还是有推免资格的高校~来吧。
跨专业考研，调剂去贵州大学读研有意义吗？,个人建议你这个直接211毕业找工作就好了，跑去贵州那地方干嘛？这样的经历不如你拿去换取工作经验。 其次，我是个功利现实主义者，在上海习惯的人，没必要去贵州折磨自己。你凭借自己的能力即使本科依然可以在更好的地方生活。 你很优秀，加油，看好你！
贵州大学怎么样？,贵大还是不错的! 不过很开心最后的阴差阳错让我们在X大相遇(∩_∩) (毕竟看到这么久都没有朋友回答……心痛)
如何评价贵州大学明德学院？,二本，如果可行，建议复读。
如何评价贵州高校积水，环卫工阿姨背大学生“过河”？, 依旧在咒骂批评的人。 站在道德的制高点，不冷吗？  现场也有男同学在背啊，而且背的几乎都是女同学。 上纲上线，不过是缓解一下都市压力罢了。  6.16更新 有人觉得我在洗地。 我试问一下。 如果新闻中是一个开兰博基尼背LV的高挑女性背人过水，哪怕背的是男的，你们还会骂吗？ 环卫阿姨和高挑女性，在这一作为上，有什么不同吗？ 你们真的应该多穿一点儿衣服了，贼冷。  6.17无奈更新: 在美国Durham，一位七八十的老爷爷钻进车底帮一个年轻小伙子修车，他也可能腰痛，也可能有高血压，但是他就是用微薄之力帮助一个壮年小伙子。 我们看见的人都没觉得有什么不对。 愿这盛世，如你所愿。 封笔。
贵州省高出一本100怎么选大学？去西安交大大概需要怎样的分？,南京理工大学
中南民大在武汉，贵州大学211，请问应该选择哪个？请大神各方面分析一下。？,看你自己的选择吧，中南民大现在在社会上越来越被认可，分数线越来越高，因为是国家民委直属的高校，所以有些政策的牵制，对少数民族地区的同学有优惠，分数线不是很高，还有中南民大在武汉市区，来大城市学习是一定的，不管是生活还是什么都很方便，就业也是不错的。贵州大学211也不错。最后还是你自己权衡吧，毕竟要对自己的选择要负责。
请问我现在在贵州一所普通二本读体育教育专业，下学期去广州大学当交换生，对我有用吗？,机遇不像金钱，可以直接提现价值。有的事情去做去把握，年轻你在怕什么，急什么？有些事没有所以然的，去做啊。
如何评价贵州大学校长郑强说的"不知空姐为何要漂亮？"？,空姐要漂亮是经济不发达年代留下的畸形产物，在过去，经济不发达，坐飞机的非富即贵，他们愿意花大价钱，买飞机的快捷，买优质的服务，其中有一种服务就是优质的服务员，飞机的服务档次，要和他们花的钱相匹配。同理，现在我们可以发现酒店的档次不同，服务员的质量也是大相径庭的，服务员的服务品质也是被消费的，服务品质的一项就是外貌，也是被消费的一项。花钱找个漂亮姑娘端茶倒水，得到视觉的享受和满足，应该就是这么通俗的理解吧。再比如说，同样是住一晚，五星级酒店舒软的大床和小客栈的一张硬板床不都是睡一晚上吗？差别在哪里。。。。。。这也反映了国民经济虽然得到了提升，但是国民思想素质仍然停留在贫穷和落后的年代。本质意义上的理解，空姐还是服务员本质，服务于有钱人的服务员。只不过，现在大家都坐得起飞机了。
新疆石河子大学法硕和贵州大学法硕那个更好一点？,都差不多，选个离家近的读
求贵州财经大学研究生宿舍图。？, 大概就是这个样子
贵州财经大学如何？, 之前的答案有哗众取宠之嫌，没想到回答的人慢慢多了起来，赞也多了起来，不禁惶恐。 虽已说明只是引用，不代表全部认同，但依然要对激烈的言语、引导的不好风向、对学校形象造成的不好影响表示非常抱歉。   本打算删掉，只是无奈遭来某些义愤填膺之士的正义国骂～文末说明一切怪自己无力不怪学校的解释好像没什么卵用。 我理解你护校情深，但动辄提起母亲，然后居高临下地斥责有异议者一群乌合之众，如此大义凛然让我好生佩服，不曾想妹子竟是如此高明的存在。 吾辈眼拙耳拙，只是好奇且不说存在即合理，听听不同的声音又如何？  批评完全接受，但当你打出街骂娘的旗号，抱歉，为人根本恕不能忍。嗯，本人确实没啥出息，运气好才能和两名前辈代表学校入选全省优秀大学毕业生事迹选，现在也只能在W500强干些端茶倒水的粗活了。妹子说得对，确实羞于拿出自己的简历，不是因为没东西可写。而是， 你只是赢了乌龟，哪有底气小瞧还在拼命向前奔跑的兔子？    大环境真的很重要，温水煮青蛙真的很可怕，差距就是在自我安慰和自我麻痹中拉开的。   如今毕业一年，说说感受，言辞不当之处，望兄弟姐妹海涵。  作为进驻财大大学城校区的第二批学子，虽不算严格意义上的拓荒者，却也是见证了新校区建成的过程，记得入学时唯一的教学楼勤学楼，于我们而言还是A12栋的代码，鼎新湖还是一抔黄土，图书馆是勤学楼下临时腾出的几间教室。一年时间，四食堂、图书馆建成，地暖覆盖全校区，银杏大道辉煌，记得当时贵州日报还专题报道了贵财速度。的确， 硬件方面财大有挺直脊梁的绝对资本，与外校师生说起财大气粗，是满满喜悦与自豪。   但是， 我们也需要直面事实的洒脱，自我革新的勇气，而非一味包庇和夜郎自大。 之前的评论虽极端偏激，但绝非杜撰，只是后来幸福的你们没有经历罢了。   且说改革。 渴求突破是好事儿，但是行政化色彩过于浓重。我们这届是学校更名大学后的第一批学生，经历了运动打卡、学院合并、笔试变机考···私以为出发点都好，但成效不大。晚上有夜跑的习惯的同学不得不早起横穿学校打卡（听说现在方式多了，我们那会儿只有一食堂旁边足球场可以打，可是苦了住三食堂附近的学弟学妹们，早起打卡的队伍那叫一个壮观），学院合并后一些专业沦为三不管专业，机考逼迫成为背书机器，扼杀了自由发挥的空间。关于改革并非本人一己之见，很多老师也表达了同样的质疑和担忧。  我不知道现在的学弟学妹们现状如何，但作为第一批承受者，这些大刀阔斧的尝试，还是蛮不适应的，借用习大大的话：改革的红利并没有惠及我们这些学子，政令一下不容异议我们只有执行的义务，我们像极了改革的试验品，难免抱怨。只是希望之后会朝良性方向发展，或者说现在的学弟学妹们会享受这些尝试，那我们这群小白鼠也算基本值当。   且说学风 。想问问大家课余时间同寝室人儿的日常？气派的二维码图书馆，座无虚席这种场景基本会在考试前一个月出现；起早贪黑泡在自修室考研的同学有，也不在少数（比起其他学校还是差远了），可是战果呢？每年的考研成功人数让人咂舌，竟不如某中部省份以线下补录生源居多的2B学院一个班的人数。要情感也要理智，不是想黑学校，一些事实我们不该回避，为什么不好好反思缘何出现如此尴尬的局面？   且说就业。 说到厉害的人，提到了阿里巴巴，当年的贴吧吧主有几个？ 不要说什么”如果你本身族够优秀了又何必在意不如你的人”，也许自诩优秀的你让大牛不在意的资格都没有。 危机和紧迫感，是不能丢的。其实财大名誉校友财大不少，却大多是在50-60周年校庆典礼才见到的人物了，院士墙象征了财大过去的辉煌成就。比起那一代的人，吾辈需奋起努力呀。不成熟的小建议，多问问自己四年后想做什么能做什么。寒暑假那么长，多去社会体验自己想从事的工作，向往的城市，旅行、实习都是不错的选择。好为人师一直是自己排斥的词汇，不喜也不善说教，总之希望大家都有个好归宿。  说实话我是个极幸运的人，遇到了可以影响人一生的老师，可惜如今他已经退休。   褪去当初的青涩戾气，已经毕业了的我，不后悔选择财大，也珍惜与她产生的每一份联系。   我没有高端黑的本事，  只知道爱不是纵容和无底线的包庇。  以此回答，向希望来财大读书和正在财大读书的同学们，说出真实的想法。   现在的财大可能不尽如人意，如果你愿意和她一起成长，欢迎加入，过程亦美好。    但如果本就有更好的选择，希望你珍惜权利，毕竟自我革新是一个漫长的过程。   已经在读书的，友情提醒一下下：切莫认为拿到奖学金当上干部评上优秀小有名气就多厉害。除非你有底气说，换个厉害点的学校，遇到厉害点的对手，我依然可以如此潇洒。   当然，我打心底里希望学弟学妹们都有这个底气！   最后，祝母校越来越好。 
普本考贵州大学电力系统及其自动化怎么样？,泻药，但回答可能让题主失望，没在南方上过大学，专业和电不沾边，没有同学在贵大，只是去过一次贵大，在我的印象里，贵大很大很大，要跨一条很宽的马路，还有很多山(或者说丘领？)但贵大作为二区的211国家线要低一些，难度比一区要小，而且贵大去年招调剂了。  也就是说刨去专业因素，比如有的专业很火，报的人很多，理论上考到国家线就行。 奖学金各个学校不一样，看学校是否有钱，以及学校是否招的到学生，靠奖学金来吸引学生。我们学校学费8000研一新生奖学金8000一人，国家补助6000一人。就没别得了。研二起，国奖20000，一等奖学金10000，二等8000，三等6000，国家补助6000一人。剩下的就看你的导师给不给你工资了，有的导师仗义疏财，你都可以躺着挣钱，但有的老师周扒皮附体，半夜鸡叫却一毛不拔。
贵州大学大学生毕业被就业是一种常态？,通知：外国语学院12级离校手续将于6月27日（星期一）上午9:00开始正式办理。离校系统学院审核是最后一关，只审核团组织关系，党组织关系，所在学院，请各位同学在到学院审核之前务必确认自己的所有部门都已审核完毕，否则无法进行学院审核。在办理离校系统时，我们会根据接收函进行办理（升学，已签三方协议或者劳动合同除外），无接收函的同学不能办理离校手续，请还没有上交接收函的同学尽快补交。收到请立即回复，谢谢！这是学院办公室发出的通知
贵州大学通信通信专业申请新加坡国立phd有没有一点点的可能性，跪求大神？,简单讲是可以的。新加坡读phd学费全免+给生活费似乎是常态。 问题是你确定你要做研究么？PHD申请的重点是有老板愿意收留你，并且他做的专业是你感兴趣愿意花辛苦去做的。能找到这样的方向和导师难度目测不比找一个合适你的对象结婚生子容易。
