贵州医科大学口腔学院好吗？,是高考填报志愿吗？ 先说住宿吧，大一到大四上住在新校区（在大学城，有独立卫生间+供热水洗澡，24小时供电），大四下开始实习回到老校区（在市区，老校区嘛……住宿就尴尬了点，但始终是市区，相较新校区要方便一点）。 学习的话，教口腔的老师我感觉都挺不错，挺负责的，课也挺生动的。学院也会组织一些活动让学生去了解口腔医学，无论是去参观工厂啊，或是雕牙比赛之类的，学院也在尽可能的让学生体验口腔这门专业。还有什么去日本交换生，港大参观之类的。在大三的时候学生会有2个月去大临床实习的机会，这是其他专业没有的，说是为了让我们感受一下大临床的生活。 当然有好的也有不好的。比如学习口腔知识的时间有点晚（听说其他学校的大二就上了，我们大三才上），教学器材可能比较差（我也没见过其他学校的，但是对于目前我来说我觉得够用了）。其他暂时想不起来了…… 唠唠叨叨那么多，希望这些对你有帮助。 补充一下，他是一本专业，独立院系，有自己的贵州医科大学附属口腔医院。最主要的是，没有雾霾。哈哈哈哈
贵州大学校长说，清华北大多汉奸，你们怎么看？,1.我没看过这方面的资料，不知道  清华北大出去的比例多少，回来的又有多少？记不得是谁说的：现在北大最大的问题是没有学术自由，完全没有了五四时期的精神。这或许就是大家都往外跑的最大的原因吧。 2.我也见过几个清华的，1个工作2年就当上央企院长助理27岁，1个研究院技术总工50岁，1个上市民企下属公司副总33岁。他们对技术的态度，办事的认真和努力，以及对问题的宏观掌握，相比他们，我这个211的就太懒太随便了。 3.中国真正掌握资源的中流砥柱就是他们这样栋梁。当我们还在愤指不公的时候，他们早就高屋建瓴，享受回报了。 4.最后， 一个成熟的人，不要指望国家变成天堂来给你养老。自己不努力改变世界，却想着世界为你服务，你当世界是傻X啊……
我是今年贵州的一名高考生，被中国石油大学克拉玛依校区录取，在纠结去不去？, 新开校区，听说是石油大学被压拉上贼船的，过两年要独立，估计最后会是西南石油的水平。 
本人是贵州二本分数线出头左右的在外省读大学的大学生，想考研，但是心里没底，英语太差！求建议了！？,读吧，贵州需要你
贵州大学法硕（法学）好考吗，就业怎么样？, 法硕是挺简单的过线即可。但是这个看你一志愿是否填贵大，如果填贵大，那就算过线的分数不高，也不用担心，但是如果是调剂的就说不准了。而且好像现在贵大专硕也会有奖学金。图片是贵大2016年研究生的分数，依次为初试分数，复试分数，总成绩。就业方面的话，如果想留在贵州发展前景还是挺好的。
电子科技大学硕士毕业做微波电路方向，已拿到中电55所和航天十院061offer，家是贵州的该如何选择?,题主最后签的哪里？贵州航天怎么样嘛？贵阳生活怎么样嘛。题主 我也拿到了航天科工十院一个offer，但我不是贵州人 对贵州贵阳了解不多  所以有点纠结去还是不去。
211末尾贵州大学，网络工程专业，大三了，很迷茫，今年研究生考试刚完，明年我也想参加，可是有很多疑虑？,我是贵阳出来的，在一个985读研，我很多高中同学也在贵大毕业了。看到贵大还是有点感情的，说两句过来人的话。  其实题主鸡汤的东西估计你看得比我还多，我们知道那些东西用处有限。  先推荐题主看一个视频系列，哈佛大学公开课《幸福课》，在网易公开课里能找到。里面几乎有你描述里所有问题的答案。  一年时间对于考研来说很长了，半年都很足够了，我认识的人考研一般用了四个月左右。但对于题主来说，这个时间还是很紧的。因为你要在这一年改变近二十年来形成的你，还要考上一个好学校的研究生。  先说一句复试吧，复试看你初试和复试的综合分。也就是说初试和复试表现好后自然就会被推到导师面前让他们选了（假设你之前没联系老师），川大我不了解，我了解很多学校的学院学生通过复试的名额比老师能招的学生名额要多。那这就是说你初试和复试过了不用愁没老师要你，只是可能你去不了最好的导师那而已。  我劝你考研期间在外面租一个房子，环境因素比你想象的大，租房的时候注意供暖供电供水是否持续，特别是供暖，考研在冬季，一个温暖的环境是学习的保障。  坚持体育锻炼，特别是有氧运动锻炼。体育锻炼是提高执行力的最好方法了，没有之一。但是锻炼贵在坚持，知乎上有很多关于锻炼的文章可以系统看看。  制定计划。计划越详细越好，但得有弹性，得有计划实施不了的解决办法和弥补措施。计划得用笔写下来，每天看多次提醒自己。  如果题主玩游戏或者其他的东西，我建议题主戒了。比如说LOL，要是实在想玩戒不了的话，那你规定每周只能玩两次人机，一次一小时。戒东西得有个过程，一步步来。  关于执行力，可以看斯坦福大学出的《自控力》。朋友推荐的，不是鸡汤，有理论和数据支撑。  我个人建议，题主这个寒假可以打份工，最好是服务类的，面向人并且有个人负责元素的。比如电影院，饭店，咖啡厅等。  综上，祝题主一切顺利。等考上了在这个回答下评论下就行。
2017贵州省高考排名6400可以填什么大学？,建议走好一点的二本王牌专业，要不就是一本的差专业。
请问各位大神我是来自贵州的17届文科考生515的分数 二本线453 可以报哪些大学 想学中医或者法律？,湖南中医学院和贵州中医学院可以选。
最近貴州大學的校長鄭强說了实話，不知各位知友如何看待空姐考研，以及對空姐這一行業的美化？,个人认为考研是对个人能力的一种认可和提升，不仅仅是文凭。空中乘务员的第一职责是保障旅客安全，并不是为旅客服务。同时，空中乘务员的知识涵盖需要较为广泛，考研从某个方面来讲也是对乘务员知识能力的提升。不太懂他为何要对空姐进行贬低，服务行业工作也不容易。如果说空姐不配考研，那么，什么样的人才具有考研的资格？难道说有明确的要求吗？赤裸裸的职业歧视。
贵州大学的社会工作专业如何？,我就是贵大的 社会工作专业   算你学长 读了三年   我觉得还是报其他专业吧，
贵州人报考贵州大学要高出一本分数线多少？,一般高出一二十分就可以了
四川人，在南京邮电大学读本科，考研失利，打算调剂到上海理工大学和贵州大学的信息与通信工程专业，哪个好？,选上理，地理位置决定发展平台，很重要，要比你以后拿个B区211学历强。
贵州医科大学的社会体育与指导专业怎么样？,好
内陆学生（贵州）考上香港大学牙医学院有多难？,牙醫學院有內地來的本科生，全部學霸妥妥的。需要注意的是，牙醫學院不是醫學院（李嘉誠醫學院）下面的一個院系，而是一個學院faculty，所以請到牙醫學院的官方網站上尋找信息。樓上所說的廣東話教學，不敢苟同。據我所知，牙醫學院是全英文教學的。這裡不僅有中國學生，還有新加坡等外國留學生。不過臨床階段的病人都是香港本地人，不會廣東話的牙科學生，雖有護士幫助翻譯，但醫患溝通方面可能還是不太自如，不過廣東話並沒有那麼難學，加油。
贵州财经贵州医科大大理大学哪个好一些？？,财经
2017贵州高考理科考生，成绩估在六百分出头，想学口腔医学，推荐那些大学？,如果自己家人有门路，可以在本地人民医院就业，那么填报哪里的其实无所谓。华北地区想进公立医院必须拖关系或者交门槛费，江浙沪是逢进必考拖关系意义不大。贵省是怎么个人事制度我不清楚，但建议你要从事这一行最好搞清楚。 如果就是打算出来，不想回老家了，那也简单，想去哪里就报考那里，今后就也方便。 一般来说穷山恶水出刁民，如果周边人口腔卫生状况越差，题主作为牙医获得成就感的可能性越低。
如何在贵州大学北校区租房？,上贵州大学贴吧发布求房帖子。
天津考生，过一本线10分，我应该去边陲的211（云南大学，贵州大学，内蒙古大学），还是本地普通一本？,别的不清楚，贵大是进不了的。
请问一下贵州2017高考文科总分601排名2577可以报什么大学呀……？,首先，建议你把问题描述的仔细一点，信息量多一点。 我的观点是，先看你所在的那一档的学校，优先选择985.211。坚持学校大于专业。 如果分数比较尴尬，踩线的这种，务必选择服从调配。
贵州卫视一档综艺节目《非常完美》发现去表白的都是些还没毕业的大学生，大学生公开荧屏求爱，是怎么一回事？,那就是一档扯淡的节目，都是一些长相不错的小屁孩在上面作秀，这些人的条件，长相 工作都没的说，试问一下生活中，像这样的人还有时间去那里相亲吗？ 如果我猜测没错的话有可能是他们节目请的人。
郑强正式出任贵州大学校长，你有何看法？,10级学生，12年郑强到贵大。大学的前半部分在老校长陈叔平的时期，后半部分在新校长郑强的时期度过。 不必其他学校，就他们两个做一下对比。 老校长陈叔平较为低调，在什么场合都惊不起什么波澜。有次消防演习，就在中山园食堂那里讲完话自己忙自己的去了。 新校长郑强就比较高调，到哪里都是人山人海的，随便随时有党宣的跟着拍照。不管是学生社团活动还是去巡考，都随时有党宣的在后面拍照。 学术上老校长似乎稍逊，老校长是研究数学的，我对数学不是很了解。新校长郑强，高分子领域。单从头衔来说，长江学者已经足够证明他的学术成绩。 贡献来说 老校长陈叔平数学领域，只记得有次建模比赛在贵大办的。 新校长郑强来说，没有到贵州大学的时候就已经帮助贵大建立了一个国家复合改性聚合物材料工程技术研究中心。后因为是第十二届中国大学生篮球协会主席，贵大篮球队也跟着进了CUBA。战况如何，没怎么关注。赶巧的是郑强上任的时候正值贵大110周年校庆，虽然校庆办的仓促，但是学术讲座特多，诸如诺奖获得者阿达 约内特、杨卫、江雷、乔松楼等。欧阳自远就不说了，名誉校长经常没事就来做讲座。是一位值得敬佩的科学家。 插一几个细节： 1，校庆期间，在主持阿达 约内特的讲演时，很多学生在听，郑强来做主持介绍完后立马去新区并叫上在场的学生一起去。原因是欧阳自远院士在新区做讲座； 2，邱冠周院士做讲座时，在场有一些材料学部的专家。郑强当场给在座的专家院士开价，希望他们来贵州； 3，毕业典礼时一一和在场的毕业生握手。 最后，如何评价这个人？以及对贵大的影响？ 说实话，贵大只是换校长不是换血，之前有的诟病后面依旧有，郑强而言只是把自己能做的做了。学校老师学生对郑强的不满大多也只是批评他说的多，做的少。但也不能因为他爱说就说他什么都没有做。现在来看，贵大成立医学院、调整院系划分整理出酿酒、烟草、旅游、大数据等学院也不无他的功劳。惠及学生的事情来说，给女生宿舍安装了窗帘，把北区的篮球场翻新等。至于老师待遇以及对博士学历老师的待遇来说，不管是郑强还是陈叔平都没有多大改变。 还有，贵大这么大的学校，不是换了一个校长就会有实质的一些改变。排除外界对郑强的关注，贵大还是以前的贵大。郑强也还是之前的郑强，愤青教授。 今年16年，郑强来贵大快4年了，不知道是否还继续任贵大校长。最近，郑校长去年两会的视频被翻出来，炒得很热。贵州大学从以前的国立贵州大学到贵州大学再到今天政策性的211，其中的滋味估计也只有贵大人自己能体会。
