贵州高二 2018高考理科生现稳580分以上 想考中山大学 但没想好以后学什么专业 想多了解中大情况？,1224更新！  更新是因为有个答主说我答的什么玩意？还骂我嘴欠...于是想解释一下。 但是首先对于他的资格论我想说一下。 @明月和我的猫 我不是中大的，但是中大招办每年都会来我们学校宣讲一次，所以有一些了解。有一点我想说的是在你没有提到的专业里面逻辑学中大是全国第一的，我认为逻辑学是专门为了要读研的学生准备的，读研的方向很多，具体可以百度。就这一点我想说你的了解好像没有我多。广东学生对中大都有一些情结。别的省的学生可能不知道。当然我确实没有你那么有资格，毕竟你现在的身份是我以前预想的身份。我也是16级的，进岭院有些危险于是选择来了厦大，不然我们可能是同校，虽然我不是中大的，但是对中大有一些感情。莫名其妙的感情吧，暗恋？ 第二是我对贵州不了解，嗯...我是一个土家族人，父母都在贵州长大，许多贵州的堂哥哥表姐姐之类的高考分数出来后，我和我爸爸都会去帮他们选大学，所以确实是有些了解的，只是自己也高考过了蛮久的了所以快忘记了，把500分当成600分了。刚一看到觉得580特别高，问了舍友才明白这不是680。 之后解释就不多了，高二的时候580我也不知道他是做的什么题，统考题月考题还是往年真题。所以这个回答确实没必要。 其次我从高一开始关注中大，但是，我从来不会去论坛知乎等问中大怎么怎么样。网上大把资料。别说看不懂，这点采集信息的能力都没有干脆回家养猪。 最后我想不到有一天会和别人撕逼，要怎么样才显得比较老练，挺急的在线等。 -------------------原答案（有修改）-------------- 官网地址：  http://  sysu.edu.cn/2012/cn/ind  ex.htm       第一高考网介绍：  http://www.  diyigaokao.com/college/  2360/       新浪高考院校库：  http://  kaoshi.edu.sina.com.cn/  collge/c/10558.shtml#score      以上有详细信息 如果你只想知道中大的信息，就看到这里。                      如果你想听听我的意见，我想说，如果这个就是你的月考成绩，那我觉得你考不到。 我本来想好好的跟你说说中大，但是问了一下我贵州的舍友的分数，顿时觉得你在侮辱中大。  我舍友上了大学以后老是睡眠不好，半夜老起床。他说有点失眠。 我也是经历过失眠的人，想帮助一下他。但是突然有些疑惑，我是因为高中的时候压力很大，想着不早睡明早怎么听课越焦躁越晚睡才失眠的。现在上了大学，这样硬性的压力小了很多。他为什么会失眠呢？ 后来他说他们以前在宿舍熄灯后熬夜学习学成了习惯，每天的睡眠不超过4个小时，全宿舍的人都2点以后才睡。有时精神一点可以通宵。整个高三都这样度过，现在就觉得很缺觉但是却睡不好了。 精力被透支了，现在只能用精力来还。 他为成绩是这样付出的，我并不是说你没有付出，只是你的成绩让我觉得你付出不够，而且你还在知乎上咨询中大的好坏，而不是去网上搜索。何其得意。 我想贴一句我们的对话，希望你能自省。 “阿韦有个孩子你们省的，想考中大。580够吗？” “580，你叫他去读技校吧。我要是580想都不敢想，先学习。” 580并不能决定好坏何况你还是高二，但是希望你少想一些，多做一些。 想是很重要的，但是别变成妄想。 噢，忘了说。我舍友是文科生658。                   其实我很不习惯这样和人说话/滑稽 可能这就是我们高中班主任说的棒喝，先当头打一棒把你打醒，再告诉你我想说的东西。 真心希望你能考到中大。 中大的逻辑学医学经济学都是很棒的，你可以在每次考试进步的时候更新问题，我就更新一些中大的信息（虽然你可以在百度轻易地得到）。
广州大学和贵州大学哪孰优孰劣?, 泻药。  广州大学在广州。就凭这点也该去广大。  再说了你一个广州人去贵州大学我估计你能饿死。  广州陀地休闲娱乐中心欢迎你。   PS。录了广大来华工找我玩啊 
2017贵州考生超一本线51分 想学计算机类专业 有什么值得推荐的大学？,贵州大学
就读师范类学校，去贵州师范大学还是西南民族大学好？,想要当老师还是选贵州师大好。
如何评价贵州大学校长郑强的演讲？,说相声的偏要来搞教育
贵州医科大学的录取分如何，?,医大学生，欢迎加QQ1900401697
贵州文科考生56o，能录到广西大学新闻学吗？,欢迎加入广西大学2017级新生群，群号码：125266569，里面有各专业学长学姐为你解疑
云南大学，广西大学，贵州大学风景园林专业考研建议。？, 考1区211，分不够你在往这些地方调剂。     修改一下回答，这几个学校不是不好，而是相对于工作来讲，个人认为读研读这些学校含金量不大，不如直接工作。     当然，有牛导师带另算。     当然，有机会留校直博当老师另算。 
贵州高中生报考福建省的大学的问题？,985的话，你就加油考上600分吧！
贵州大学人武学院的位置与存在状态？, 抱歉，现在在看见你的邀请。  贵州大学人武学院在贵州大学北校区旁边，大门口在贵阳市花溪区溪北路 
如何看待贵州六盘水暴雨后环卫工背大学生过水塘？,  我还没看问题下的回答，如果这个问题出现在腾讯微博上，这些学生肯定会被各方批判一番，但这个问题出现在知乎上，答案就不能确定了 
贵州大学体育系报考分数线？,分数线划的很低！
贵州大学的二本专业都有什么？好不好？,教育技术  软件工程。  交通运输。   物流管理。    电子商务
16高考艺术生没考进理想大学 读了贵州 后悔志愿 现在迷茫了？,谢邀 题主请介绍详细情况
内蒙古大学、贵州大学、云南大学、海南大学？, 云南大学，不要选贵州大学。来自一个学姐的诚实建议。  之前去昆明玩过，昆明的交通比贵大好太多了。如何你希望自己的大学过得充实有意义，你会发现时间是个多么宝贵的财富。所以，交通很重要啊。  关于你选的专业，云南大学的计算机专业好不好我不知道，贵大的计算机还是很不错的，是贵州大学的老牌优势专业。但是由于贵大在搞通实教育，第一年不会学什么专业知识，并且阳明学院的管理有时候也是也是比较乱的。但是到了专业学院可能就会好很多了。  注意一点，贵大有个什么软件工程专业，一年的学费大概是1w+，好像说是和企业对接的，具体不是很清楚，可以去了解一下。  关于考研，我没有办法回答你，我也才来1年。 
贵州考生在贵州读贵州财经大学好还是武汉读湖北经济学院好呢？,你好，不知道你还在不在。我是今年17届的考生，想必你也已经和我一样填写了志愿。  我是贵州的，和你一样的曾经为这两个学校纠结。首先是，湖经的知名度并不高，甚至很多时候大家都会为了学院这个字眼而轻视。但是在湖北能进去湖经的宝宝们都是高出一本线几十分的。综合来看其实湖经的专业素养方面比贵财好，但是名气并不大。  我希望我能够走出去去看看一个不一样的世界，也许是这个原因让我选择了湖经，但是因人各异，如果你是在贵州工作的话，那么贵财会是你不错的选择，因为贵财的区域名气和人脉还是很好的。  希望你看到之后，能给我说说你到底选择了那里吗？
贵州大学624生物化学？,《普通生物化学》第四版   作者郑集
怎么评价贵州大学校长郑强这个人？,刚在学校听完他的演讲，说实话，一开始他的几个观点给了我一种耳目一新的感觉，因为很少有教授敢在公众讲这些东西。但是在等了一个小时才开讲又听了他吹了一个多小时自己如何如何牛逼后。我知道这个人肚子里的干货实在有限。  在演讲一开始，他就亮出了某宝老大某云的照片进行抨击，认为大学邀请这样的商人来演讲败坏了大学的文化风气，还说欧美的大学和媒体绝不会邀请这样的人云云，这一点我实在不敢苟同。整个过程他宣扬的就是爱国，当今教育，传统文化之类的，时不时还讲讲黄段子，说几句相声，唱几句歌，逗的全场笑一笑。（当然还是在其他学校用烂了的段子）  至于他对中国和中国普通大学生的感情的真实性，我不作评论。但是他那种自卖自夸，哗众取宠的方式实难让我相信他是一个忧国忧民，内心有深度的人。  当然，我看到现场有百分之八十的人都在为他拼命鼓掌，相信他在网上的粉丝还是不少的，所以，喷子们不高兴的话随便喷，匿名就是为了这个T_T创建于 2015-11-29
贵州大学可以辅修第二专业吗？,可以，有辅修  双专业  双学位三种
在贵州大学就读是怎样一种体验？,东北汪在贵大四年半，在我看来贵州大学在贵州省内算是首屈一指，211高校的牌子可不是没用的。省内有什么好事估计也不被无视，比如最近很火的大数据。贵阳的冬天着实把我冻成了一条狗，湿冷的天气让人有一种发泄不出的苦闷。不过夏天还算可以，虽然很热但不用空调也能睡着，偶尔下一场暴雨也是极好的。只在南区和新区住过对于北区唯一的印象是妹子多，而且漂亮妹子多。但是没勇气去撩一个也算是遗憾。南区生活氛围比较好，学习一年有点被放羊的感觉。新区宿舍很好宽带也不错外卖更是方便所以很多人颓废了下去（我也是有过一段浑浑噩噩的时光，回味一下也是无比后悔）。新区还正在建设，以图书馆为中心建成之后与北区融为一体，各种美好画面，学校也是下了血本。食堂嘛南区食堂是好，夏天的炒饭让我念念不忘，食堂菜色比较全，味道也比较好。早上的豆浆油条我吃了将近一年，偶尔出去吃点火锅就是不敢多要肉。新区东西就稍微贵一点不过现在也好了不少尤其是外卖。食堂也就是开学时热闹一点罢了，其他时间也就那样，饭粒很硬建议换成五常大米。学风什么的我实事求是说贵大愧对211这个牌子，老师里有学识渊博谈吐风趣的，比如教英语的沈老师，讲机械的蔡老师，也有花大力气引来的985年轻博士肖老师。但也有不少老师讲课无聊靠点名维持到课率我就不吐槽了。学生里两极分化比较严重，自习室学到11点的每晚都有就是不多，打游戏睡到11点的每层宿舍（男寝）都有而且也不少。就是看自己了。我是学霸学渣都混过曾经夜夜笙歌连挂五科，后来醒悟拼命考了个研究生。回首望望，发自内心的热爱贵大，怀念南区的炒饭，新区的外卖，在贵大拥有了人生第一项热爱的运动，足球场上我也曾是精灵般的白色少年。图书馆里我也是算别人眼中的学霸，无论刮风下雨都会出现在一楼报刊阅览室做题，笔记或阅读。对于即将来贵大的孩子们我衷心的祝福你们，也许你们刚来贵大时后悔，吐槽，抱怨，想要离开。但那是暂时的，你们会留在贵大并发现她的美。当收拾行李迈出校门，回首一望的刹那，关于她的不好仿佛瞬间被流水冲走，只留下点点金子般美好的画面。最后借用冯骥才的一句话：“呵，生活，你真迷人……哪怕是久已过去的，也叫人割舍不得；哪怕是不幸的，也渐渐能化为深沉的诗。”
我在北京读大学今年大四，想去重庆找工作，我家乡是贵州。应该怎么做，好无助，希望大家可以帮助一下我？,没什么好无助的，都需要你自己度过，建议可以找，但其实别人给不了你建议。 如果是我的话会选择留在北京找工作，虽然北京压力很大。
如何看待恒大抽调1500名校招大学生去贵州大方扶贫？, 06.06更新：已经离职恒大，跳槽啦  ------------------------------------------分割线-------------------------------------------------------  利益相关，本人恒大家属，本来打算今年结婚，目前男朋友已被选上抽调去大方。  扶贫这件事恶在3点：  1. 不服从，就问责 的一贯作风。从不反思自己的决策是否有问题或者执行手段有问题。  2. 信息的彻底不对称 。我想你跟一个公司签劳动合同之前，你一定会关注你会在哪工作，工作做什么，你可以得到什么这三点吧。为什么你签了合同之后，公司对你有了调动，你就失去这些知情权了呢？就得一脸懵逼地接受调动。  3. 视对员工的人文关怀为粪土   ---------------------------------------------下面说事---------------------------------------------------  我男朋友也是校招进的恒大，在他在恒大的整个过程中我彻底见识到了，一家公司是如何把，不服从就问责，体现地淋漓尽致的。我承认，作为一名公司的员工，工作上是应该服从公司利益。但是，这不意味着公司对我可以 肆意索取 吧。   恒大恶心就恶心在，天然的认为员工该服从一切，不服从就对你做道德审判，就问责，选择彻底无视颁布的那个任务是否具有合理性。  比如公司发通稿，会要求所有员工集体当水军，每人得转评多少条，还要截图证明上报，请问公司有什么权利占用员工私人的朋友圈、微博这些私人关系链？  比如那个所谓的打击官僚主义办公室，必须得上报人选被打击一下，我想这个办公室就是形式主义这种官僚特征的最好代言人了吧。  又比如恒大金服上线，每个员工必须拉到多少人下载注册app，否则就怎么怎么样。  再比如这次扶贫。   扶贫的文件发下来，几个关键词是，人员范围是本科毕业5年以内的，选派期间每月补贴3000元，根据扶贫进展情况原则上半年到一年可返回原单位，轮岗期满后特别优秀的予以晋升嘉奖。  每月补贴3000元，那本来在原岗位工作每月该得的奖金还发不发？  原则上半年到一年可返回原单位，原则上是指什么？有可能的变数是哪些？  特别优秀的可以予以晋升嘉奖，特别优秀的标准是什么，特别优秀占全部被抽调员工的比例有多少，或者起码有一个大概的说法吧？   就算恒大真的弱鸡，做一个1500人的集体工作大调动（甚至都涉及到工作城市变迁了），就是如此仓促想不清楚细则，只能用模棱两可的话术。那起码你们也稍微有点人文关怀，告诉一下员工那边的生活情况，好让被抽调的人有个准备吧。可是呢，什么都不知道。住在哪里，在哪办公，那里的生活情况是什么样的，公司没有给任何信息。全靠猜，或者和已经过去的同事打听。当然，要求恒大能给被抽调员工发布一条大方县生活工作小贴士，实在是太难为他们了。毕竟这家公司加班是无偿的，工作中的大额经费都要个人先补贴，报销一拖就是大半年，而且 零年假 ，连请个婚假都要看领导脸色。   抽调去扶贫整件事，从头到尾都是信息不对称的。没有人知道过去了具体要做什么，对于个人发展来说到底意味着什么。一切都突如其来。   最后我想说，我敬佩愿意承担社会责任的企业，如果这个世界上可以因为我们的努力，少一个人挨饿受冻，这都值得敬佩。  但这并不意味着你有资格站在道德高点上斥责我，为什么不离开自己的家人去扎根别地，去奉献去付出。正如另一个知友所说的，提供参与公益的机会，和强迫弱势的大学生去扶贫，是两件事吧。  扶贫是件好事，但被你们落实地真心恶心了。   只有对自己不自信的人，才会一直选择用淫威强压他人吧。  就算你做的扶贫如何利在千秋，也不会真的让人对你拥有敬意。因为你并不伟大。  我也坚信真正伟大和现代化的公司，对待员工不会如此粗暴，视人文关怀为粪土。做公益也不是为了面子工程，而是这家公司真正的价值观是希望这个世界变得更好。 
贵州大学附近的环境和城市生活怎么样？能不能吃上大排档？,谢邀。 看你的问题你应该是2016级贵州大学的新生，我把你的问题拆分成3个问题一一回答：1、贵州大学周边的环境；2、贵州大学周边的城市生活；3、有没有大排档。 解答： 1、贵州大学处于贵州省贵阳市花溪区，环境问题很好的毋庸置疑，正所谓爽爽的贵阳，而花溪区也算是贵阳市最凉爽的地方了，在其他地方已经很热了的时候这边晚上睡觉都还要盖被子的。你是贵大2016级的新生，新生的话都在贵大的新校区，4人寝（上床下桌）或6人寝。 2、贵州大学周边的城市生活即为花溪区的生活，花溪区有美丽的平桥、花溪公园、花溪湿地公园，对于生活而言，虽然没有大都市的繁华，但是也少了喧嚣。但是花溪却是一个休闲度假的好地方。城市生活：好。 3、大排档的话我不知道你指的是哪种，我理解的是晚上撸串的摊子，这个是有的，还很多，不过学校旁边没有多少。既然你问到了大排档我也跟你讲讲其他的，这边也有很多通宵营业的KTV，而且价钱也不贵。 另外，作为你将来的学长。贵州欢迎你！贵州大学欢迎你！！
贵州财经大学图书情报专业硕士如何？,呃呃呃呃。这个我可以强答一波，今年贵州财经图书情报专业是第一年开，分相对低。然后我是从会计专硕调剂到图书情报。所以说，这个学校的这个专业还没人体验过。学制3年，学费略贵。  环境好，山清水秀的，宿舍两人间，独立卫浴。我就知道这么多。剩下的等我读一段时间再追评。 
怎么向大学同学尽量好的介绍自己的家乡:贵州。才能显得不卑不亢？,童鞋你知道茅台酒不？
贵州师范大学的学哥学姐们，我想问问贵州师范大学好考吗？谢谢，我是贵州当地的。,好考……比较好的专业是汉语言和数学吧，反正也就是个二本专业，在贵州的话还是比较好找工作的（但是只会是很普通的初中之类的，因为现在很多好点的学校收的都是西南大学免费师范生之类的），宿舍条件……除了没有洗澡间都还不错，上床下桌，老停水。（我不是贵师大的，不过我妹妹今年高考，我问了很多贵师大的同学，仅供参考）
贵州大学？,感谢邀请，我是光晶哥， 贵州大学（Guizhou University），简称贵大，创始于1902年，位于中国贵州省贵阳市，是 教育部   与 贵州省人民政府   合作共建的国家“ 211工程   ”全国重点建设综合性大学，贵州省属重点综合性大学，全国本科统招第一批次重点大学。是“ 卓越法律人才教育培养计划   ”“ 卓越农林人才教育培养计划   ”和“卓越工程师教育培养计划”重点建设大学。 2012年成为教育部“ 2011计划   ”协同创新中心牵头高校，入选教育部“ 中西部高校综合实力提升工程   ”成为教育部在西部地区重点建设的14所高水平大学之一，“ 中西部高校联盟   ”成员，中国最早创办的大学之一。 贵州大学历经 贵州大学堂   、省立贵州大学、国立贵州农工学院、国立贵州大学等时期，1950年10月定名为贵州大学。与贵州农学院、 贵州工业大学   等院校合并，2012年12月，成为教育部与贵州省人民政府共建高校。 学校在校全日制学生54279人，研究生6533人，在职职工3922人；学校占地面积4285.56亩（不包含新校园扩建二期工程）。图书馆现有馆藏纸质文献310余万册，中外文电子图书201余万册，中外文数据库43个。
贵州财经大学怎么样啊？,可以多来对门我们这边找白衣天使
我是贵州2017年考生，分数530超一本线74，被录取到了天津外国语大学，教育技术专业，这个学校好不？,你是哪的人啊？怎么可能超一本线这么多？
2017年贵州高考理科563 省排名4600有多大把握上厦门大学临床医学?,小透明竟然收到了邀请，可是我不是学医学也不是甘肃人。 但是我要强答一次。 首先声名三点:1我们只能是建议，如果你自己后悔你的决定你只能抽自己嘴巴而不能怪我们。2你真的要学医吗，慎重啊孩子。3其实我感觉哪个大学都差不多，自己的人生态度更重要，每个大学都很努力的给你们创造机遇。下面开始建议  首先，高考是一件严肃而重要的事 。 高考，决定了你的未来，这是人生最重要的转折点。别和我说以后你还可以转专业，改变人生，你的人生基本定型了。这是一项高风险但是高收益的投资。但这绝对不是让你选择最保守的方案，你参加高考是为了和别人不一样而不是一样。  其次，青年人给你的建议比爸妈的更重要。  我是来自一个高考大省，对，就是分数线很高的那个。这个问题很有趣的，在于提问者给出了名次而不是分数。对于分数的说明没有任何意义，你的排名更重要。全省4000多的排名，说明楼主成绩很高，这个时候一定要选对学校。估计985能去，而且是很好的那种。 这里要说的是，老人们给你的建议都很有限。我说的老人是指正经历过大学人之外的人。他们有的读过大学，有的没有，他们只能按照他们的思维方式给你建议，但是请想一下，我们这个日新月异的社会，很多想法跟不上时代的发展，他们认为的大学或者专业，和实际情况差别很大。我不否认他们很关心你，为了你好，但是别人的建议有多大参考价值，请慎重。  最后，眼光决定了你的未来，永远不要在你能看到的尽头拼搏 。老实说，我妈希望我读完大学回去考公务员然后结婚。但是这不是我想要的生活。我也同意这种生活压力很小，我会生活的很舒心。但是，你是年轻人，要有长远的眼光。我的建议是，去大城市看看，当你的双眼睁开了，你就不想闭上。不论你去哪所大学，也建议你能够出国看看，世界还是很不一样的。(不过我还是觉得国内比较适合我) 最后的最后，说点正题吧，我没去过厦门，所以也没有到过厦门大学。不过见过很多厦大的交换生，厦门大学很不错，实力很强，最近国内排名蹭蹭涨。听说校园环境优美，是中国最美的高校之一。一起来看流星雨就是在那里拍的。宿舍都是海景房。 以上
贵州大学是个怎样的学校?, 只能说你见识短，少和在外面读书的同学交流吧，不然到时候你自己该怎么看这条帖子 
西南大学还是贵州师范大学？,录取人数和参考书目之类的基本信息你自己不会找吗？这也要伸手？？？  西南大学和贵师大不是一个梯度，没能上西南大学调剂去贵师大还差不多。  作为一战西南大学失败二战华师的人，我忍住想要黑一黑它的冲动，认真劝你，要么拼命，要么换学校，西南大学的分数很高。  求稳的话，贵师大吧，在一个学校待六年又怎么了，熟悉的老师熟悉的套路熟悉的环境熟悉的城市，当一个老司机岂不是美滋滋。
如何看待贵州大学校长郑强？,他现在我们学校的校长。他平易见人，经常跑到教学楼看我们上课的情况，去寝室看我们的生活起居。为学校做了很多事，一来就整顿学风。贵州是个麻将盛行的地区，赌博风气很重。我们学校周边很多麻将室。他除了要求我们学知识的同时，也要求我们有道德有理想。他亲自带队到学校周边去抓赌，手段严厉，处罚严厉。以前考试作弊处罚不严厉，他来了之后作弊被抓到的轻则留校察看，重的直接叫家长来领走了。。。现在我们学校风气好了很多很多。强哥挺好，他敢说，他也真的有在做事。
怎样看待贵州大学校长郑强的“很多理工科学生没有情感”？,事实上中国理科学生虽然比文科学生智商高、占用教育资源多、毕业待遇更好，但的确既没有做好马桶盖又没得诺奖。  结论：和平奖和文学奖早该滚出诺贝尔奖了，简直是对于科学的侮辱。
贵州文科考生578分，在北方工业大学和贵大间纠结，贵州大学是211而且离家近，但是北京是大城市，所以？,贵州大学。 北京生活费贵，而且有211就去211
