参加天津大学和海南大学联合培养项目，是一种怎样的体验？,每年都有海大的同学来天大学习呀，这个，我们班就有同学。天大的学习生活管理和海大有不一样吧地方 来了能适应就好。
海南大学的普通讲师待遇怎样？,海南大学的待遇是出奇的差，讲师的话，一年工资，课时，津贴，奖金等加一起总收入8万吧。  当年我D类人才引进去海大一听这待遇就把合同撕了。
海南大学会计学怎么样？, 安徽大学也是211... 
海南大学宿舍环境怎样？,这个真的要看运气和人品
山东人或北方内陆人，突然想去南方沿海甚至海南上大学，该怎么准备或注意什么？,多看社会新闻
河南文科500分能考海南大学二本嘛？,额，会计学专业是一本专业……海南大学现在貌似所有专业都升一本了～
海南大学的俄语专业（商务俄语方向）在哪个校区？,大一在城西校区，大二会搬到海甸 文科都是这个套路
今年考上海南大学，应不应该复读？,去年的这个时候，有三个人这么问我，我都建议复读了，后来有两个人真的去复读了。海南大学和大部分211学校一样，只是海南这个地方不是每个人都能接受的，话说回来如果不是因为在海南省，它作为一个211学校分数也不可能比其他学校低了快二十分。上了大学之后会发现，复读的人并不在少数。 可是，现在我发现，复读分数比去年高出一个档次的，并没有多少。除非是第一年发挥失常了。去年被劝复读的是上交大那个水平的学生，但考试的时候生病了，落到了海大，这种情况当然可以考虑复读，可是第二年难道就不会有意外了吗…因为多学了一年的时间，所以第二年哪怕还是这个水平也是复读失败。 复读不是一个人的事，是一个家庭的事。如果你父母这一年并不太辛苦，可以复读一年，一年换一份跟随一辈子的第一学历是值得的。但如果这一年家人已经心力交瘁了，就没必要折磨家人，来海南大学念书并没有那么委屈。刚刚和一个本科园艺考研到pku的学长聊完天，他感觉，还不错。上学之后能感受到和其他同学的差距，但是如果不是985，211大学都差不多。 我男友现在在北大，他们学校的氛围和海大简直是天壤之别，但也没有什么不可逾越的鸿沟。其他学校……类似于大连理工、重庆大学、湖南大学、北京师范等等等等，从就读体验来讲差不太多，海南大学只是学校硬件设施逊色一些，其他的资源其实没差。
在海南人眼中，海南师范大学怎么样？, 海大和海师大在海南的地位就跟清北在国人眼中一样的地位。（感谢楼下纠正）  其他大学在专业上可能不输二海，只是知名度差距太大。 
海南师范大学不给学生装空调，现在白天都是三十六七度，风扇吹出来的风都是热的。我们应该如何维权？,如果你想维权，首先你得知道对方侵犯了你什么权利。大学应该给学生装空调吗？如果你能回答出来这个问题，就可以去维权了。
我能不能上海南大学？,海南大学不是二本院校吗？
男友在内蒙读研一 我海南上大学马上毕业 男友让我去找他，且男友有读博打算，将来又要换城市，我该怎么办？,关于前途的事请除了父母不要为任何人考虑 以后后悔的是自己
海南省的新农合在中山大学的肿瘤医院可以报销吗，报销多少？,谢邀 就目前来说，社保及医保的政策并不具有全国统一性。所以还是建议找到当地社保部门的电话进行咨询。
海南大学毕业在内地难找工作吗？,跟学校无关，跟你有关系。
海南大学联合培养？,如果去了天津大学 首先自身的实力也是有的  但是天津大学管理很严 动不动 不好好学没有成绩 退学什么的 还是挺吓人   我就是海南大学 也想去天津大学 但是力不从心
海南大学的应用化学专业及其就业前景怎么样？,你可以往化妆品行业走。
请问海南大学选修专业可不可以跨校区？？？？？,啊，选修专业是第二专业的意思？如果是第二专业的话是可以修的，不过不给学位证，如果要转专业的话，去年排名是年级前百分20，要转法学的话，还要考试。
2017年海南上大学生活费大概一月多少？,龙昆南校区的话，吃的倒不是很贵，选择也多。 公交路线也多，去哪也算方便。 其实说预算一个月要多少钱，倒不如你第一个月带多点钱，就能估摸着能用多少钱。 毕竟这也不好说。
海南大学文艺学的考研书目？,谢邀，同学这个问题有必要在知乎上问吗，有问的时间早就查出来了，自己上学校官网研究生专栏一目了然
海南大学和南京工业大学选择哪个？,居然就这么被邀请了 受宠若惊 但是对不住了学妹 学姐其实知道的一点儿都不多   我不了解海南大学 你说的那几个专业 说实话在南工也都不是强势学科   只有一条建议 能去211 就尽量还是去211吧  你要知道学姐的某个学姐想去参加某知名大学的夏令营(可以保研的那种) 结果报名的时候  报名条件上 明确要求 要985和211的学生 双非再好 和985 211的待遇上还是有差的    
本人大二海南大学，想考重庆大学的风景园林研究生，我想问问好考么(⊙_⊙)，大家有啥建议？,重庆大学的风景园林专业难度较大，毕竟是老八校嘛。17年一共招收12个专硕，5个推免，也就是说只有7个考试名额，大概有200多人报名考试。 重大考研非常看重快题设计能力，手绘能力占总分比重不大，也很看重出身，如果是海大风景园林专业的学生，出身还是没问题的。 如果想要考上，最好到重庆这边来报班学习，有专门针对重大的机构。现在主要有两家机构，一家是风暴，一家是筑城，各有优劣，但是我个人感觉筑城好一些，因为风暴人太多，而且方案教学相对不强，筑城的话手绘还可以，方案是他们的优势，而且老师太负责了，每天不画完不准回去睡觉，而且会守着你画，有问题也会非常耐心，我就是报的筑城 学弟加油
我河北理科学，今天高考592分，上海南大学可以吗？,第一次被邀，有点小激动。必须认真回答：按以往的录取线，和今年河北理科省控线525，感觉高这么多分报wuli海大有点亏，建议报别的学校（友情提示填报志愿211，985这个对今后发展很重要，好像走偏了）如真的看中海大，应该比较稳妥。谢谢看得起我的母校。
报考海南大学，在想如果被调剂到旅游管理，以后转专业会很难吗？成功概率大吗？还有本一录取的宿舍条件概况？,学姐占个坑，改天再来回答 。。。。。。 回答如下。 不管是哪个专业，转专业都是一样的。看第一学年的总成绩，在专业前几就有资格申请转专业，具体细则在开学发放的学生手册里面都有详细说明。   其次是住宿条件，大一文科生都在城西校区，据说住宿条件很棒。大二旅院住宿全校最棒，不限电限水女生门禁12点，男生没门禁。全校停电旅院都不停电，线路不同。同时，全部四人宿舍，有空调，下楼就是旅院食堂和独立商业街，距离各大教学楼最近，北门商业区小吃街公交站步行五分钟。生活方便，一不小心就变懒～
海南大学紫荆公寓怎么样？,限电，门禁，有电梯。新宿舍，硬件过关，软件吐血。做好心理准备。 还很偏远   在右下角一大块黄色区域的左上角就是紫荆。哪哪都离得很远。
海南大学金融系怎么样？未来如何规划？,准学弟？   分几方面来讲： 1.知识是哪里都可以学到的。全国高校都属国民教育大学本科系列。海南大学作为省部共建的211高校 应用经济学学科体系建设是合理的。 2.金融属于应用经济学范畴，首先要掌握经济学，而经济学的学习有 初级 中级 高级 三个阶段。对应 本科 硕士 博士阶段。 3.金融有俩大方向：资产定价 、公司财务。数学基础要打好。 4.研究生最好 再考去 教育部金融重点学科高校 比如西南财经大学 武汉大学 中山大学等    5.近年毕业生 就业质量也不错 合资投资银行 银行总部等。 总之 好好学习 好好享受海南的快乐时光。
在海南师范大学就读是怎样的一种体验？,二更 —————————————————— 补两张环岛实习图         收到很多私信，感谢大家的信任~   不用依赖任何人做你的入学导师，自己的路还是要自己去闯闯看，即使是弯路也许有另一番景色。 没有人有资格给你的人生定义并左右你的选择  关于我们学校老师怎么样？  大学是个绝对自主的环境，绝大多数老师是不会过多管你的， 但也不妨碍真心换真心，面对老师和学长学姐们多点礼貌  在此表白旅游学院屋里霍研如女神_(:3」∠)_严肃的笔芯！！！ -----------------------------------------------------------------------------------------------------  原答案  2012级旅游管理班毕业生。 既是体验那学院和专业因人而异，主观的对学校生活给大家一个参考吧。  海南名义上而言只有两个大学，海大和海师。这里所言的海师指龙昆南校区。 男生住在金鹏，学校对面隔一座天桥。（四人间） 女生刚进大学基本都住四合院（八人间，一般六到七住）随后会搬到9栋或11栋，13栋。（四人间或六人间） 第一年比较辛苦，四合院比较破且挤，但搬了宿舍就好了   2017年入学新生应该有机会享受新装的空调，硬件设施和厦大中传当然比不了。田家炳教学楼在陆续更换桌椅环境不差。但细化到专业方向，音乐学院琴房去过几次也还可以。其他物电生科就不懂了。普通学生上课在田家炳教学楼，体育生在黄华康体育馆，音乐美术生在音乐楼（当然还有部分物电学生在物理楼，生科学生在生科楼，初教地理旅游没有自己的楼，因为穷。。。。） 看你们专业在哪个校区，新校区羊村另谈   学术氛围不严谨，考试相对而言较轻松    大学期间悟出一件事，类似旅游管理这种专业，除个别科目限制或个人智商限制。期末考试所有科目（包括数学）都可以在两个星期内全部学完以应付考试。  当然如果绩点想要刷4.0以上的忽略我上面这句话，极其适合我这种学酥，大学期间基本可以吃喝玩乐虚度光阴临阵磨枪，期末考试分数控制在80左右过线就满足~   期末考试定三点的闹钟起床背书也是好几回了，万幸的是，只是平时缺席不过分并且不太笨，老师也不会刻意为难学生。  （不过学姐还是建议用心考试比较好，不论是奖学金还是出国绩点都和考试成绩挂钩，以前觉得大学嘛~及格就好，大四申请学校是卡在了平均分上，又申请重考刷分，以至于每逢遇到辅导员都被逗趣说少壮不努力老大徒伤悲，海师的科目基本不难，考前多用点心，争取平均分达到85+对你们而言不会有坏处）    一个掉在了0.15绩点坑里的学姐抹着泪的劝告~~     海南夏季从四月底开始热，几乎要热到十一月，六七月为高峰，气温一般hold在35度掉不下来，这时候冰淇淋就是必不可少的。  清补凉也是消暑必备，分椰奶，椰子水和沙冰清补凉。  类似烧仙草但胜于烧仙草。     海南夜生活12点才刚刚开始，如果你习惯早睡，这个学校估计能完全颠覆你的作息规律。  二十四小时不断电~~~~~不断网~~~~~我会乱说？！！！！！！   整个宿舍常常十二点还精神抖索，我这种夜猫子三四点醒着听摇滚是常事。当然我这样的人也不多。  所以学校东门的宵夜摊呢，烧烤炒粉是标配。    当然，也会时常被你的朋友圈po图说海师抬头随手一拍就可以做明信片。  海南的天空和空气确实好，清爽干净，黄昏时候也挺有味道的，但不要觉得这样多适合谈恋爱，夏天热得两天人满身汗看你还有没有力气谈恋爱。   偶尔碰到台风天，也许你们还能共患难~  图为威马逊台风实拍，断水断电没信号，在宿舍避难第二天睁眼学校成了灾难现场。  但狂风过后的normal day还是比较有看头的，我们旅游专业的实习老师带全体学生环岛游，图片不用后期随手都是风景。   --------------------------------------------------一条忧伤的分界线--------------------------------------------  因为在学生会呆了三年，我会着重介绍学校活动和学生会。 大一小鲜肉基本都乖，扛住军训就是一年一度疯狂的团委学生会社团抢人招新。 团委主要负责团组织工作和团干培训等，包括办公室组织部等。 学生会气氛较为轻松，主要负责十大歌手毕业晚会等学生活动，包括办公室文娱部。 团委学术气氛强于学生会，社团数量较多，是学校组织单独独立出来，包括口才协会，摄影协会，加入协会与任职团委学生会不冲突。 同时还有学校广播站播音员等比较有意思。  开学招新过后的第一个活动是运动会。每个学校都那样~不多介绍。如果班级和学院的荣誉感强，积极性也比较好，那么运动会还是比较有意思的。   元旦游园。 跨年当天，学校统一发饭票提供所有学生的晚餐（加鸡腿~）每个学院准备各自的元旦游园门和吉祥物。每个学院两到三个游戏，赢得可以获得兑奖券，由学校提供奖品。   运气好的话在度期间可能碰到校庆，学校对于学生活动基本一个几百块钱幕布了事，但校庆确实大手笔，在黄华康体育馆，音响设备和灯光都不错，据说当天LED屏砸了13万？（打个问号）     两年一度的十大歌手和每年的毕业晚会。     我特别庆幸当时误打误撞的留在学生会，一留就是三年 自愿并有机会的前提下我也鼓励大学生参加学生会 对于海南师范大学而言 团委办公室组织部工作内容要稍微多一些 学生会办公室文娱部是我熟悉的两个板块 协会找自己感兴趣的参加就好，轮滑协会经常在图书馆轮滑看起来还是比较有意思 参加协会好像是一年20元吧~  扩张人脉。这是最重要的，除了舍友舍友和同学、你有机会接触到完全不同专业领域的校友，增长见识。当然，如果你的上司足够厉害，你就赚大发了，部长或主席团身上可能会某一个点是值得学习的地方～ 也庆幸当时带我的办公室主任，高压任务高压环境练就后来天不怕地不怕的气场～   更何况～～～ 万一哪个部门有看对眼的呢，大学恋爱不易还不抓紧机会？哈哈哈哈哈哈哈哈   ===========================又是一条分界线===========================   海师四年，闲言碎语几句 海师作为全国最普通的二本学校之一说好不好，但却不忍心责备他什么 评论里愤懑的抱怨我能理解，毕竟师傅领进门修行在个人，大学成就了你什么? 把自己一无是处归罪于你的母校，去哪儿都是一样的辣鸡。   同一块土壤，既长参天大树，也出一季杂草。    海南大半年都是高温，多备夏装，冬天两三件大衣还是要有的，毕竟台风来了冷空气一吹谁也扛不住。 中国城校区休闲娱乐轻松无压力，羊村不敢说话哈哈哈！  海师的辅导员和老师大多都亲切又可爱。  我原属地理与旅游学院。 我们学院的辅导员在这里要给一个大大的赞！ 一方面给学生足够的自由一方面又懂得把握住底线。  要和舍友处好关系，性格合不合看多能包容 我不是师范专业，脾气很爽说话又直，我妈一直担心我第一次住校会和舍友起冲突 完全没有！  大学以宿舍为单位，舍友就是你的家人  可能是六个人本来就合气场，有彼此懂得分享，迁就和包容   舍友才是最直接分享你喜怒的人 希望即将步入大学的你们，真的。 不用太计较，吃亏是福~   旅游是个吃喝玩乐的专业，我们平时上课，还会教西餐摆台，制作咖啡，意式浓缩卡布奇诺巴拉巴拉挺有意思的~  高尔夫管理的老师巨有趣！！！   =======================最后一条分界线===============================   如果你的家庭经济条件能支撑的情况下，兼职不是必须  大学生体验兼职我举双手赞成，龙昆南校区又在市内，基本兼职都是以家教为主，肯德基麦当劳也会有，个人意见是体验即可，如果不是有超人的智慧能寻找创业机会，不必要花大量时间挣这微薄的收入。  四年期间走了不少弯路，我认为大学最重要的三件事：   1.保持GPA，考取相关证书。  （虽说大学过了及格线就不会耽误你毕业，但绩点和平均分能保持在85绝不是坏事，和四六级证书一样，你不知道什么时候，它就成了你的敲门砖）  2.多参加校内活动和学生组织。   3.不间断尝试明确你的未来规划  （工作？考研？出国？ 有的人到大四了还想不清楚这个问题，比如我。 哪方面的工作是不是要从事和本专业相关，考研考哪个城市什么学校，出国又去哪个国家？ 我决定做的非常唐突，去北京做了和酒店管理相关的工作实习觉得自己不喜欢，当即换专业决定出国。也导致我大四几乎都沉浸考雅思的阴影里，前三年基本没去过图书馆，大四基本都泡在图书馆。 大学比较遗憾的事就是不知道第三点的重要，没有利用碎片时间学习英语和拍电影，现在才来矫正方向，已经落后了别人好多步。 海南师范大学不像中国传媒大学那种专业性很强的一流学校，聚集那么多优秀的资源和导师，所以一切要靠自己，不断的摸索。 也希望能看到这篇知乎的学弟学妹们，无论你们选不选则海师。国内学校资金分配不均匀也会导致学校师资力量分配的不均匀，如果你未来规划和自己所学专业无关，那么  靠自己不断的尝试和突破，  可能也会不断的碰壁，  才是你们大学真正要做的。  祝好！
我今年高考完了录取去了海南大学，被调剂到我不喜欢的专业，加上本身我也不是很想去这里。我要不要去复读？,要。不喜欢阻碍一切。
华侨大学，南京农大，南京师大，华中农大，湘潭大学，广西大学，云南大学，海南大学，该选哪个-_-#？,首选211....其次看城市与专业....根据你所提供的学校，南京排第一...
海南大学mba怎么样？,海南大学在2009年升为211重点大学后，经过这些年的发展，无论是硬件还是软件设施都得到了很大的提升，特别是海南实施国际旅游岛建设成为国家战略后，海南大学作为海南智库发挥了越来越大的作用，近年来，国家实施一带一路战略，以及南海战略，海南大学的热度也不断提升。 海南大学mba的热度也非常高，竞争激烈度不亚于国内的主要的985院校，每年有上千人报考海南大学MBA，学校复试分数划线已经多年按国家A类学校划线，海大MBA师资力量不断提升，教学也不断跟进，预计未来几年，海大MBA的学费会猛涨，如果达到考试条件，有条件的话尽快报考，未来的竞争压力会越来越大。考试过程中，基础差，复习时间不多的人，建议报个培训班，网上有很多类似的网课培训机构，像是太奇，华图都有这方面的课程，海南也有面授，好像是海南大学经济管理学院的教授办的培训班，好像叫海大源，嗯，就是海大源，刚搜了一下，感兴趣的话自己可以网上搜一下，了解了解。
北京外国语大学收不收海南的考生？,我今儿还哭半天就因为这个！！！！同为海南考生！！我在海南中学！！！
在海南大学读研究生是怎样一种体验?,准备去海大读研究生 
我是安徽文科考生。高一本线四分。能不能上海南大学？,二本专业可以吧
二本经济学想考海南大学金融专硕 各位有什么建设性的意见吗？,请问一下楼主的431金融综合买的什么专业书？
请教一下我分数离一本线比较近，选择藏大、海南大学有211头衔的学校还是东南沿海稍有名气的二本院校好呢？,离一本线比较近是没达到还是达到了呢？据我所知虽然海南大学在所有211大学里排名是比较靠后但是对外省的录取分数线也不低呀。照你给的选项我觉得如果你能报211就报211，保研工作什么的有些地方211是硬性要求，当然报不上211就找经济发达的地方读书，工作机会多你也会有优势
如何看待海南大学老师扑灭煤气罐着火？,个人之说，不喜勿喷，错了望指正。 首先，煤气罐着火，不会马上爆炸，因为煤气罐里面气压高，而且都是液化石油气，并没有氧气，就好比一个密闭的空间里都是液化石油气，凭空出现一个燃烧的火柴，这个空间并不会燃烧并爆炸的。但是为什么煤气罐着火很危险呢？个人觉得是因为高温会是气体膨胀，如果煤气罐中的液化石油气从煤气罐某个位置膨胀泄漏出来，遇到空气就会引发燃烧，从而会有爆炸的危险。所以视频那个，老师很快就把火熄灭了，理论上并没有什么危险。 其次遇到这种情况可以镇定的灭火吗？这个得看你自己的心理素质，如果心理素质强，有过这方面的训练，你可以镇定，但不要这么灭火（如果仅仅是跟视频那样着火了可以这么灭），视频那个老师之所以不慌第一是已经有心理准备了，第二就是可能讲过很多次这种课了习惯了，不过一般人看到身边着火估计早就慌了。个人亲身经历过一次，上大学时做实验，我们老师在上面演示，正在燃烧的酒精灯不小心被打翻，酒精就在桌面上燃烧起来，然后，我们老师，就随手拿起了手边的蒸馏水，就随手拿起了手边的蒸馏水，就随手拿起了手边的蒸馏水……结果你懂的。老师会不知道酒精燃烧怎么灭火吗？显然他是知道的，但是遇到突发状况，还是会做错误的操作，就是手比大脑快。所以，一般人镇定不了。 总起来说吧，视频中那个老师估计习惯这种讲课了，所以并没有事，而且那个方法很对啊，隔绝氧气了，所以火就熄灭了。老师用很实际的方法教给学生了，能不能学到敢不敢用就是学生自己的了。 我怎么就没遇到这种老师，难道因为我的老师都是女的原因么？ 以上……
海南师范大学新进博士待遇如何？,可以搜海南师范大学人事处，会有人才引进办法和待遇，每年博士引进大概在五六月份开始，但是实际上任何时间都可以联系负责人（负责人联系方式可以在当年或者去年的招聘附件里找）。具体待遇还要看你联系的学院或者单位，他们最终给你的待遇会有不同，根据你博士期间的科研成果和条件来决定，需要面试之后学校审核完毕时具体来谈。而且有时候一些不定因素，比如过渡房有没有空余，这些需要入职报到时候才能确定。
西北政法的法硕跟海南大学的法硕，就业的话选哪个？？？？,当然是西北政法大学。地理上来说，西安虽然地处内地，但是高校林立，在全国也排的上前几。专业来说，西北政法大学是专业法学学校，学校的侧重也是法学，当初的五院四系之一。海南大学是综合类大学，王牌专业也不是法学。吃喝玩乐：世界四大古都之一，光西安城就够你玩几年，就是没海滩吧。
环艺室内设计专业，一个是四川美术学院毕业，一个是海南师范大学毕业，想申请国外的建筑专业，不知道有什么？,留学当然可以，人家大学开门做生意的，只要你钱到位，他们稍微矜持一下，之后总会让你上的。  但上完之后呢？你又没办法在当地找到工作留下来。回国之后不见得工资增加很多。留学的成本很难收回来的，还浪费了自己几年时间。不是很划算啊！
在海南大学学园艺是不是读外校研比较好。我们老师说如果在本校读研公派出国机会多，我该怎么办?,你哪学的？
海南大学，哈尔滨工程大学，合肥工业大学哪个好?,合工大啊。
在海南大学上学好还是出省去经济发达的地方读书好？,如果本来想学专业不是学医这类不能转的专业，那就无所谓，大学再转就是了
海南大学信息与通信学硕调剂如何 ？,全国40+的排名 算重点学科  不过本科的大神们都不屑就在这里
