去海南读大学有什么注意事项？,  抱歉我是今早才看到的，所以回复晚了      行李必备    旅行箱（拉杆旅行箱，背包各一个）  钱和卡（拿到学校那张卡后记得充学费进去） 鞋子两双（开学一段时间很忙，估计没时间去买，而且新到一个城市不熟悉） 笔记本电脑（大一上也是可以带的） U盘，手机及附件（充电器、电板、耳机、充电宝）手机（把通讯录先准备好，到学校后再换卡，出门在外贵重物品莫外漏放进包里）  睡衣、袜子、内衣裤和换洗衣物，被套（这是最重要的！！海口虽热，冬季衣物也别忘了带几件，不过没冷到带羽绒服的地步，怕冷的还是带吧） 镜子、梳子以及头绳首饰等（女生）  纸巾类（女生懂就行） 笔(黑色中性笔），一个小本子  身份证及复印件 团员证等证件以及转团关系的资料 照片 (⒑张左右，4寸，2寸都可能会用到，2存多备一些) 户口本、户口本迁移证（想迁户籍的带） 汇款凭据 家庭情况表（方便申请助学贷款） 准考证，录取通知书  牙刷和牙膏   选择的交通工具有火车，轮船，飞机，是个人情况而定  准备好一些零钱用于打车或坐公交，免得到时候手忙脚乱的  还有就是防晒很重要，海南紫外线超强色素容易沉积  至于台风，来之前你得购好吃的东西，准备蜗居宿舍  下暴雨时尽量穿短裤凉鞋，因为很可能你在学校里水都进教室里去了，海南地势低，一下暴雨海水就会倒灌。  暂时想到这些，祝你大学生活愉快！ 
海南师范大学的非师范专业如何？,海师目前几乎所有硕士点都集中在师范专业
姑娘家在陕西，明年大学毕业，非常想留着海南工作，又怕家远，没办法好好照顾父母，怎么办？希望大家一起想?,海南的环境很美  老人可以考虑来海南养老  而且作为本地人来看 海南的房价跟那些大城市比已经算是便宜的啦   而且离姑娘近一些也好啊
我该不该复读，考上海南大学。?,海大毕业生，现在北京大学，海大确实不算优秀，但也没有各位说的如此差劲吧。 首先，环境很好，校园很大，田径场图书馆东坡湖教学楼，这些硬件都符合211水准，这两年校内道路修得也不错，纵横联通，我看过北京的一些211，地方很小，很拥挤，摸着良心讲，就校园环境，真的觉得海大很难得了，反正我很喜欢，满满的美好回忆。但是，宿舍环境确实不好，没啥设施，相信用不了几年会有改善的，记得刚一入校的时候，校园整体还很破落，没几年已经大变样了； 学术不了解，只谈教学，确实跟内陆211高校有差距，由于内陆211高校我其实了解也不多，所以具体差距多大也说不清楚，只是听说中国的本科教育全盘腐烂，五十步笑百步吧。真正具备超脱末流211的水准，高考分数何以落到海大的层次？如果真的高考失误，或者真的不甘心，那就复读；如果没有勇气不甘心，那就管理好情绪，要为自己的高考成绩负责，毕竟是你自己考出来的成绩，顺便说句不顺耳的话，就高考成绩来看，海大没有委屈你； 关于升学，海大好歹也是211，平台也不算差，我们专业五十多人，NO.1，NO.2保研去了北大，本人是考研考上的北大，另有一个去墨尔本大学的，一个保研中科院，还有考研华科东北大学重大南邮等高校，不过没有本校留研倒是真的 很多人说话，给人感觉像是遗落人间的天使，在海大似乎蒙受了很大委屈，我想说，如果高考分数没有超过海大录取线20分，就要明白自己确实只是末流211的水平，比起其他211，海大确实没啥优势，但是你的成绩就是这个层次，不甘心就不来，勇敢复读，既然来了，海大就是母校，热爱自己的母校，无关品德，只是作为一个学生最基本的觉悟，那些读了几年，还动辄贬低母校的人，心性至此，不提也罢
本人就读于海南大学，目前大一，想要考上财或者东财的研究生 请问各位从何时开始准备较好？,建议大学该参加社团就参加，海大竞赛也挺多数学建模啥的，多出去走走，多运动，大一就想这些你会过的很累，再说学校有保送，即使没资格保送考也不难，过来人，加油
海南大学和湘潭大学经济学哪个更有优势？,并不是经济的，不清楚。但是海大的经济类分数普遍都高很多。
如下提问海南大学的情况？,有二本。宿舍有空调。大一不一定分到最好。辅导员抽签，抽到哪住哪。有三个等级:4人有独立卫浴，6人有独立卫浴，6人无独立卫浴。 环境说下雨就下雨随时带雨伞，四月份就开始进入30℃，最低一二月份也有10℃以上。
在海南大学读书是怎样一种体验？,作为一名大一新生  讲讲我现在的感受吧  应该会持续更新   其实真的很意外来到海南  作为一个地道东北妹子  在我们坊间流传着“高考考不好 流放海南岛”的传言  然后我就来啦orz 第一次来海南 一天要换三件衣服  物价也是好贵的啊  海南人口音很像骂人啊  刚来的时候热的连觉都睡不着  但是！！ 空气很清新 热带风情很醉人  喝各式各样的饮品还是很棒的  大学还是很精彩的  周围的小姐姐也好漂亮  ———————— 2017.6.24 现在我已经大二了。 再看一年前的自己已经有很多不一样的想法了。 当初刚来的时候真的是后悔，怀疑留的汗都是脑子进的水。 现在随着日子的逐渐推移，感情也渐深。 从不吃辣到现在面前有东北菜和湖南菜我选择了湖南菜。 再也没有痛过经（原来都是死一般的疼）。 会注重护肤。 喜欢吃南方的小点心，超爱吃炒粉。 会看云，猜测是不是要下雨收衣服，还是放晴要晒被子。 会和朋友在海大校园里散步，也会自己守着自习室的一方净土。 一句老话“既来之，则安之”。 开学就大三了，两年的大学生活，在学生组织里待过，曾深夜改过策划；做过无数的志愿活动，累又快乐着；也曾为雅思辛苦备考着；自己也学会了煮饭… 有的时候，不是大学的问题，是人的问题。无论你上了什么大学，你都会获得一个完全不一样的大学生活，四年很短，但你可以用这四年决定未来你六十年的生活。 海南大学实在不算是个好的211，有四年毕业出来混着个毕业证还不是碌碌无为，也有学长学姐考研北大，留学海外。 人生是自己的，你要拼搏啊。 来一波无滤镜图片，我学弟拿单反拍的。                          最后，游泳馆，不知道是芒果树还是木瓜树。
对于海南大学将农科类三个学院搬去儋州校区怎么看？,谢邀。因为不是农科专业的，最近又忙于各种事情，所以这件事完全不知道。也不知道消息是否属实。 但是联想到学校近几年包括城西校区的调整，可以想到学校可能在下一盘大棋，呵呵哒。之前对文科类学院动刀，现在又是农科，想必是要进行学科调整。 至于13级，并不了解实情，但是毫无疑问，至少对于你们考研的来说，你们应该是被牺牲了。就看学校有没有其他的政策补偿了。 老实讲，学校干这些没头没脑的事情真的是太多了，我倒是挺同情你们的。毕竟，从李校长就空调一事答记者（15年李校长上微博事件后）问来看，校长智商堪忧。
我大学未毕业，男生，打算今年暑假去海南一个月，边工作边旅行，这个想法是否有可行性？,1.可行 2.对海口比较了解，没去过三亚，说说海口。 海口租房我们学校海南大学附近都有月租600左右的房子出租，具体可以去海南大学起点论坛逛逛。工作最好还是先找好，海口这边普通的工作一个月1500是没问题的，大不了每天做兼职发传单50块钱一天也行，还可以去找个家教兼职，大概20-30一小时。海口公交市区内都是1块钱，去快餐店吃饭10块钱左右能解决一顿，所以基本的生活水平600+30*30=1500。可以好好活下来了。 3.4.大学生，没有工作过，不了解工作的情形。
二本金融学毕业想考海南大学研究生靠谱吗？,为何没人回答
在海南大学（Hainan University）就读是怎样一番体验？,更新下 现在有空调了 可是我毕业了啊 心在滴血               ------------------------- 海南大学其实公关做的很好 （详情请见Moses的回答）
在海南大学读风景园林研究生是怎么样的体验?,本人就读于海南大学风景园林研究生，不过本科不是海大的。我想说不管哪个学校的研究生，有忙的有闲的。取决于两点，第一是你跟哪个导师，有没有项目有没有工作室。第二是个人，感兴趣的就算导师没工作也会自己去找实习，不想弄的就算导师有活也可以不做。  其实我挺后悔读研的，感觉三年工作经验更重要，而且海大也不是什么名牌学校。心累(((￣へ￣井)
这个季节在天津晚上可以开窗睡觉么？住大学宿舍，舍友是海南的，她觉得屋子闷要半夜开窗睡觉，求科学解答?,海南人从小被风吹大的 冬天都穿沙滩裤加短袖 用冷水洗澡嗷嗷两下就好了 我是觉得挺萌的\(//∇//)\ 舍友是个海南人 觉得她很萌 我也经常发现宿舍的窗被她打开 不过没发现就不会觉得多冷 发现了再自己关吧 多盖点被子  海南人真的好可爱啊
上海大学不向海南招生吗？,有的年份招有点年份不招，以每年公布的招生简章为准。
我是海南大学，大四的学生，材料专业，专业技能课程没有过，目前也无法补考请问能否毕业？,专业技能有学分吗
在海南大学读书有助于在海南就业么？,大二狗   还没接触这方面呢 不过真的没觉得海南对海南大学的学生瞧不起 不过 虽说如此说母校不好 但是 不建议来这边  只能说是一点都不尊重老师和同学 校长智商也比较有限 办的一些事也是招人嫌 比如之前的空调事件 还有对文科某些专业的整改 以及现在威胁到我们自身的农科三学院的换校区问题 而且学风 很宽松自由 如果自制力不强 来这边基本就是每天都在浪 没有早操和自习 课程安排的也很操蛋  无力 悔不当初 这是我目前认识的所有同学的想法  为三个学院的老师要搬到儋州校区的事倍感委屈 毕竟刚从儋州搬上来不到十年 在这边一切事物安排好了的时候 却告知你要回去 以及准大四的学长学姐们 下学期刚来就要去儋州实习两个月 有些人已经在这边报了考研班 报了驾校 报了各种兴趣班 却只因为学校要把三个学院踢开就损失了这些 大四正是考研的关键时期 两个月对他们来说太关键了 悲哀 当初海大借着三个学院上位211工程 凭着农科类项目获得不少资金 现在却要一脚踢开 悲哀
兰州大学、海南大学哪个好？,在兰大的海南人来一发，有啥说得不对的还请各位校友老乡或者相关人士批评指正和补充   兰大985.211，海大只是211， 兰大优势物理化学和草科 海大优势热带农学，应该还有别的但是我不太了解，似乎一些文科比我兰好一点？？  我兰有萃英山 海大主校区有个很大的人工湖，里面长期驻扎白鹭，  对于题主宁夏人来说， 我兰离家近，生活条件容易适应 海大远，而且生活习惯啥的和宁夏几乎没有相同的地方，  他们说我兰榆中地处偏僻， 但是海大也有个儋州校区 P.S 听家里人说是海大的二本专业才在那里，答主可以自己核实一下  评论里有小伙伴指出 儋州是两院的所在地，也就是之前的华南热带农大。并到海南大学之后，那边自然就是海南大学的校区了。在儋州那边的专业也是之前华南热带农大的专业。  但是答主有认识在那里读旅游英语啥的小伙伴，不知道是不是后来搬过去的  所以建议答主想一下，自己对陌生环境的适应情况如何，尤其是对于南方动不动大暴雨主食只有米饭的生活感觉怎样 因为我在西北吃面是不咋吃得习惯的 以及，考虑一下自己是文科理科，对就业方向专业方向最好有自己的一点想法 最后，高考成绩出来了，就综合评估一下自己的成绩，以及往年的各种线  我爱兰大，毕竟这是4年青春和他乡风情，同样我也慢慢习惯了甜胚子奶茶和牛奶鸡蛋醪糟，以及牛肉面  我也爱海南，毕竟是18年的故乡，椰子汁和清补凉是我一辈子的念想  所以 如果来了海南，欢迎你，我可以给你安利各种小吃， 如果来了兰大，同样欢迎你，下架学姐可以给你兰大生存指南， 最后，祝高考顺利
安徽大学 郑州大学 湖南师范大学 东北师范大学 华中农业大学云南大学 海南大学 长安大学怎么选？,云南大学。有过比以上所有其他学校都辉煌的历史，有着一流的自然环境和硬件设施（硬件设施不输一些名校），录取分数因为地理位置被拉低，大学十分的低调。至于专业，你还是仔细的去详查比较好，都了解的不太全面，随便说的话不客观。
今年山东考生487分可以报考海南师范大学吗？,同问同问，我也想知道
在海南读大学需要多少生活费？,其实物价一般（较便宜），主要是看你怎么消费
我收到了海南大学的录取通知书，上面写着逾期两周取消入学资格，我没有去海大报道 我的学籍还在海南大学吗？,差一点我们就是校友。
海南大学戏剧影视文学专业怎么样？,   直系！这么说吧，海口最近两年在搞海口人艺，调过来很多专业前辈。就近在海大任教了。可以说这几年的学生都是比较幸运的。 但是海大第一年以理论为主。你会很难受你的同学们第一年都已经开始抗摄像机了，而我们还在学一些看似无关的理论。但是你要记住厚积薄发。 上学期邓涵彬老师的剧本写作受益匪浅。有幸参加了15级的一节邓老师的导表课，非常震撼。 虽然是艺术类专业进来的，但是下属人文传播学院。和普通文科文化生没什么区别。大学靠自己。现在同学中开公司的也有。接片的也有。加油。 海大戏文16级在读
海南大学和河南大学哪个好？两个大学侧重专业是什么？河南大学211重点建设学科是什么？, 然而河南大学并不是211 
海南大学的涉外会计的校区在哪？,儋州校区，别来。。。
海南师范大学和湖南商学院哪个略好？,去湖南商学院吧，不要去海师。
在海南师范大学上学是一种怎样的体验？,热成热狗。 十一必刮台风。 蟑螂多老鼠肥。 [手動分割]——————————[補充] 我都不知道我什麼時候抖的機靈  也不是年年十一颳颱風，十一期間大學四年也就颳了三次颱風而已。毛毛雨、不稀奇。 全國各地的交警小哥都很帥； 海南的交警小哥又黑又帥  你們趕上好時候了： 因為裝空調咯     給你們看看圖書館效果圖： 抱歉看不了，總之很帥的～     是不是～
为什么知乎添加教育经历那一栏没有海南师范大学？,因为知乎的教育经历，包括居住地等个人信息栏，完全可以乱填，其实并不没有基于对应的栏目做优化。 当然是可以看到一些候选条目的，比如： 那么题主就要问啦，这些候选条目哪里来的呢？ 本来以为是根据其他用户填写的内容，后来发现不是。  是不是很像！ 所以其实都是话题名。&gt; &lt;
海南大学与厦门集美那个更加适合就读?,看你学什么专业，轮机航海当然来集美，不过女生很少。外语千万别来
广州大学 山西大学 海南大学选哪个？,海南大学211呢，海大优秀学子还是挺多的，上自习都要去占位，要不然晚了都没空位呢！当然不学习的也有，可每所大学这种现象都有啊！缺点就是热，所以很佩服学长学姐在让人热的发昏的情况下还能坚持学习保研或考研到另人心仪的好学校！
内蒙古大学、贵州大学、云南大学、海南大学？, 云南大学，不要选贵州大学。来自一个学姐的诚实建议。  之前去昆明玩过，昆明的交通比贵大好太多了。如何你希望自己的大学过得充实有意义，你会发现时间是个多么宝贵的财富。所以，交通很重要啊。  关于你选的专业，云南大学的计算机专业好不好我不知道，贵大的计算机还是很不错的，是贵州大学的老牌优势专业。但是由于贵大在搞通实教育，第一年不会学什么专业知识，并且阳明学院的管理有时候也是也是比较乱的。但是到了专业学院可能就会好很多了。  注意一点，贵大有个什么软件工程专业，一年的学费大概是1w+，好像说是和企业对接的，具体不是很清楚，可以去了解一下。  关于考研，我没有办法回答你，我也才来1年。 
三本考研，一志愿海南大学，该不该去读？,谢邀。 不想读就去二战要不然就去工作，没啥好说的┐（─__─）┌ 海大至少也是个211，如果你二战能考到一个比海大还好的学校那你就二战，如果宁愿就业也不要来海大那我问你你考研干啥 并且你觉得太远了你之前报的时候不知道它在哪里吗？
澳门理工学院和海南大学哪个好？,海南大学是211吧？
华侨大学，海南大学，浙江理工大学，如果只考虑就业该如何选择。广东考生？,不知道你是文科生还是理科生？  如果是理科生推荐你去华侨大学，华大的理科是在厦门校区的，地域优势比较大，而且华大的一些工科专业好像还不错  如果是文科生的话还是去海南大学吧毕竟211
2016年的安徽考生 想要考海南大学 需要上一本线多少？,别来不好，我也是安徽的
云南大学和海南大学哪所适合学艺术？,海南大学的话 学风慵懒 加上学艺术就有点不合适 如果你比较喜欢旅游并且只是去大学混一个学位 建议你去海南大学吧 毕竟在海南旅游业很发达  来说说云南大学 云南大学也算是大西南比较好的211了相比贵州大学广西大学 云南大学学风各方面也都还好 学艺术 云大旁边就是云南艺术学院 能结交很多艺术朋友 云南艺术学院号称西南最大的综合艺术学院不知是真是假 如果想学好艺术建议你去云大吧。
四川高考理科女，估计2016高考分数在520---560左右，想去福建，广东，海南三个省读大学?,我也是四川理科，估分600多点，今年整体偏简单，听说重本线很高，感觉压力好大~考虑到以后就业谈恋爱什么的，我还是想留四川。不过我这个分数上川大什么的好像有点悬，正考虑电子科大沙河校区或者中外合作班什么的~
海口大学城哪里买电脑便宜？就是海南师范大学或者海南经贸这边。想买一台电脑上学用，电脑城太远了？,网购 就算楼下有卖电脑的也选择网购 具体不多做解释了（ づ ωど）也不知道是什么时候的题了 无聊搜自己学校搜到的 （琼台师范15届的）
海南大学的经济法跟西财的法硕。选哪个？,选西财法硕吧。我是今年开学的西财法硕新生。看你的就业地点和就业方向当然是西财，西财法硕好考的，只要国家线就行。
海南大学难考吗？我是江苏高二学生~,题主是把知乎当贴吧了吧，还弄个镇楼图么？ 首先我想吐槽题和图无关。 其次你只提到江苏，高二，其他信息全无，让人怎么回答？江苏有学霸，也有学渣。 学霸眼里清北都很好考，学渣连一本可能都望尘莫及。  最后给个建议，要么删除问题，要么修改补充问题。
海南地处热带，随随便便就37、38度，为什么海南的大学多数教室和宿舍都不装空调？？？,楼上说本地人不觉得热，是傻的嘛，有没有空调是学生能决定的嘛，抗议了几年有用吗，遇到了官僚作风严重的校长，学生还能怎么办！
求解答海南大学儋州校区怎样 ？,为了学习还不错 为了生活就肯定不如海甸校区
莫纳什&海南大学？,如果莫纳什是野鸡大学的话，那社会主义就能拯救全世界。就冲这一点，你就应该出国。你生活在一个是非不分的世界。
文科考生纠结于北京工业大学（211工科大学）的文化产业管理专业和海南大学（211综合）？,北工大的文化产业管理，学的比较杂，包括基本经管类的课程，营销，策划也有平面设计的，就是偏文艺的管理吧，15届的还没毕业，就业看自己感兴趣那个文化领域吧 工业设计，应该有很多绘画类课程，素描侧重于产品创意设计，大三有分不同设计方向，还有产品管理课程，就业大概就是设计，产品相关类， 我知道的就这么多
如何看待海南大学冬季小学期？,谢邀。 人功成名就之后就会有一个通病 喜欢吹牛喜欢受追捧 所以茶话会式的吹牛讲座听了没什么意义 又不学吹牛 但是也不能说所有人都是吹牛 也不能排除吹牛的过程中有一些能让我们受益的观点 毕竟人家阅历在那里 选择性的听吧一个星期而已 即使放假也是在家玩手机不是吗
云南大学与海南大学的法学专业相比哪个好？,谢邀  今天答了好几个类似这种问题了  你可以在网上查一下法学专业的排名  或者去贴吧 再或者加新生群 总有热心学长学姐会给你详细解答的  但是这些过程也要自己完成  最近老听一句叫劝人学法 千刀万剐  法学不是一个简单的学科  我连皮毛都不算懂  但是你要真的对这个专业很感兴趣在枯燥的法律条文还有案例分析里找到乐趣 那就是很棒了  师资力量个人觉得除了名头响的五校四院以外 其他大都差不多 重要的还是看自己 混日子在哪里都能混  以上是我个人意见  
三本学生想考中国政法大学，本科是经济学，第二学历是海南大学的法律。？,呃…这么说吧 我们本校的学生考本校的研究生都还是要下很大一份苦功的 而且我们学校学生的学霸程度也异常恐怖 按你描述的硬性条件…我只能告诉你非常非常难
考上海南大学，纠结要不要复读。？,同学啊，同安徽，不过第五志愿海南大学录取，不过没想过去复读，什么这个大学好那个大学好的，在我来看所有大学肯定都有优缺点，学会适应才能成长，每一所大学都会给你崭新的生活，说实话，本来也有点低落，不过景色宜人，值得期待，而且里珠三角很近，发展应该还是不错的
油皮去海南上大学和军训用什么防晒霜好？,必须安耐晒
该填报211的海南大学还是位置环境等较好的普通一本？感谢回答！？,211平台还是好些！
江西师范大学汉语言文学毕业，去海南大学读研会好就业吗？,泻药。   说实话没有什么资格回答什么问题 因为我是戏剧影视文学的学生 但我们的课堂有古汉语课 古代文学课 课程老师都很负责 特别是古代文学老师 海老师幽默风趣 只上了他一节课就非常喜欢 声音参考罗胖。  个人觉得海大这个环境非常好 如果你想学 能找到很多资源 气候也好 我是北方姑娘 北方雾霾天儿的时候感觉自己在海南 吸的每一个空气感觉都是钱。  另外 研究生这件事要慎重 还是要问问你的老师 权衡一下自己的能力。  希望不久后可以见到你。
