请问怎么看待南开大学津南校区浴室的设计理念？,拐    弯    那两个喷头的位置已然告诉我们一切~~~~
面临对外经济贸易大学和南开大学外院的选择？,在南开校学生会fly的可能性小于1% 红专好智障啊 南开风气是不是被你们这种人搞坏的
如何看待南开大学2016年的引进人才计划？, 学校意识到了人才问题的突出性，外加新校区的事基本解决差不多了（至少一期如此），已经有精力和财力在人才引进方面取得重大进展了。另外今年天津市外专局也开始大力支持南开，许多海外高层次学者的经费都是外专局出的。 
参加南开大学历史夏令营是一种什么体验？,你应该看重将来高考成绩方面的，这个你看看不知道对你有没有用。。  高考到底为了什么？既然高考不能决定一辈子，我们为什么还要玩命高考？ - vczh 的回答 
南开大学法学院邢禹大神是个什么样的人?,不请自来 985高校法学院本科 辩协扛把子 同为辩论队大神 关键词：撩妹，18cm，两小时 达到知乎平均水平
湖南大学和南开大学的金融专硕哪个好考？,并不，南开的专业课比湖大难，而且南开考395，需要看经济学，南开可以参考我知乎的帖子。
南开大学转专业转到法学？,不清楚(⊙o⊙)…
南开大学 经济学院 考研问题 必须有问号？,书够啦，也有点多啦，重点就看曼昆、范里安多就好啦，高和圣才的打基础，用来答简答很不错。真题淘宝有一家很靠谱的，买过资料很不错，里面有些拔高的知识点和计算题可以重点看看，考前会有几份卷子，也值得做一做。  
如何客观地评价南开大学津南新校区？,2016.4.8更新 接受  @大云豆 的建议，删除了过激的“不如不开”的言论，希望大家关于这篇转载的文章本身。 对于  @杨欣悦 的所谓“爱母校就不要抹黑”言论，评论区已经很多人回答的很好，待我今天下班再来撕。 ~~~~~~~~~~~~~~~~~~~~~~~~~~~分割线~~~~~~~~~~~~~~~~~~~~~~~~~~~~~~~~~~~~~ 什么都不说了，大家直接看刚刚在朋友圈转的很火的文章吧！文章有理有据，可是发出来不到一小时就被删除了，我开干维稳速度！ 
396、395联考是不是竞争很大？不想二战，南开大学国际商务怎么样？,泻药。 这两个联考没有数三那么难，是很多想学经济类但对数学有畏惧感的同学的不错选择，竞争力不会小的。 南开大学国际商务是没毛病的，南开本身就985而且经济学类实力雄厚，名气很大。可学校地理位置比较尴尬，天津虽然是直辖市，贸易港，紧邻北京，但发展一直处于高不成低不就的状态，金融经济类市场，前景都不是特别大。如果你想在天津，或天津周边省份就业，南开是不二选择。 我不太清楚南开国商是不是专硕，就2017年招生情况来看，南开经济金融类专硕还是呈现扩招趋势的。 最后是大环境问题，近几年考研人数逐年增多是大趋势，但18年可能达到最大，因为教育部建设双一流大学的政策，其中一个指标就是深造率，老师们可能会动员大家去考研，造成考研人数剧增。 加油。
考研想考南开大学经济学大类的研究生，请南开目前在读研究生告诉一下南开目前的考验难度和就业前景?,这个我觉得还得具体来看吧，首先看是选择专业硕士还是学术硕士，还有是金融学院还是经济学院。16年金融学院金融专硕和保险专硕两个专业的专业硕士的分数线才统一330，但是今年保险专业过线的我了解到只有七个人，一共二十多个名额，那些没有考上的同学可不是傻子，也有不少考了好几年的。金融学院的大厅看到屏幕上一个很高分的同学复试被刷了，四百分的也有不少，前几名都是南开本科生（考的，不是保的），所以说还是要综合考虑的，包括今年的政策，还有去年考题难度等等。像去年增加了很多应届考生考金融学院，还有一半以上的名额都给了保送的，按理说剩下名额都可以稳稳的被剩下的考生拿走了，结果并不是这样。  还有就业前景，保险方面比较好的出路无非大体就走精算、保险、证券、银行。证券去的人也非常的多，上一届很多去了不少券商的总部，待遇不错，再前几届去券商的较少，保险发展潜力还是非常巨大的。还有一部分留学深造，这部分比较少。  南开很好很公平的。      补充：那个高分的同学似乎最后并没有被调剂，因为我知道的时候，得知他就已经回去复习再战去了。  而且分数和判卷尺度学院间也是有一些的不同，对比一下今年的经济学院和金融学院的出卷和判卷就能比较明显的看出来。  我和老师聊的时候，老师也说今年金融学院的专硕的确有些亏，因为据我所知是因为新成立金融学院，加上新校区建成，还有招收应届生报考这几个因素，导致这一年的金融学院在考前更改了考试范围，超出了原本的复习的很多内容，395到了数三的难度，专业课也是比往年增加了不少，而经济学院的出卷和判卷分数则要成熟不少，一个学校两个学院的差异今年很大。  图片新老校区   
厦大，南开和中山大学，志愿应该怎么选择？,利益相关：我开本科毕业狗一只。 1）从名气上讲上述三所都是名校，且基本属于同一层级，属于第二梯队名校。如果你没有特别的地域偏好（如珠三角、京津冀等），学校名气的影响不大。 2）从生活条件上说，三所学校校园我都到过，厦大去过本部和漳州，中大去过南校和东校。平心而论，厦大有湖光山色、巨大的图书馆、无处不在的人文关怀；中大有南校的砖楼草坪、自由开放的风气，两校软硬件都远胜我开。 3）从城市而言，广州是华南一霸；厦门文化多元，还有小情小调。而天津会相对保守，创业氛围不够浓厚，实习没有广州多，情调不如厦门足。但我开虽然在天津，我开同学的视野可以不局限于天津，到北京、滨海新区实习都是可以的。 4）从个人感受方面，内心有千言万语难以明说。从高考失利自以为折翼到我开的中二病少年，到今天工作后愈发懂得敬畏的新鲜人，南开包容了我四年。在我心中，我开学霸们低调肯干、不事浮夸的作风，是南开精神最好的体现。当去深圳实习，感谢我开给人【老牌名校】的印象，面对清北的同事也有不觉低人一等的底气。工作后，还有碰到几次合作伙伴说我们领导就是南开毕业的；-D 说实话，南开大部分是普通人，不过它给了你一个往上走的平台、一群以后有前途的、靠谱的伙伴。如果想去更高大上的地方，抓紧这四年，毕业后争取刷海外或国内1st tier学校的背景。在申请上，我开不会比另两所差。 另：我有个感悟，每个地方都有顶尖资源，只不过享用的是那5%的人。与其坐等学校给你带来什么，不如想办法成为5%的其中一员。只有顶尖的人才配得上顶尖的资源和岗位，和是否target校无关。 希望对你有帮助 祝安！
为什么天津大学和南开大学老校区人口这么聚集的地方没有地铁经过？？,看看清华东路西口就知道了，为什么15号线始终接不上13号线？北大东门地铁站已经对北大的精密仪器造成了影响，清华不想重蹈北大覆辙。 据说原来3号线打算从南开底下过，南开坚决反对，才南移到了从天塔过，想想看，难道南开大学或者天津大学这个地铁站名哪个不比天塔好？无论本地人外地人都一目了然。 由此看来，南开和天大还是有战略眼光的，一条地铁带来的方便远比不上科研的落后带来的损失。
南开大学有哪些好老师？,1.  楼上说的高数的徐锬，“ 人脾气非常好，从不点名，全靠自觉，讲课耐心细致，每次下课很多同学提问都耐心解答，有时都把午饭时间耽误了”。 我120个赞同。徐老师笑眯眯的样子，不急不躁的样子，让我知道什么叫“谦谦君子，温润如玉”。谢谢老师，学生不才，高数课真的没有太学习好，但老师的教诲如沐春风，学生不能忘怀。  2. 史广顺老师。老师的辩论修养我有上，其实我很讨厌辩论，因为我生性最怕和别人吵架！史老师上辩论修养内容我已经忘掉了，但是我记得他有说一些我当时用小本子记的观点“你要忠于你的国家，而不必要是那个党”“两个人真正的感情在于细水长流，在于那些平淡的时光”“用最大的善意去猜测别人”等等等等。因为我不是辩论队的，但我知道辩论队战绩不错，和史老师关系也都很好，所以上过史老师辩论队培训的可以出来讲一下。  大家可以和那个讲演讲的艾跃进比较一下！我！要！点！名！艾跃进是我南开最讨厌的老师，没有之一！一个集权统治者，一个滥用师教威严者，一个水平不行却要扯大旗者。 我不骂人，我只陈述事实。 我记得那时上课三个钟，他不许学生喝水，只可以自己喝水，如果学生喝水就要扣分数，因为不尊敬老师。 他说女生穿露肩装是“有伤风化"，说“你穿露肩装，那你内衣带怎么办？有的女生说，可以穿透明的，透明带就不是内衣带吗？” 我大一时是南开演讲团的，艾跃进是指导老师，有时一帮同学会去他家做特训。然后有一次艾跃进问我们，“你最爱的运动是什么？”那时我抖机灵说“睡觉”，然后他就劈头盖脸的一顿大声训斥“你眼里还有没有师道尊严，有没有一点尊敬师长的意识？balabalabala”我真的被吓蒙了（那时心里还是尊敬他的，认认真真的想去学习演讲），快要哭出来，但是忍住了（眼泪怎么可能因为他这种人而流！）。 艾跃进还一直想给文革翻案，他说现在毛泽东都要被重新评价了，文革也会被重新评价。 艾跃进真的是一个大写的神经病！  3. 南开有很可爱的一群辅导员，季芳老师（不知道老师现在还在做辅导员吗？想念您，季老师）。那时经院学生去美国交流的项目，中间有一些曲折，麻烦了很多季老师，季老师都特别耐心的去帮我收集资料，联系美国学校，开学校证明，很亲切，很温和，很耐心，是一位真正为学生着想考虑的老师。   4. 最后要重点说张健老师。这个故事我有说过，想再提一遍，感谢张健老师，向我展示什么是一个老师的风范。 故事如下：  2008年我大二，是个不成器的学生，期末考试都是考前提前两天复习。  那天我在南开二主楼的教室里复习到下午6点，把书放桌上出去吃饭。吃完饭回来7点，发现自习的那间教室有课，老师在上课，而我的书都在教室里——第二天要考试了，我却还只看了一半的书。  我在二主楼的那间教室外徘徊了很久，想看能不能等老师下课时进去拿书。我查了课表，那是马哲老师张健的课，我大一时上过，他是个中间不爱下课，3节课一口气讲完的老师。我在外面纠结又纠结，上完课就9点半了，我就没时间复习了。我犹豫了一下，悄悄的从后门进去，收拾了书包就走了。  晚上我在宿舍水房听说，今天张健老师的课有个学生老师点完名就马上收拾书包走了，气得张健老师粉笔都捏碎了。我越听越不对劲，张健老师第一节课，那不是我么？我不是张健老师课的学生啊。我当时特别不好意思，我想怎么办呢，张健老师肯定觉得特别心寒。  当时BBS还是很流行的，我没有老师的联系方式，想在主页版“南开之声”发帖跟老师道个歉，但是已经过了11点，不能发帖了。我就在马哲学院的界面上发个帖，简单的介绍了一下事情，和老师道了歉。 没想到，张健老师特别快的回复我，不仅只是劝导我，没有指责我，反而反省自己为人师表的责任，对我加以鼓励。  我表达不好，原信附上。  我的发帖和老师的回复。    后来老师又单独给我发了站内信    我毕业后和张健老师断了联系，只回过一次母校，非常匆忙，没有见到张健老师，但这件小事我一直记在心里。其实马哲课真的是特别不受重视的公共课，张老师只是一个普通的讲师，他却绝不以敷衍的态度对待自己的工作，对待任何一个学生，教我反省与担当。我有时想，得做一个不让老师失望的学生啊。  在这里写出来，如果有谁能够看到，向张健老师再次表达我的敬意和问候，非常感谢。  也向所有南开的好老师们表达谢意，谢谢您们向我展示了师者风范，虽然没有机会再回到南开的课堂，但教诲和关怀不敢忘~❤
南开大学从经管类专业转其它专业好转吗（或者转其它文科学院好吗）？或者转某学院成功的机会大？,蟹腰。。 我就是题主说的那种 特别爱分享的 转到经管类学院的 学长学姐 尴尬脸(☆_☆)  不过看在小学弟同文科僧 同数学不好 同爱历史 同为转专业付出这样那样的心思 宝宝再来回答一次好了哼 傲娇脸(￣^￣)ゞ  一秒正经(・ω・)ノ 宝宝是13级文转商老学姐 高中文科生 文科数学年级普遍第一 偶尔第二 然而上了大学就懵逼了 文科数学基础差一点挂掉 转专业考试前一周翘了所有课找大神恶补数学 英语一眼没看就去考试了 最后我猜应该是倒数几名擦边入围吧  看了半天 没猜到题主到底是经济学院还是商学院（估计不像是金融的）  经济学院对数学要求相对较高 但素商学院维持基本的数学要求就好了嘛 大二分完具体专业后 完全可以选择人力资源和市场营销等 专业课几乎不再涉及数学的专业 想想还是蛮舒服哒  字里行间感觉学弟已经被数学彻底折磨哭了 老学姐感同身受的不行 确实数学底子好的人没办法去理解 线性代数概率论与数理统计统计学还有改革以后尼玛场论与无穷级数这些什么鬼什么鬼什么鬼的东西学起来有多恶心 所以发现难以消除的障碍后 转移确实是可行的办法 就是“转到不使用数学的文科专业”  【我并非已经锁定某一文科学院或某一具体专业】  专业选择是为自己转的 除了个别大院的政策挺让人无语的 多数友好有爱的文科学院（文院史院外院马院blabla）都不太会拒绝外来专业的同学 以文院为例 13级转出文院9人 转入9人 在文院的生活学习都很不错 表现出你对目标学院 目标专业真诚的热爱 定一个和未来发展相关的规划 然后尽最大能力去体现 不会出现学院故意不收你的现象 就像一窝蜂转经管学院人 只有真的喜欢目标专业的人 才能投入更大的热情和精力去达到自己的目标 否则不是我说 都是骗父母骗洋鬼子的 (´･_･`)  【我只求能够好好把握这次转专业的机会，成功转去一个对数学要求现对比较低的专业，然后凭借我对文科的一贯热爱，学好这门专业。我不想撞运气啊！哪怕是一点点失误啊！不能让上天决定我的命运啊！不要说我之前为啥还要读经管学院，分够啊！父母家人，老师推荐啊！当时还觉得骄傲啊！没有好好考虑过自己的长项和弱项，迷迷糊糊的来到了某个学院。你眼中美好的东西只有在你拥有后，才发觉值不值。】 很开心学弟自己就有这样的体悟了 很多人到大四 甚至一生都不会想自己的长处短处 更不要说及时的调整方向 所以祝你早点找准自己的目标 好好努力呀o(^▽^)o   最后说一点信息类的东西 转专业最重要的是时间节点 各个学院信息下发时间不同 建议多关注数学院和周政学院的官网 信息较早且全  由于从经管学院转出文科学院的案例较少 多去自己的目标学院和专业走走 混个脸熟的同时紧盯考试内容 一旦得到消息立刻准备    加油~(=ﾟωﾟ)ﾉ
南开大学三农学社相关？,这是我大一想要留任时的写下竞选稿：  流程： 自我介绍（某某学院某班，普通成员） 优缺点（个人与社团） 改变（个人与社团）  一、责任与担当： a.三农陪伴我一年，活动参与了很多，从一开始的军训服装收集，周六嘉陵北里的支教活动，直到汾水道小学联谊的活动。 b.大二留任与否，三农的新老换届，充满了难过与欣喜，学长学姐离任，我们来顶替，三农的发展需要我们。  二、留任之因： a.兴趣：我喜欢三农，农业，农民，农生，三农的文化，活动，成员（尤其同级的某个成员特优秀，很有热情，与他共事的想法很足）特别棒。 b.选择：我大一参与了很多社团，但是我最终放弃了其他的，大二就果断的留下了这一个社团，可能大二就是0个，这就决定了我会将更多的精力放入三农学社。 c.优点： ①做一位有担当的男生，下一届将会把时间更多投入到三农学社，因为我只留任这一个社团，更愿意配合，希望对三农的发展提供更多的一份力。 ②相信部分成员，相信有他们，能够进一步建设三农，愿意服务， d.缺点： ①简单，许多事不能透过现象看本质，许多事理所应当，没有考虑深层次的，许多事一根筋。 ②参与活动没有部分成员那么多，南开书屋，暑期实践没有多大参与。 ③更多的原因是个人能力不足，没有leadership。 ④掌握的能力很局限，目前仅限于支教，创意，点子不足。 ——责任与义务相对，能力与地位相应，因此我竞选了一个小的职位，某某部部长。 e.遗憾：感觉没能有很大的归属感，可能是因为自己没能更多的快速融入三农学社。  三、三农的发展： a.招收下一届的成员：吸纳更多成员。 b.凝聚力和积极性：联欢，给予社团更多家的魅力。 c.责任更加明确，分工要明确，感觉目前部门的惩罚制度不明确，一部分原因是成员不足，一部分原因没有很强势的成员（某某就不错，但是得把经历集中于三农学社） d.传播三农文化，宣传力度需进一步加大。 e.干事与部门之间的关系要加强，不能中途遇冷，干事与干事之间的关系要紧密。
南开大学的王祎是谁？,这～
在南开大学谈恋爱是种怎样的体验？,在南开谈恋爱，就是 一起去吃一食堂的方便面 一起去吃实习餐厅的肉酱面 一起去吃清真食堂的炒鸡肉 一起去吃二食堂的番茄炒蛋 一起去吃三食堂的饺子 一起去吃天快美食城的麻辣香锅和黑米粥 一起去吃金鹏饭馆的金鹏炒肉 一起去吃八道江山的大酱汤 一起去吃喀纳斯的小盘鸡 一起去吃馨香园的京酱肉丝 一起去吃名锅贴饺子的锅贴和饺子 一起去吃醉爱重庆小面的豌杂面 一起去吃蒲姐燃面的燃面 一起去吃老王豆皮的豆皮 一起去吃仟味阿婆的麻辣拌 一起去吃甜啦啦的甜筒冰淇淋 一起去吃太禾谷香的牛肉饭 一起去吃台湾风味小吃的甘梅地瓜 一起去吃惠民水果店的西瓜和樱桃还有芒果 一起去吃炒酸奶的炒酸奶 一起去吃体育场后面的烧烤 一起去吃老陶包子的丑八怪 一起去吃呷哺呷哺的咖喱锅 一起去吃鱼酷的烤鱼 一起去吃鲍师傅的肉松小贝 一起去吃香园炸鸡的鸡翅 一起去吃玛喜达的年糕火锅 一起去吃龟丸制面的乌冬面 一起去吃渝情未了的芝麻酱 一起去吃元和西饼的水果盒还有泡芙 一起去吃99炸鸡的酱油炸鸡 一起去吃7-11的饭团 一起去吃星巴克的纽约芝士蛋糕 一起去喝大茶杯的奶茶 一起去喝梁氏韩料的大麦茶 一起去喝星巴克的馥芮白 一起去喝优漾的酸梅汤 一起去喝美膳广场的绿豆汤 一起去喝三食堂的小米粥 一起去喝一食堂的豆浆  都说爱一个人，就是要和他一起吃很多很多顿饭。  很多很多顿饭我已经吃好了，那我爱的人呢？你打算什么时候回来啊？  你回来之后，我们 一起去二主楼六楼自习 一起去新开湖边吃外卖 一起去612上睡觉 一起去新图玩电脑 一起去90咖啡蹭wifi 一起去Helen's喝Mojito 一起去数码小院取快递 一起去思源堂假装勇敢 一起去主楼小礼堂听讲座 一起去七教逗猫咪 一起去开水房打热水 一起去迦陵学舍看看大师的住处 一起去学府街菜场买菜 一起去琢璞茶坊复习功课 一起去田家炳看演出 一起去学活二楼值班 一起去津南吹大风 一起去滨江道只逛不买 一起去金逸影城看电影 一起去恒隆试个不停 一起去海河边上看大爷钓鱼 一起去天津之眼往下看 好不好？  我更希望，我们能 一起去馨香园请老师同学吃喜酒 一起去附属幼儿园接宝宝放学 一起去老图准备各自的考试 一起去天塔坐地铁上班 一起去荣迁西里看房子 一起去郊区宜家买餐具和抱枕 一起去好收成买纸抽和牛奶 一起去南开小学拜访孩子的老师 一起去附属中学给孩子送作业本 一起去西区公寓吐槽当年怎么没住在这里 一起去中心实验室找成了老师的同学闲聊 一起去行政楼与曾经的导员侃大山 一起去大中路的长椅感叹时光过得真快 一起去荒岛书店偷窥儿子和女友约会 一起去操场慢慢溜达阻碍年轻人跑步 一起去校医院开药老眼昏花给错了钱  如果可以，我希望这辈子都不要离开温柔的南开，和你一起。
南开大学光电所怎么样？,毫无疑问最好直博
南开大学的经济学专业怎么样？, 物超所值，学霸很多，老师水平不错也很敬业。除了你列举的学校之外我觉得可以秒杀了== （当然和武大的数理金融实验班哪个好这不好说）  金融学院今年独立出来了，势头更猛。师资上了一个档次。 
南开大学数学类统计学怎么样？,想学数学的话可以去山大 本科阶段学数学还是不错的，这样以后考研的话可以选择转财经类啊等等需要数学好的专业
南开大学翻译系新生如何在四年后考上北外的高翻学院？,14级英语系 目标同 然而 想保研 没有学分绩 一切都没有什么卵用 一定一定一定要重视成绩 并且大一a类课很多很水的情况下 一定要用A类课把基础成绩打好 然后 有了学分绩或者没有学分绩（比如想考研的）专业素养肯定不能没有啊 至于专业素养的提高 我想我还不够资格回答  祝好运
南开大学有哪些让你们觉得好的地方？,西门附近的上海生煎挺好。虽然老板打死也不说是哪儿人，一定要说是上海附近的，蛮好玩。
南开大学为什么分数线那么高？,千万别报南开！ 一定要报千万别报新校区！ 来之前听起来很棒，来之后发现生活就是一碗毒鸡汤
有谁了解南开大学陈悦教授团队研发的抗胶质瘤新药，ACT001的药理和临床实验的情况？,ACT001就是小白菊内酯，有别于TMZ，它对胶质瘤干细胞有作用，且在脑内聚集，所以单从原理上说，这是一类很有前途的药物。陈教授也发了JACS的文章，也获得了杰青，说明业内对其还是相当认可的。 有幸与陈教授团队一起做些事情，我现在用来工作的处理器，就是陈教授团队资助购买的，他的团队非常高效、学术化。 ACT001不仅对胶质瘤有作用，其实最早是在胰腺癌和肠癌里面试验的。有关的公开的资料可以在陈教授发表在JACS等杂志的文章查到，军事科学院也曾在这方面发表过文章，在plosone。 临床试验是在澳大利亚，网上可以搜到相关信息，已经注册过了，正在进行中，已经有一些结果了。
