加入南开大学经济学院学生会是一种怎样的体验？, 谢邀。  作为一名与学生会“纠缠”了多年的大三主席，以下是我的看法。   就像是一段旅程的开始。    你会遇到许许多多有趣的朋友。 每一个朋友都身有所长内心丰富，他们与你志同道合、他们与你患难与共。你们将会一起筹办活动，体验着从策划——现场的全过程；你会学到很多新的技能，修图写稿都能信手拈来；你们将会一起轰趴K歌，大学生活不再孤独。   你会举办丰富有趣的活动。 无论你是大一的干事、大二的中层、大三的主席，学生会的生活都是忙碌的，也是自由的。戏剧节、舞会、知识竞赛、辩论赛、院长杯比赛......每一个下半年学生会的活动档期都会排满。而每一个上半年都是留给学生会人自由发展的天地，优秀的伙伴、出色的团队，让你的每一个灵感都能成为现实。   你会感受到服务的力量。 学生会是为了服务师生而存在的组织。日常中收集学生意见，联系师生情谊；举办冬日暖温情活动，捐献爱心物资；参加股权大会，撰写提案切实改善生活条件；甚至只是新生群里的答疑，军训场的西瓜。你会收获到笑脸、也会付出汗水。你不再是经院光环的使用者，你是守护者、甚至是缔造者。  总之，我在这里等你。  以上 
参加南开大学哲学夏令营是怎样的体验？,轻轻松松过的体验。（老师都很欢迎同学们，真的会给你很多帮助！希望参加的同学也有点自我进取的精神）毕竟学哲学因为生活太安逸一不小心就堕落了。再说一遍，不支持生活条件不好的学哲学，不支持全身心想要折腾的人学哲学，天天在外宣扬什么人生哲学，把好好的学术风气带得乱七八糟）。没有任何指向，但是应该会有人明白我指什么。
如何看待南开大学公共数学课讲义错误频出？,根据和各种出物理书、数学书的教授交流……书里的错误特别是符号错误。。。主要是编辑和校对的锅。。。中国出版业就这水平而已，不能要求更多。。。十x五规划教材之类的也是这种情况
高考志愿填报安徽文科217名，武大还是南开？综合类大学还是专业类大学？,哈哈哈，贵开学子改回答、删不利评论的水平简直无人能及啊。有胆量把自己原始版本的评论留下吗？有意思也是［手动斜眼］ ——————————————————————————— 点名  @Lawrence Wang  1、这位南开同学开始就对武大加以谩骂和嘲讽来凸显贵开的优秀，被指出后删除自己的辱骂性语言； 2、该同学删除评论中对南开不利的评论，虽然这些评论都是客观真实的；还有就是，据一位上财的同学@ Harris 反映，这位上财的同学点评了一下南开，结果被这位南开的同学追着骂。大家难道想和这种南开的同学做同学吗？ 3、该同学将自己对武大的辱骂性语言删除后，改说南开生源质量高武大1-1.5档，关于这点，我表示并不同意。基于以下3点：      （1）文科，南开在大多数省份的投档线低于武大；      （2）理科，即使南开分数高，也不会高的很多，并不能形成明显的差距；      （3）南开每年招生不到4000人，武大每年招生近8000人，我想，真正要对比生源质量应该拿进武大的前4000名来跟南开对比才合适吧；并且，在现在武大招生人数近南开2倍的情况下，大多数的省份文科投档线高于南开，理科也与南开差距并不大；我想谁的生源优劣，大家可以想清楚吧？说实话，高考分数差距十几分的同学之间实力往往没有什么差距，非清北的学校差距也不是很大，关键是自己在大学如何学习。我想，读完大学的同学都会有这种体会吧。 4、该同学还列举了最容易出国的十所学校，但是并未给出来源和具体数据。我想，出国情况最有说服力的还是教育部，教育部教育涉外监管信息网据显示，国内出国留学最多的十所大学分别是：浙大、武大、中山、北大、同济、复旦、上交、清华、人大、南大，并没有南开，具体数据可见教育部教育涉外监管信息网育，想省事也可查看： 教育部:出国留学人数最多的10所中国大学!-搜狐    5、关于该同学给出的新生质量排名，这个排名取自最好大学排行榜，这个排行榜的发布机构的介绍见：  高考志愿填报安徽文科217名，武大还是南开？综合类大学还是专业类大学？ - 匿名用户的回答 ，看完这个我想大家能知道是怎么回事了。  上面是我对该同学言论的反驳，下面我们来分析一下@ @Lawrence Wang  这位同学： 1、该同学出口便是侮辱性的话语，可见其并不是一个懂礼貌的好同学；追着骂人说明其不仅仅是不懂礼貌，更易怒，情商低。我猜这是一名南开的低年级学生，要是南开高年级学生还这个样子的话，那我真的得对贵开刮目相看了； 2、他的回答充满着偏见，字里行间看不起其他的学校，说明该同学心气过高，只可惜实力配不上心气，只能搞得自己白白受气；总想通过证明南开是多么的优秀，以此来证明自己优秀，可见在他在现实的学习生活中并不优秀，并且缺少自信。 3、他所说的内容，缺少恰当的数据支撑，更谈不上数据权威的信息来源支撑，然而他却想拿这些东西来当作论据，可见其分析判断、论证的能力一般，没有经过科学的培训，根本都不知如何写让人信服的东西，更不用说写paper了。  上面说了这么一些，其实，这些都不是重点，重点是我更想问一下@ @Lawrence Wang  这位同学： 你真的是南开学生吗？确定不是来黑南开的？？？ 
南开大学水污染情况是怎样造成的，该如何治理？,小引河以前是活水，现在是死水 设施老化 人工清理太少 天津的水质本身就完蛋
南开大学的英语系是全英教学吗？,不是。楼上两位别乱说。 外教全英，因为不会说中文，中教要用中文解释一些事情，比如发音，告诉你舌头放在哪儿，牙齿放在哪儿，这种时候怎么可能说英文。 最简单的，老师上课有时还走神聊天呢，“二主楼那那么多人什么事？” 这时候怎么可能用英文说？
请问南开大学自主招生经济学类的笔试数学是什么难度？,不好意思，我是法学专业，不考数学，没办法很好的回答你的问题。
本科南开大学国际政治专业，现大三，因为感觉本专业核心竞争力不强，想跨专业考研，请问我该怎么决定？,上本科的时候觉得，选了专业就等于选了一生的事业。 毕业了才知道，据统计京津地区本科毕业生60%没有从事自己大学所学的专业相关工作。 题主可以试着考一下外交部（玩笑），企业就业，除非是专业性强的岗位，其它（对本科生）没什么差别的，当然外语好求职有很大加分。 经济金融就提一句，在国内你的上限基本取决于你的背景。
请问天津大学或者南开大学的同学是怎么看待你们旁边的天津中医药大学的？,南开文科女一枚 ―――――――――――――――――――背景： 大一时在郁闷中度过……自怨自艾自己专业实用性不强，将来没有一技之长难找工作； 刚来天津水土不服一年时间几乎大半都在生病，校医院无效、小诊所无效、一中心去不起（来自较贫困地区，天津的医疗成本着实把我吓到了……）、每天被病折磨着…… 后来误打误撞，在中医药大学贴吧发了一个求助贴，下边很多同学回复推荐保康医院，于是我就跟保康医院，跟中医药大学结缘啦。  大一一年去了中医药大学无数次。北院进门的小路，我常常取完药坐在路边，羡慕地看着来来往往的妹子们，羡慕她们是学医的，有一技之长； 被一位老师减免过治疗费； 医院里跟着老师见习的同学们都很和气； 保康医院的费用真的好便宜； 中医药大学的风格古朴内敛，让人觉得这样的学校培养出的人也是让人放心的吧。  后来身体渐好、也认识到自己的专业跟医学比起来并不是那么没用，很少去中医药大学了。但是如果提到天津的高校，我第一反应就是天大，南开，中医药这三所。 谢谢这所大学~帮助我走过最困难的一年
如何看待南开大学“一人砸刷卡器，全楼禁用洗衣机”？,保甲连坐制度的进阶版而已  利益相关：工大屌丝
在南开大学历史学院学习是一种怎样的体验？,我的经历就是在一个三线城市，到了12年夏的时候，我在想我估计也快报志愿了，我想我应该去学学历史（高中文综强项），于是我就找市博物馆曹主任，跟她聊聊学历史和文博的出路。 曹主任说我还too young，too simple，sometimes naive，不要见得风就是雨，看了书和杂志，我们自己也要判断。她是身经百战了，见得多了，省里哪个博物馆她没去过？她做为长者有必要教我一些人生的经验。中国有句古话闷声发大财一句话不说是最好的，她说这专业没出路，我又不高兴，她怎么办？她替我着急啊。当然我自己的决定权也是很重要的。 我提高了自己的姿势水平，报志愿时文史哲一律不报！我觉得这是很重要的，这个对我以后的收入多少有很大的关系。 人呐就都不知道，自己也不可以预料，一个人的命运啊当然要靠自我奋斗，但也要考虑到历史的行程。我绝对不知道，我按照经管法贸政社顺序报的专业怎么把我调剂到历史学院去了。所以，老师家长同我讲话，说南开都录取了，你去读博物馆学，我说换个专业吧，实在也不是装哔…我一个没报这个专业的学生怎么就被调剂了？但是老师讲，南开通知书已经决定了。后来我就念了两句诗，叫“黄金榜上，偶失龙头望“。所以我就来了历史学院。 到了史院我学了这三四年也没干什么别的，大概三件事，第一个是想转专业没转出去，第二个是想双修没申请上，第三个就是准备考研现在心里也没底。 让我学历史，其实我一开始是拒绝的。不能让我学我就去学，学完了出来找工作别人说你学的东西都没有用，是空洞的，进入社会就碰壁duang~大一时候对专业课好抵触，重建三观太痛苦了，大二又太自信了，觉得自己看看书什么都会，中二病犯了好几年，老是在想学历史为了什么，学这个以后干什么，把这些有的没的想了一通后觉得自己还是有点喜欢这个专业的，还是往上念吧。但这时候已经大三了，发现大学生活快结束了自己也没有保研。  念了三四年，一套学科体系接受下来，觉得确实学到了好多东西，上了许多好课，认识了许多好老师，从中领悟了些许历史智慧，有了点点历史情怀。我们学历史，并不能直接拿去改变自然、改变社会，但可以改变我们自己。这个社会向前发展，但遗留下来的东西总要有人去清理、去发现、去记录，我们研究历史的人就是在这方面做一些微小的工作。如果我们人类连我们这个物种过去几百年几千年的历史都不能明了，又如何展望未来呢？扯个远的，程心如果像罗辑一般了解历史，怎么会把人类领向灭亡呢？言归正传，这些年我还结识了不少同学，他们虽不全是学霸学神，也未必愿意以后继续研究历史，但都是有自己理想并愿意为之去行动的人，这说明史院的氛围总体是好的嘛。我自己也是逐渐的接受了这门学科，喜欢上了这门学科，当然我以后可能会选择做些务实的事，但这显然需要我去念个研究生。这就是我的体验吧 。 总有人给南开泼脏水，给史院泼脏水，给历史学科泼脏水。学历史以后深造难、就业难、出成果难，我们有思想准备。年轻人就是要豪迈，惟真惟新，求通致用！
上海交通大学大学法律硕士和南开大学金融硕士哪个更有竞争力？,学法律的也可以成为金融市场的一份子是必然的，不少优秀的法律专业都可以去做风控和合规。但是题主的比较方法不是很理解，如果考虑日后的实习，且希望留在上海，交大无疑是最优选择，前提是你能上。南开的性价比很高，也许是由于自身地域影响所以相比发展放缓，但是如果是要进入金融业，基本的金融知识必不可少，考个CFA有时候可能比金融硕还顶用。
作为南京人，你为啥去了南开大学？不选南京大学？,我一直想上大学去个有海的城市 所以选了“渤海之滨，白河之津” 去了之后发现离海还有好几十公里…  差不多就是这样哈哈哈。  但是去那里很好， 现在的人生都是因为这个决定。 去南开太棒了。  还有就是关于楼下的诸君觉得是高考分数上不了南京大学 这是一个想当然的答案，不过对我来说其实不是这样 原因有二： 1.我是保送生。 2.人们常常会擅自认定A好于B，并且在另一个人选择B的时候武断地认为他只是无法选择A，而不是以自己意志选择了B。这个叫做评价体系一元化，他们可能并不能理解对于有些17岁的小孩来说，“那个城市有海”是一件比“这所学校全国第三”更有魅力的事情。这完全可以理解，可以原谅，就是有点没趣。  我们很难和评价体系一元化的人解释自己违反这一体系的一些决定，也没有必要。 毕竟是我的人生嘛。
在南开大学住宿是什么体验？,前几天校庆日，女票跟我说，一个大妈走在她们的宿舍里，说道：“好几十年了啊，一点都没变啊！”
为什么南开大学有很多人愿意在知乎黑本校？,这些匿名用户都是在校学生吧 你们匿名有个卵用 南开信息办能轻轻松松联系到任何网站网管 再查到你发帖的ip地址 再查到你上网用的学号 再找到你本人 再约你来学工部喝茶 不要问我怎么知道 我在校的时候就被这么约过  Too simple， naive!  引用我本科时一位老师说过的话 “趁南开这几年名气还在 赶紧出国深造 以后有出息了回国多多帮助南开”  上面这段话是几年前说的 现在不知道南开名气还在不在了 不过出国后靠着南开血统的确认识了很多牛人 得到很多帮助 不过他们大都是重庆/天津南开中学的  补充一句 信息办连你们平时上什么网站都一清二楚 所以翻墙或者上黄网的 好自为之 还是用移动硬盘寝室间传阅比较好
考研选择南开大学国际商务还是新闻专业？,谢邀，非国商非新闻硕士，经济学学硕一枚。对新闻不太了解，对国商稍微了解一些，其实是不敢答题的，怕说的不对误导题主，但本着南开人热心的传统，还是就我知道的说一下，题主辩证看待。 国商在经济学院，就业还是不错的，有许多进券商的，在南开也算就业很好的一批硕士了，钱途不错，难度的话，不知道新闻怎么样，但感觉现在信息已经比较充分了，越好的专业越难考取。 个人感觉国商和其它经济类的硕士差别也没有太大，经济学类感觉还是比较浮躁，好多学生刚上研究生第一学期就出去实习了，在学校待不了太长时间，专硕又比学硕严重一点，但也木办法，都是为了就业。也有一些执着于学术的学霸，令人敬佩。 最后，加油！ 匿了
