在杭州浙江大学附属中学（曙光路）就读是一番怎样的体验？,答主2014届校友。长文。 想了很久还是决定来回答这个问题，带着复杂的心情。一部分原因是每每想到上几届的校服永远比我们的好看，小卖部和食堂在我走了之后焕然一新，浙附社团也突然一下子就高大上了起来，心里觉得一阵失落…(ｰ ｰ;)  毕竟是母校，真是怀念高中时光。 答主女（汉子），中考第四志愿上的浙附，讲真，当时心里实有不甘。然后一路考进实验班，包括也拿到了当时新加坡项目的推荐名额（就是浙附和师附还有几个民办初中的一个项目。每年新加坡非常优秀的中学会从这个项目的推荐者中选出几个人去新加坡念书，好大学妥妥的，基本不花钱还会给你每月倒贴零用钱，代价是要读四年中学，还要在新加坡工作一段时间，但是overall是个很好的项目叫SM1，不知道现在还有没有了），结果最后一轮面试没过，还是too young too naive～ 这个项目我有N多可以说的，…如果感兴趣可以私信～^_^  然后就开始了漫长的高考党的生涯。 分几块讲吧，先讲颜值。在我们那一届曾经有一个很神奇的说法，“师附的美女，浙附的帅哥”。当然这个说法…嗯…在我看来可能有待争议吧哈哈，只能说个体还是有的～个人觉得美女比帅哥多。男女比例还是很均衡的，实验班男生偏多一点。不过放心吧，浙附情侣一对对的，晚上去小卖部的路上简直虐狗。  学校依山而建，风景秀美。每天上学都有一种正在往山上郊游的感觉。不过一直觉得实验楼阴森森的，一进去就奇冷无比，每次路过窗口都可以看到一个房间里面放着小婴儿的成长过程标本，好可怕…特别喜欢食堂，音乐楼那一段路，好漂亮。还有充满激情的小树林。但是另一面就是蚊子特别多！还有各种各样的虫子。军训第一天在山脚的篮球场，衣服上爬了一只虫子，我还不能动，真是快把我吓哭…  浙大附中也很会利用这个独特优越的地理位置。比如，我们有一周一次的跑山。每周四下午从浙大附中跑出去，跑上挂牌山，西湖边下来，拿个名次，（偷偷买个冰淇淋星巴克）然后跑回学校。再比如，我们有一年一次的环湖跑，全年级一起跑里西湖，相当的壮观。当然，作为一个耐力渣渣，这是我每年的噩梦…但是每次跑完，成就感Max！  其实我也是进了浙大附中之后才知道我们原来是体育特色学校…所以在体育测评上会特别严格。当年，那个年轻中二的我还把市三好荣誉看的相当重要，于是曾经每天晚上在操场上计时跑2千米，就为了体育（12分钟跑！！！）能勉强够到75分…不过，现在回过头来，好感谢浙附抓体育抓得那么紧，让我高中身体没出过什么问题，对学习帮助也好大～。（现在又忙又不太睡觉也懒，于是各种出岔子…）  是时候讲讲学术了。好了我要开始装逼了(^-^)/ 先来骄傲一下。我们班作为这一届理科最强实验班那成绩是杠杠的。接近100%的一本率（只有一个人没上一本，出国了），5个浙大+2个上了浙大分数线的但去了别的学校，以及还有出国的，牛津+墨尔本大学+悉尼大学*3+uiuc+gwu+美国top10（你猜是哪个～哈哈）。  好吧，装逼装完还得讲点切身体验。其实进了浙附之后发现，身边有很多像我一样第四志愿进浙附的，有很多很牛逼的人。而且，还有很多单科很牛逼的人，其中理科大神也有很多（我们班后来去牛津的那位就是），之所以到浙大附中是因为语文英语考太差=_=。所以，身边会围绕很多很优秀的人，大神带你飞！至于教师，怎么说呢，一个学校会有好的老师也会有不好的老师，虽然我们班老师都很好，但是我们班的气氛还是大部分自学，王后雄重难点轮着来……自己一定要懂得怎么学习，机会在你自己手上。高一的市统测我甚至比我二中的几个基友考的高，所以如果也是第四志愿掉下来不要太绝望！  至于竞赛，省里还是可以比比的，每年各个学科都有省二的样子。但是要拿国家竞赛，享受高考加分之类的，除非有底子，否则还是算了。答主数学竞赛师从金康（超帅！我们班有个女生为了康康从物理竞赛班转过来了！），生物竞赛师从缪仁票，每礼拜花8小时上课…结果就是自己把自己玩死了。 最后拿了个小奖就卷铺盖走人了。竞赛班的故事太多了，现在想想都觉得人生乐趣。  课外活动。浙附强项啊！各种社团我就不一一列举了，比较有名的文学社，动漫社，英语社，辩论队，电声乐队，新潮的CV社（还是我们班同学创立的），国学社，书画社，现在应该还有很多很多好玩的社团了吧。如果说我在浙大附中有什么非常遗憾的事情，应该就是我没怎么参加社团吧。电声乐队去了一次就被数学竞赛班带走了，诶…  ps，如果你根正苗红热爱唱歌，请一定一定一定一定去找刘晓星老师要参加小组唱！作为曾经的队长，我很负责任的告诉你浙附拿市一是必须的，省一省二常有的事情。而且常常可以溜出学校玩哟  各种节日。社团节到处玩和游园一样，英语节猜字谜，体育节女生们就可以当啦啦队了～篮球足球排球乒乓球。当年班上没有一个女生报名体育节，为了凑数，我硬是拉了我同桌上了…体育节的回忆是我在浙附最开心的回忆之一，能想象大家每天齐心协力的练排球，甚至晚上7点课间休息天都快黑了还跑去排球场练，然后互相夸好球的那种默契感…毕业之后好像再也没有那么美好的场景了。  如果你要出国，浙附可能不是最好的选择，因为感觉学校没有太好的支持。十四中，二中，师附都有很好的项目。但是浙附出国可以改成绩单…好吧，虽然我没改过、不过我知道可以。出国的搞的也不弱，看我们不是牛津大神都有吗（≧∇≦）～～  对对，来讲讲浙附食堂。看到有人回答敲扁土豆，水波蛋，哈哈，超怀念有没有…食堂两个招牌菜（其实别的还有很多，甚至过了一段时间我都不想吃这两个菜了）！总之我觉得食堂马马虎虎吧，据说现在食堂已经好很多啦，连夜宵甜点都有了，好羡慕。  总之我好喜欢浙附。在浙附，我憋着一股中考没考好的劲儿，基本上就是挺玩命的，把自己弄的很辛苦。但是好感谢我遇到的人也好感谢浙附，让我有一个（我觉得比较完美的）高中回忆。  暂时就这样吧～有问题欢迎私信。
如何评价浙江大学《创造性设计》课程？,被邀请回答这个问题也是蛮惊讶的……  这门课应该是专门开给浙大土木学生的设计课程。据老师说前些年还有很多其他专业的学生抢着选这门课，从这话可以看出课还是不错的，不过因为容量原因现在只开放给土木学生。 我是在2015年暑期上的这门课，当时大二刚刚结束。由于浙大的课程设置原因，此时土木学生的专业知识有限，显然，这一门设计课对于专业知识的要求也不是特别高。值得一提的是去年来了好多位清华的土木同学和我们一起设计，应该是高校老师互相交流的结果吧。  以去年的设计为例，去年的题目是要求设计一处符合“绿色建筑”主题的商业综合体。整个过程为期十天左右，包含一个期中展示和一个期末展示。 前期为概念设计，小组成员会大约花2~3天查阅资料，然后整合意见，再用大约2~3天时间初步设计，画概念图等。在这个过程中一般的土木同学可能就用常用的CAD之类的，有技术喜欢玩高端的同学就可能会用一些建筑系同学需要掌握的软件。个人觉得利用这种设计性课程当做压力，促使自己学会一些软件使用蛮不错的（虽然我并没有这么做，掩面）。 期中展示之后就进入实体模型搭建阶段，其实也就是用木材、纸板、水彩颜料、502等常见的做手工的小玩意，并没有建筑系做设计激光切割那么高级的东西……   优点 ：对于土木学生来说是专业在广度上的一个向外的延展。毕竟土木也不能只会埋头算钢筋混凝土吧。我们在设计过程的选址、造型都综合考虑了经济、交通、造型美观等多方面因素。另一个方面，设计本身也很有趣啊，比如我们的课程有小组在楼顶养猪（让我想起网易）、有的小组干脆造了空中花园（没错就是我们组），平常能这么玩的机会可不多。和同组小伙伴进行沟通交流也是很棒的体验。   缺点 ：只面向土木学生开放，这一类型的设计题，如前文所说，对土木本科的专业知识要求并不高，反而可能要用上建筑、城规什么的知识。所以，如果有建筑、城规的同学能参与进来，设计的效果可能会更好，更具有可行性。而且在不具备太多专业知识的情况下，设计出的作品会……嗯，举个直观例子，前两个月一个同学跟我吐槽：“现在想想当时竟然设计了一个悬挑几十米的商场，简直不可思议……”  所以说，课程的优缺点其实是建立在同样的前提上的，看各人的感受咯，重点是玩设计玩的开心就好~
浙江大学的法学是不是一般般？,只是浙大的一个本科生，今年大二，社科大类。法学是我们社科大类下的一个专业，不过我不是法学专业的。我们班主任是浙大行政管理的博士生，本科硕士也都是浙大的，所以他提供的信息还是挺有参考价值的。他的意思是浙大的法学当然不能和中国政法的法学相比(嗯我很爱我的母校，我也很爱我的大类完全没有黑的意思，只是提供我了解的信息供题主参考做选择)，但如果毕业之后想在浙江省的法律圈混，那么浙大的法学完全可以称霸。我们的光华法学院里也的确有几个很棒的老师。
清华，北大，复旦，上海交通大学，浙大，本科生的生活是如何的，丰富多彩吗？,啊哈哈欢迎来浙大。活动超多超会浪，一天学习24小时，一周学习7天，一年学习2周。
宁波工程学院好还是浙大宁波理工学院好？, 浙江大学宁波理工学院  分数上 浙大宁理一本专业投档线超一本线20 30分 政策上有立交桥计划 中外合作项目 同时宁波政府是准备好好建设这个学校的 最差也是第二个宁大 
如何看待浙大华家池校区被部分卖给开发商搞房地产？华家池校区未来会不会消失？, 华家池校区并非只是“浙江农业大学”的校址，而是老浙大的校区之一。  民国时代老浙大有最初两个校区，大学路求是学院一带，后来让给了中医学院，最后于2005年拆毁。这个是原来浙江省立工业专科学校的旧址。  而浙大另一支：浙江省立农业专科学校的旧址则选址在笕桥，后来校址给了蚕桑学校和空军官校。  1935年国立浙江大学购买了华家池周围城外土地，并把农学院从笕桥迁到了华家池。这时候由于华家池土地平坦，面积大，开阔，可以容纳大量的学生。因此称为浙江大学的主校区，相当于那个年代的紫金港。  竺可桢就曾在华家池办公。当时非农学的如外语，人文等也迁入华家池，而工学院则主要在大学路一带。所有新生教育也在华家池完成。  因此从某种意义上，华家池相当于中央的四牌楼。院系调整的时候也都是奉行校名和校址分开的原则。浙大（南大）获得校名并迁址，而浙农（南工）则改名为原址。 
浙江大学何时才能摆脱「万年老三」的帽子？, 我觉得少想点排名的问题，安安心心做大学该做的事，就行了。 
通信工程专业保研，北京理工大学，北京邮电大学，浙江大学，哈工深圳，中科院电子所，还有天大哪个比较好？,想都不用想，必然是北邮。 而且你还提到了找工作...... 北邮优势太明显
浙江传媒大学能考研吗？,可以，有研究生专业，新闻传播
如何理智地黑浙江大学？,听说你们浙江大学的竺可桢学院和北大的元培学院是和辽宁大学的本山艺术学院类似的由企业家冠名的二级学院，那你看看我这400多分去你们那，是不是有点亏啊
被浙江大学退学是怎样的体验？,我想邀请 酒神来回答这个问题
有浙江大学2009级外语学院同声翻译专业的同学吗？,在浙大待了一年多，然后转学去美帝了  听说前两年回国了
浙江大学录取分数线是多少？,自行百度
浙大网新校园招聘靠谱吗？,不看好，浙大网新不是什么顶尖公司，基本上是一群以做外包为生的小公司合体，而且往往顶着国家高新技术重点项目的名义骗科研经费，当然，如果你是码农的话，是拿不到这些钱的。而且浙大网新还巨歧视本科生，一般本科生进去都只给5K，奖金又少，纯粹是当廉价劳动力来用，一般进去的人三年内都基本跳槽。。。
浙江大学美术系录取分数线公布吗？, 昨天微信上看到的 然后又要纠结了
浙大竺可桢学院怎么样？,今年大四要毕业了，看着之前写的这个东西，发现许多观点略显幼稚；而且最近竺院出了很多新政策，所以更新一下。 =========================2016.6.25========================= 本人竺院混合班；高考保送进竺院，高中无竞赛经历。   1. 专业选择上极大的自由度  今年竺院推出了“竺可桢学院交叉创新平台”，即三个双专业班级：金融＋数学、计算机＋统计、自动化＋计算机，全部瞄准在未来可能有很大发展的交叉学科：金融工程、大数据、机器人，专业热度和资源配置没得说，而且主修哪个双修哪个由自己定，最低学分要求和单个专业一样，仅为180分。我们这些老竺院人私下讨论的时候，都认为这是一个很大胆很吸引眼球的尝试，如果办得好，应该会成为竺院最吸引人的地方。要知道，能考上浙大的这批考生在选择学校的时候，从学校好坏的层面去考虑就没有太大的意义了，因为除去清北的其它几所学校都是中国顶尖的大学，各有优劣，综合实力差不多，更应该关注自己想学的专业哪个学校更好。 如果对这三个双专业不感兴趣，理工科的学生可以来混合班，浙大所有专业任你挑。自从浙大将大类招生阉割成小类招生以来，混合班的优势就更加明显了。很少有人在刚刚高考结束就对自己的兴趣、人生规划、各个专业有正确清晰的认识，把选择专业从高考结束推迟到大一下，往往可以做出更理智的选择。插一句：按照大的学科方向划分的小类招生是学院（特别是冷门专业学院）和学校博弈的结果，既保证了各个专业的人数和学生质量又在选专业上给学生一定的自由度，但是被阉割了的大类招生还是大类招生吗？目前全校范围内的小类招生＋竺院混合班的大类招生是一个很理想的组合。   2. 26门荣誉课  混合班大部分基础课程，如数学分析、线性代数、普通物理、C程，均设置了荣誉课程， 任课老师是浙大最一流的老师 ，很多课程使用国外的原版英文教材，课程难度、任务量比大类的基础课程大很多。 求是科学班的的课程设置更加高精尖。求是科学班是教育部专门的项目，针对基础科学的，有数学物理化学生物生物医学计算机，清北交大南大都有类似的班，有大量的钱砸到上面。小班教学，用的是外国的原版教材，开课老师绝壁是浙大最牛的老师，会讲很多很前沿的东西，还有很多讨论课，这种教学模式是很锻炼人的，有时还会请一些知名学者给他们上课讲座。还有很多出国交流和参加国际会议的机会，费用大多是学院来出。当然在这样的班压力更大，淘汰率更大，大一结束求数貌似一共17人，被淘汰了7个。 但是无论多难的课，想水总是可以水掉的；如果足够主动，即使课程要求很低，也可以构建非常完善的知识体系。   3. 导师制和个性化培养   大一下学期即开始进行学生和导师的双向确认，之后会和导师一起制定个性化培养方案，并按照该方案修读课程，因此在课程选择上享有一定的自由度。更重要的是，导师制给我们提供了得到优质科研训练的机会，无论是院士、长江、大千人等学术大牛，还是刚刚回国的青千等青椒，你都有机会进到他们的课题组里，进行SRTP、省创、国创等项目研究。  当然，浙大大部分老师都很欢迎本科生进到组里，参与一定的科研工作，即使没有导师制，只要足够主动，大都可以进到自己感兴趣的课题组里。但是导师制保障了竺院学生能够优先得到优质资源，还提供了一个与导师进行更密切交流的平台。  我的导师是学院里最大牛的教授之一，长江、973首席、国家重点实验室主任。组里的三年，我进行了三项科研项目、参加一次国际会议和多个国内的会议。无论是做人、做事、还是做科研，我的导师都给了我非常宝贵的启发和指导；在我海外交流选导师以及出国申请的时候，我的导师给了我非常中肯的建议和非常实际的帮助。    4. 海外顶级名校（哈佛，MIT）毕业设计  “关于选拔“ 2015-2016 年竺可桢学院世界名校科研实习奖学金”的通知”节选如下（  http://  ckc.zju.edu.cn/office/r  edir.php?catalog_id=381&amp;object_id=45970      ，需要浙大内网访问）  “ 2015-2016 年竺可桢学院世界名校科研实习奖学金”旨在为浙江大学竺可桢学院毕业班学生提供赴世界名校开展科研训练、毕业设计，选拔有志于在相关领域研究攻读博士学位的优秀本科学生。现将有关申请事宜通知如下：  一、项目时间及试用期   出发  至 2016年5月30日，约1年  三、研究领域和名额  拟招收35名左右学生参加，根据海外教授需求和申请情况适当调整，宁缺毋滥。（大王来巡山注：竺院混合班每年约200人）。去年实际参与毕业设计为30人，竺院专业背景为：数学2名、统计1名、计算数学1名、物理3名，化学1名、生命科学6名、计算机科学2名、电子信息2名、电自1名，光电2名、控制2名、通信1名，材料科学1名、经济学2名、政治学与行政学1名。  七、说明  1）本项目定义世界名校：   哈佛、麻省理工、加州理工、普林斯顿、耶鲁、斯坦福   。 2）本项目时间跨度大，请同学认真考虑后续的课程安排、免考、培养方案，及时关注毕业设计进程。 对于打算本科毕业打算申请国外PhD的同学来说，这是一个非常难得的机会。申请国外PhD时，科研经历是最重要一部分，海外顶级名校近一年的科研经历和一封名校教授的推荐信无疑对申请有很大的帮助。当然，除了这些，个人的科研能力、学术视野、英语水平、生存能力都会有或多或少的提升。这个项目推行以后，竺院拿到顶级名校全奖offer的人数大大增加（6人增长到2016届的22人）。我有两个基友，都通过这个项目，去了MIT两个院士的课题组，现在也顺利地拿到了MIT全奖PhD的offer。   5. 最重要的是和你一起成长的那批人  大学四年，我感到最幸运的就是遇到了竺院的这批小伙伴。竺院卧虎藏龙，大都思维很活跃、很有想法、且踏实努力，平时看起来没那么厉害的人保不定哪一次上课就会让你大吃一惊。  竺院同学和大类同学是否有差别，去教室看看就知道了。 因为大三就要和专业班同学在一起上课（但仍和竺院在一起住），通识课什么的也是全校一起上，所以可以看出两者明显的差别。因为我喜欢做前排，偶尔一回头就可以知道大家都在干嘛。竺院的课上，很少见到有睡觉玩手机的，也很少有发呆的，到课率也很高。李胜宏老师在数分第一堂课上就说“ 给你们上课很累，下了课放了学就会被你们围住问问题 ，这是你们和大类学生最大的差别”。至于和大类同学一起上的课，翘课的会更多一点，上课睡觉水手机更比比皆是，甚至很多时候，只有前两排在听课，也少有去问问题和老师讨论的，当然这跟专业也是有关的，竞争力很大的那几个专业，学风并不比竺院的差。         我并没有黑大类的同学，并不是说大类就比竺院的低一等，我绝对绝对没有这个意思。 我只是在描述这两个群体，而不是群体里具体的个体。只不过  竺院优秀同学的比例比大类的稍微高一点而已。 竺院自然也有很多天天白天睡觉夜里Dota一星期都不出门的，每年都会淘汰一批GPA太低或挂科较多的同学。我认识很多大类的同学，他们都非常优秀，我也从他们身上学到很多东西。   6. 毕业走向   竺院组成为（2016届为例）混合班185人，人文社科班59人，巴德年医学班（8年制，本科毕业后继续在浙大读博）46人，求是科学班133人，数学与应用数学班6人，启真班70人。其中读理科的人数占比较少，所以平均下来，出国的比例会少很多。但是每年毕业生深造比例依旧近 90%，出国毕业生中中约有一半赴全球 top50 名校深造，约 30%赴全球 top20 名校深造。   表一：毕业生就业质量情况(以 2014 届为例)        数据来源，浙江大学汇报材料中的各高校 2014 届毕业生就业质量报告    表二： 2012-2016 届学生赴世界名校深造情况  2012年－2015年数据来源：《求是为基创新为魂——竺可桢学院多元化拔尖 创新人才培养模式改革的探索与实践》，2016年数据来源：  https://  mp.weixin.qq.com/s?  __biz=MjM5ODE5NzY0Nw==&amp;mid=2651005697&amp;idx=1&amp;sn=ebef15b1a8de56baeda0b943e84daabf&amp;scene=1&amp;srcid=0626F8J7F7i5ndWb47Q9R5oc&amp;key=77421cf58af4a6536f68f11bffee878d80641146134b6c95af8368a1a09f7655122552ae20b5bea73b372292cb18b872&amp;ascene=0&amp;uin=MjUxNjkwODg0MQ%3D%3D&amp;devicetype=iMac+MacBookPro12%2C1+OSX+OSX+10.11.3+build(15D21)&amp;version=11020201&amp;pass_ticket=WCzyl8mvMeOMbYFzzxGOMO82OeFOulEFqS0W2PF73MNaoWrPgLtoNYGmdlbd2qMZ        表三：2012、2013、2015、2016届学生赴12所世界名校深造情况   数据来源：同表二    7.说说不好的。  竺院同学大一大二时一起上课，大三大四换了校区也还在一起住，一个寝室四个人的专业很可能都不一样，增长见识、拓宽知识面的同时，也造成了和大类同学的交流较少等问题。           竺院是学校改革的试验田，很多新政都会把我们当小白鼠，所以政策比较多变。           竺院和专业学院的工作对接不够好。有时会出现踢皮球没人管的情况  写在最后：            说到底，竺院只是一个平台而已，有很多资源在那，但也需要你自己去争取。而浙大这个平台已经很高了，即使不在竺院，只要够主动、够坚定，也可以得到非常好的成长。
浙江工业大学的药学怎么样？,谢邀。我觉得浙江工业大学的药学方面还是比较强的，尤其是药物化学类。以后如何发展得看你自己的选择，如果楼主有意学术，可以多进实验室看看的。貌似药学类工资普遍不是很高吧，医药销售代表工资挺高但是压力大，还有药物化学小硕工资是比较可观的，但毒性据说很大，可是我觉得毒性是相对的，如果你防护措施做得好，心细，还是没那么可怕的。只是准大三狗，能说的只有那么多啦orz
南京航空航天大学2016级浙江新生群群号多少？,欢迎加入南航2016浙江新生群，群号码：549672306
如何评价浙大舟山校区？,到底是谁取的名字真是想打他一顿，这是浙大第一个名字中不含水的校区
浙大光华法学院怎么样？,专业肯定首推华政，但华政不是211和985，看你现在的情况真去了华政浪费很多分，而且我本科在法大这种专得不能再专的学校，发现本科阶段还是综合性大学更利于本科生。东部的话报浙大、交大、复旦都差不多。
在浙江大学农学院学习是怎样的体验？,谢邀 。 不用换校区，农学院现在就在紫金港校区，于是我们就是传说中的老死紫金港。 至于在农学院是怎样的体验？具体应该以专业而异。但貌似大部分都在和植物或小动物例如昆虫打交道，而我们茶学，除了这些，还顺便炒炒茶，种种苗什么的，生活真是别有风味啊~
