如何评价浙江大学学生一言不合就上知乎“如何评价浙江大学blabla”发表吐槽？,小哥这个提问莫名喜感，你仔细看看是不是前几个字都一样？
浙江工业大学在浙江怎么样？,在浙江人眼里，浙江只有“浙大”和“除了浙大以外的其他大学”
浙江大学的宿舍是怎样分配的？,以前是在入学时的大类专业内部，按照生日进行分配。
曾经给曾老师沉痛一击的浙大人要去伯克利了，曾老师怎么看？,不吹不黑。SS是浙大的牛人，佼佼者。是浙大学生的顶尖代表。虽然他一开始去的是上海交大读博，后来老板加入浙大再一起回校。  那么浙大还是不是三本呢？  就事论事，不吹不黑的说，浙大顶尖phd达到了美帝top20的水平。这标志着巨大的进步。但浙大的平均水平和王博士的差距还是很大的，很多人都来自山东大学。可以说，王博士的成就更多的和自己的天分与勤奋有关，学校的关系大不大需要对照试验。  不过这也是巨大的进步了，毕竟很多年前还没人听过浙大这所学校。  另外，近年很多浙大当年的学生都学成归国，去北大，清华，交大，复旦等一流高校任职做教授。这让人振奋。可喜可贺。希望大家继续努力。  这说明，浙大已经不是三本了。离脱离三本只有一步之遥。  我为王博士取得的成就感到由衷的高兴。如此才能必可成大器也。  楼下有些冷嘲热讽的可以消退了。  当然，媒体的过度包装有时候会有反效果。。如果我是王博士，我一定会斥责这些捧杀自己的大陆华人记者们的。他们缺乏见识，听风就是雨。。还记得门萨女神，清华特奖们的故事么。。。
复旦大学、浙江大学和清华大学、北京大学的差距真的很大吗？,不好意思我必须来回答一下这个问题，我知道我说这些“事实”对于正在浙大念书的同学来说，没有任何好处，按照浙大图形学CAD大神曹辰的学妹的说法，给你们心里添堵了，你们请快点取关我。但即便冒着这样大的风险，我也必须说出事实。对于还在念大一的你，高三的你，如果差几分去清华，请你立即复读。  原回答：  这个问题问得非常好，另外可以参考我最近的浙大三部曲。 这么说吧，一般人认为，浙大和清华大学的差距是这样的：   嗯。高考时候的分数差别并不大么～～（这是按照浙大入学成绩最高分和清华入学成绩最低分相比） 本科毕业之后的差距。在浙大，你努力一点成为系甚至全平台第一之后，就在学业上没有努力的目标了；浙大的实验室实力，配置，方向等和清华大学相比都具有很大的局限性。（ 注1 ）此外，清华大学各专业前三名会被MIT， Harvard， Stanford录取，但浙大的情况就差了很多（非常多，多到我都没去成）。   研究生毕业之后的差距，如下图。清华大学毕业生占据顶级firm和it 公司中高层职位的绝大多数（大致比例是，清华&gt;北大&gt;剩下学校的和）。   对于那些进入竺可桢学院就觉得自己其实没有亏的人，我只能这么说一句：眼光还是太短浅了。超级大牛不算。但我们都是平凡人。我个人认为，浙大拿专业第一的实际市场价值，不如清华大学的专业前15-10。 我给你们的建议是： 如果你是考败来浙 ， 建议复读 。只需要1年，可以弥补你日后3年，5年都无法弥补的遗憾。我没有复读，我没有看到更广阔的天空，我没有更多的人脉，我不能成为高晓松的校友，我不能和街上的大神们有说有笑，我是傻逼。
为什么说浙江大学是靠人多堆数据，靠人海战术，是大而不强？,浙大被黑完全是武书连把它放在了前2的位置，甚至一度超过清北。 但是换句话说如果排在了前七甚至前10大家还会有什么异议么？ 浙大再不济一年本科生不超过6000，对于像武大，川大，山大过万的怎么没人说了呢？
找个浙江大学的男生做男朋友是什么感受？,浙大男生资源还是相当丰富的，本科四年也算是阅男无数，略作总结博君一笑~ 工科男人傻钱多好管理； 理科男猥琐机智爱学术； 社科男高端大气逼格高； 人文男浪漫有才气质佳； 医科男勤奋细致有前途； 农科男朴实稳重靠得住。  当然了，你要是要找基(pao)友(you)，建议还是去体育系找，虽然不都是孙杨级别的，但保证你从里到外都满意......
浙江工业大学的教育存在什么问题？, 不请自来。  浙工大14级中文系在读，大一在英语系。  先来谈谈我自己的观点， 如果答案有什么偏差，一定要告诉我，否则这等于……等于我有责任吧。    这里吐槽一下学校对于文科的模棱两可的态度。   一会儿说要发展成文理兼备的综合性大学。还曾有人建议改名杭州大学，去掉工业二字，以说明学校的综合性，结果遭到原杭大校友的强烈反对。  一会儿又轻视文科专业。从今年开始，人文学院的中文、广告、对外汉语三个专业，并在一起招生了。而且似乎对外汉语合并到中文里去了。另外，中文也有老师离开的，去了更好的学校。   =====手打的分割线======   我一个人说了，那只是我一个人的观点，不足以说明问题。我们需要看看更多的人怎么看。  在2015年5月和2016年12月的时候，我和其他人分别做过一个调查，调查内容很简单， 浙工大满意度调查 。（这其实是思修课和一门专业课的作业）   题主的问题是关于教育的，大致可以等同于 学习方面 。  以下内容引自我们的调研报告（2016年12月版），打分的满分是5分，受访总人数是254人：       与总体相比，学习方面的满意度较低，且不同类别的同学给出的分数略有差异：男生比女生更满意，文史类学生比理工类学生更满意。而从年级来看，大三同学的满意度又是最低的，同时数据又最为稳定。与之相反，大四及研究生对学习的满意度明显地比其他组别高。  谈到学习方面的具体问题，近一半的同学认为部分同学的学习积极性有待于提高，超过三成的同学分别对老师上课方式、教学设备、课程安排有所不满。   
mpacc在浙江，哪一所大学最好考？,不考虑异地班的话，浙江只有四所学校招MPAcc。 以2016年为例， 浙江大学分数线230/75/120，招生人数25(推免18)； 浙江财经大学分数线219/39/78，招生人数50； 浙江工商大学分数线	215/39/78，招生人数81（推免1）； 杭州电子科技大学分数线	211/39/78，招生人数	40。 招生数据可能有出入，题主可以参考下。
浙江大学有哪些前景较好的工科专业？,计算机，建筑，电气。 欢迎来浙大。
上浙江大学城市学院还是垃圾二本？,同河南考生理解你的心情，今年分没过一本线，离想去的浙外差比较多的差距吧。杭州也是我一开始就选择好的城市。差二本的浙科也有差距。高不成低不就的分数对我来说选择也是蛮难的，高城院所有收文科专业的分数多，然后别的地方的二本也够上。 因为杭州的学校就是这样，二本的学校给你超过一本的分数，相对于省内而言我觉得出省是一个best choice。因为河南有些方面是相对于比较闭塞的，不及南方城市。 家里人希望留省内的学校这个心情也能理解，因为省内二本他们觉得更好听？更有面子？或者是觉得更有利于考研。但是无论哪种，大学这几年生活是你自己过的，不是家人过的。 复读我是十分不建议，能走就走，今年是二三本合并，以后就可能本科和专科的区别了，大方向在这里，这些东西差距会越来越少。 据我杭州本地人朋友来说城院的口评还是不错的，这个分能选城市就选个城市。北上广江浙沪的城市基础是比河南要好的多的，什么政策的试点肯定都是先在大城市实行。 今年我第二志愿填的城院应该是比较稳了，之前我爸妈也是非常不想我二本的分数去上三本，但是我只想去杭州，别的地方也没考虑过，好好的心平气和谈过了以后父母也不反对了，也希望你能好好的和父母沟通。 以上
浙大文科真的那么烂吗？,我是南大的。按理说这个答案没我的事。但是我看到LZ这么想觉得LZ想法还是有偏差啊。我觉得我要给你讲讲人生的经验。  有句话说，本科时代，选大学；到了研究生想搞研究了再选专业是真的。南大文科，不客气地讲，比浙大和厦大都强吧？ 然而并没有什么卵用，出了江苏省还不是被问南京哪个大学？  我一直很羡慕浙大的学生---但是不后悔来了南大---没法后悔啊，你们浙大社科对我们那一年不招文科生我怎么办，只能被迫来南哪了不是么。    我觉得啊，如果你不想搞研究，那就去浙大没有错。在找工作、保研、出国方面也有优势。 不说排名和声誉你浙在中国大陆就是名副其实的TOP 5（TOP 5的意思不是第五，而是前五；或者，说你浙和复交并列第三我也没什么意见，只不过复交占了地域的便宜），更重要的是现在很多名企都已经是清北复交浙了。 今年的顶级咨询公司---麦肯锡招聘，就去了5所学校----清北复交浙。没有去人大，没有去南大，没有去上财、厦大、中山。这意味着什么还用说吗？ 而我亲耳听过一个厦大会计专业的专业排名前5有机会保研到复交都没去的人说： 她觉得她这个学历，进不了这种咨询公司----这意味着什么？  意味着浙大在麦肯锡这种顶级企业招聘的top list之中，而厦大---虽然我也很喜欢这所学校，对不起，不是。  至于南大，去年麦肯锡还曾来过，今年么，呵呵，已经再也不来了。  南大文科研究实力强是不错，但是，我不客气地讲，现在总体实力早已被浙大拉开了。国内外排行榜没有一个排名南大是在浙大之前的。就生源来说，浙大即使是文科生源现在也总体超越南大了。生源超越意味着什么？意味着浙大的同学总体比南大更优秀---这就是实实在在的，我南大毕业的我也承认---当然我只承认总体。当然，要是有人认为高考总体分数差那几份代表不了什么我只能呵呵，我高考那年复交和清北也就差了几分，甚至复交和清北的分数差距比南大和浙大的还要小，然而呢？  说到文科，不可避免地说商科---虽然经济、金融、会计能不能算社会科学是有争议的。咱们就说商院吧。 AACSB_百度百科     厦大经管虽强，拿到AACSB了吗？并没有。南大拿到了，但只拿到一项---然而浙大不仅拿到了AACSB，还拿到了EQUIS和AMBA---国内同时拿到这三项的，除了浙大，只有上交了吧？ 这还不能说明些什么吗？     不少学校（尤其是南大的）总爱黑浙大是工科学校。浙大工科强是不错---但是说浙大是工科学校就是胡闹了。 想想吧，我记着十几年前，说商科都是北大人大吧？有上交什么事？ 但是今天谁还改质疑上交的安泰和高金？ 上交作为一个工科强校能把商科建的那么好，靠的大搞就是资源资金和人脉了吧。说到这三样，你浙缺吗？（浙大有钱是毋庸置疑的，至少比南哪和厦大有钱；浙商以及阿里马云帝的影响力更不用说了，南京和厦门有什么好企业？）  我这讲了这么多，看起来好像和你的问题没有关系。但是我的意思就是告诉你啊，不要只考虑专业。你要是不搞研究，上大学还不是为了就业，还不是为了以后能有一些校友人脉？  你去翻翻浙大校友会历年捐赠排行榜，看看是不是稳居TOP 5. 这些都是浙大实力的体现。  现在，依稀还记着当年小百合bbs里，一帮南哪的酸葡萄黑别人浙大，直到有个人发了这么一句：   “ 浙大的学生，无论到哪都能自豪地说自己是浙江大学毕业的。南大的学生，能做到吗？”      最后送你一句话： 珍惜吧少年。你现在所拥有的，正是很多人所羡慕的。  顺便说一下，劝劝你们高考招生部，建议文科立即对全国每个省份都放开招生吧。你能理解一个想去浙大的文科生，拿到高考志愿报名指南的时候，发现在文史类招生学生名单中却找不到浙江大学 的心情吗？ 
在浙大，你学到的最重要的东西是什么？, 海贤同学我来晚了，但我终究还是来了，哈哈。  在浙大120周年的时候，回顾一下以往的大学生活，觉得学到最重要的一课就是： Raise your standard， 永远不满足于环境，规范，和他人的平均标准，永远要为自己设定标准。   大一的时候刚到杭州，举目无亲，父母有一位老朋友安家在杭州，于是阿姨有一天晚上来看我，8点多，给我送一些吃的表示关心。那时候刚开学，我在图书管里看书，阿姨见到我的第一句话是：“那么努力干嘛，大学考试过了就好了嘛。”   那一刻我觉得有什么不对，却也说不出来。只能说，我喜欢看书，看看书挺好的。  大二的时候，各种课堂老师开始设定期望。当时还有一个课叫做“职业生涯规划”，就是老师讲一些MBTI理论啊，然后每个同学做一份PPT，讲自己的职业生涯规划（career planning)，投行咨询做研究创业。不一而足。那时候“职业生涯规划”是一门很火的课，还经常请成功学长回来分享经验。当时有一个学长，成绩一般，但进了四大（德勤），请回来做分享，讲自己怎么写简历，怎么面试，怎么过五关斩六将拿到德勤的offer。同学们一脸崇拜和渴望。  那一刻我又觉得有点儿不对，我不能对这些所谓名企，所谓牛逼offer产生哪怕一点点的崇拜感，好奇怪，这又什么值得羡慕，值得崇拜的？  大三的时候，开始认真学术，有了一些自己想研究的大问题，感兴趣的思考，于是就把时间都投入了进去。跟课本上讲的，考试考的，都没关系。我特别喜欢社会中实际发展出现的问题，读的是社会学。那时候开始关注到网络社会学，读Manuel Castels的《信息社会三部曲》，读KK的《失控》，各位老师天天讲工业时代社会学，经典社会学，我就都懒得听了。把一个已经死去的时代研究得再明白，都没有意思。  那一年，同学们去云南乡村做民族志研究，去富士康理解工人心理写论文。我哪儿也不去，蹲在网上写文章，研究互联网，看看新商业。  很多人知道社会学的一本书，叫做《乌合之众》，在知识精英中很流行的观念也是“大众是愚蠢的”。而如果你置身于一个所谓的“精英群体”里，环顾四周，你就不得不问自己一个问题：“在这里，谁是乌合之众？”  大多数人，即使在浙大，也不会思考，不会阅读，也只是一个社会受害者文化的缩影，成为面目模糊的群体的一部分。在任何一个学校里，嘴上是说着鼓励创新，创造的，而实际的操作上，不过是求一个安全感和平庸。  毕业那一年，本校我最欣赏的老师，也是当时本科生院的主任，做毕业演讲。那天在所有人的面前，他报告我们这一届，有多少人去了国外深造，有多少人去了什么企业，又有多少人主动去支援西部工作…… 这是他的职务，他必须要说的话……虽然，作为人的层面，他是个天才，热爱并投入学术，从教20周年，他敢于说，自己有生之年渴望拿到一枚诺贝尔奖。  生活是一场自我期许的游戏。  学校里专业课程设计，每门课要求读那么一两本书，但永远有人会读20本，50本，甚至把这个领域的书全部读通。学校里，老师告诉你，考试过了就行了，写一篇论文就行了，总有人会投入全部的心力，把每一篇论文都写成精品。毕业的时候，大家说，找一份好工作，早点买房结婚，就够了，总有人会说我不干，我要做出一番更大的事业，成就一种更伟大的生命价值。  其实，和读什么学校，又有什么关系呢？一所大学，对有些人来说，是人生的上线，对有些人来说，也不过是人生的底线。  标准是自己设的，游戏是自己的。别人读不读书，努不努力，对自己认不认真，是别人的事情。自己对自己有什么样的标准，是自己的事情。 
浙江大学转专业真的有官方说的那样零门槛吗？,没有硬性条件 然而名额有限
城市规划专业考研择校问题，重大和浙大如何选择？,2012年教育部学科评估 城乡规划学 重大全国第四 浙大全国第十二  以上实力差距还是明显的。  研究生就不要在看学校综合实力了，那个用途不大。一句话说的好，本科看学校，硕士看专业，博士看导师。现在城规就业的行情不好，如果不选业内最认可的老八校，那就给就业加不了分了。至于地域优势，当然不能忽略，不过不要忘了，老八校几乎可以说是全国通吃，而浙大只能局限在那一块地方。所以，考哪所大学的研究生，这个不言而喻。
浙江大学和复旦大学哪个好？,问的简单，题主其实是要一个简单的回答。  复旦好。因为绝大多数进浙大的人是考不上复旦的。
浙江大学可以进去拍婚纱照吗？,可以的，经常看到有人拍，不过车辆在学校里呆久了要交费用。
人大、南大、浙大如何选择？,首先，亲，你要知道，浙大是大类招生，一般说来浙江以外可能科设大类会略高，其他各大类的分数线基本都是最低录取线，所以虽然垫底但是却基本没有专业压力。大一录入大类后你有一年的时间来熟悉各专业，在大二根据大一成绩在大类内或者跨大类选专业，实际选专业时因为大家兴趣不一等等原因，操作空间非常大，除了个别非常热门的专业，只要成绩不太差，基本都可以进心仪的专业，你喜欢的心理在理科大类，听说不错的，你可以问 @采铜  ，环科在哪个大类我还真不是很清楚，多跟招生老师沟通吧。 【福建省】2013年高考招生咨询帖    是浙大贴吧的福建咨询帖  【大类咨询】理科试验班介绍及答疑    这是理科大类的咨询帖 大类招生是个很有特色的东西，有利有弊，一言难尽，我个人挺支持的，这个给了你很大的个性选择余地，没有人管你，大一大二一个寝室可能四个人专业都不一样，你要自己操心选课、活动等等。总之就是一定要知道自己想走哪条路，只要做到这一点，并且坚定地往下走，机会真的是非常多，尤其是理科，出国氛围还是很浓的。 大一大二所在的新校区紫金港硬件相当好，景色、环境也很好，住着很舒服。 【国有成均】浙江大学之紫金港震撼美图~_浙江大学吧    雪景： 【发几个图】亮瞎你们，亮。瞎。你。们。。。。。。。。。   其他各校区也各有特色，比如我就更喜欢玉泉校区，有一种深沉学术气息，紫金港总觉得有些浮躁，还有之江校区的民国风，真是非常稀罕 【杭城记忆】★☆这里是国立浙江大学，中国最美丽的大学★☆    最后，隆重向你推荐百度贴吧浙江大学吧，他们每年都有招生咨询、迎新等等活动，办的非常好： 浙江大学吧_百度贴吧   
想去浙大或上海交大读研，电气。虽然浙大是电气四虎，但感觉上交地处魔都，或许能提供一个更好的就业环境？,哈哈，楼上好多他浙的知友~~~~我来替我交说两句~~~~我也是电气专业哦~~~~ 学术上，目前电气专业确实是他浙更胜一筹。 但是，从你的问题表达来看，你读研不是为了搞学术的。从找工作的角度来讲：      1、如果你想找电气本行的工作，在业内各单位看来，交大和浙大是同一档次的学校，没什么差别，二者所受到的待遇是一样的。当然，电力行业内上海这边还是交大的人多一点，浙江肯定是浙大的地盘。      2、如果你找工作想转到其他行业，尤其是工科转金融一类的，上海的平台还是很重要的。而且金融圈也是很认学校的，据说有“北清复交”的说法~（浙大的朋友们不要拍我，我知道错了。。。）~~不可否认，这方面我交是有优势的。 好了，第一局战平，第二局胜出，显然。。。。 而且，本人身边的同学，有本校保研的、外校保研的（也有浙大过来的）、考研的，还从来没有人来了上海交大感觉到后悔的~~  多说一点，如果LZ是想搞学术的话，那么浙大交大这个层面上的学校，不同学校所导致的影响差别已经很小了，自己的本事和研究成果才是第一位的。进一步想出国读博的话也是如此。  再多多说一点，一月份问这个问题，看来LZ应该是大三，希望通过保研来的，那么交大和浙大在暑假都会有夏令营，可以参加感受一下再做决定。。。额，如果你是想考研过来的话，还是先好好复习的好，这两学校电气都不好考呢~~~~  最后，欢迎来我交：)~~~~
浙大为什么被称为宇宙大学？,浙大目前杭州有 紫金港校区 西溪校区 玉泉校区 华家池校区 之江校区，已经被撤并掉的还有个湖滨校区。然后在舟山还有个校区，宁波还有个学院，似乎在英国和某大学合办还有个校区。然后就开始调侃世界各地到处建，建上七大洲，走出亚洲，走出地球，走向全宇宙233333333
金融硕士纠结浙大，央财和西财，哪个性价比更好一些，就业方向是投行、券商或者银行总行投资银行部,谢邀，不好意思，以上三所具体情况不甚了解，但是对金融院校宏观情况略知一二。 第一梯队: 北大光华，清华五道口，上交高金，复旦金融。 北大听说今年扩招了，专业课书目也大面积调整，上交高金一般考不进，一般都保研，考研要求出身985以上，一般都C9.   复旦招生人数多，分为经院，管院，数院，(100个多一点，但有缩招趋势，  第二梯队: 人大，上财，中山，南开，央财，西南财经，南大，厦大，浙大(有漏掉的别打我，告我一声我补上~ )  建议:  结合自己实力，尽量往上冲，能有多高冲多高。湖南大学是好学校，16年不止一个人考上了复旦金融。 尽量选择魔都与帝都，原因你懂的。 尽量选择名校，北大帮，清华帮，复旦帮，金融是有圈子.....  stretch yourself.... 我吃饭啦，食堂黄焖鸡(ฅ&gt;ω&lt;*ฅ)  倒计时30天+，佛祖保佑
如何证明浙大校徽跟阿玛尼没有关系？,因为真没啥关系，只是越做越丑了。 我最近因为工作的关系在整理世界各个大学的学校符号，把浙大的部分整理一下贴上来给你看看  先给不明真相的吃瓜群众看一眼，浙大现在的校徽是这样   GA的logo是这样，其实本来也不像好吧，完全就是你们黑着玩嘛。浙大使用鹰这种视觉符号真的是因为自古以来......  据我所能找到的资料，最早的浙大校徽可以追溯到民国25年之前，这只鹰应该是浙大多年传承的视觉符号了   后来有了削弱政府印记的版本，民国26级浙大学生卞华年设计，飞鹰代表浙大精神，横条象征三民主义，六角形象征苯基（为什么是苯基......） 那时候的浙大校徽长这样  我知道要辨认有点勉强，不过中间那个真是一只鹰，我想现在的浙大依然选择鹰作为校徽的主要元素也是为了传承历史  至于现在的这款logo浙大自己的官网上就有很详细的说明，是在90年征集的  不过确实很丑就是了，还不如民国时期的老版本好  而armani的老板乔治·阿玛尼 (Giorgio Armani) 1934年7月11日出生于意大利皮亚琴察，那时候浙大就已经在用鹰作为自己的象征了所以抄谁也不会是抄armani嘛  顺带说一句，浙江大学四个字是用的毛泽东的集字，实际上他没给浙江大学提过字。但是自从49年北大要到毛泽东的手书校名以后全国的各个大学就刹不住车了，浙大这样还算守规矩的，还有人把毛泽东回信拒绝时信封上写的地址弄下来当做自己学校牌匾。你们猜是哪所学校：）
如何评价浙大计算机学院15级对陈越姥姥的差评？, 老师：禁止作弊。  学生：我凭本事做的弊，你凭啥不让过？！我要投诉到学校！  老师：你投诉吧。  学校：作弊可耻，你投诉你妈个卵。  学生：卧槽！这个老师背景深厚、有靠山！我要在知乎发文谴责、声讨、扒皮！  学生扒皮半天，没找到黑点。   学生耿着脖子嚷嚷道：她这么大年纪居然不结婚！你说可耻不可耻！！！   这是哪个学校的学生？！真TM不要脸！！！ 
