清华和浙大怎么选择？,北方人清华，南方人浙大 想去北方清华，想去南方浙大 想找汉子清华，想找妹子浙大  是妹子来清华，是汉子去浙大吧 小学妹的话有问题请联系我hiahiao(≥v≤)o
浙大哪些专业就业前景比较好？,有一种说法是浙大的学生应该胸怀远大，不应该以就业为导向…… 但是…… 真的计算机是王道啊哈哈哈哈哈哈哈哈哈~~~~~~~~~~~~~~~~~
曾老师黑浙大是对浙大在浙江人数招的过多而不满嘛？为什么不直接说出来。。？,印度的发展也一年比一年好。。
在浙江大学就读是怎样的一番体验？,你来了就知道了
浙大（西溪校区）附近有什么好吃的？, 第三次自问自答，     1. EAC 汉堡王  2. EAC 对面，唐炱宗肉夹馍（刚烤好的脆皮真的好吃）  3. EAC 新时期烤肉  4. 影业路，老街面店（桂花酿好评）  5. 南园正门对面，溪园留学生食堂（留食一贯作风）     其他两个校区的回答：   知乎用户：浙大（紫金港校区）附近有什么好吃的？    知乎用户：浙大（玉泉校区）附近有什么好吃的？  
为什么浙江财经大学在浙江的招生分数线如此之高？,在浙江，尤其文科，浙财大会计可以上重庆大学等985高校，更是秒杀一片211。 首先，地域。我作为放弃财大去内地211 读书的人，深深感到地域这个平台带来的束缚。资金不充足，活动流于形式，大多同学只求现世安稳。而在浙江，无限多的机遇和挑战，有冲劲的同学，环境大不一样。 其次，财经。西南财经地域一般为何分数线接近川大？“财经”二字功不可没。且浙财大多为方便就业考研出国的专业，选专业也是相当重要的。 还有，未来发展。大多浙江人未来集中在长三角。那么校友力量和人际网络就无需多言了吧。  如果再给我一次机会，我可能会选择浙财大优势专业，211/985没有想象中那么重要。
如何看待浙江大学四点起床拉练？,如何看待有些智障屁大点事往知乎上发 如果像以前一样凌晨让你步行去靶场 你想起义吗
浙江财经大学东方学院就业毕业情况如何？,我们的公司里很多同事都是浙江财经大学东方学院的，和我关系都不错，和他们聊起过母校，他们都很喜欢这所学校，对她是夸赞有加，说学校的宿舍怎么这么好，环境也挺好，挺安静的很适合好好学习，学校的老师也非常的厉害，对学生很关照，也经常给予学生很多的帮助。然后在和他们一起工作时，他们也很认真，专业技能和想法都挺多，也经常能帮助我，我觉得学校能培养出这么出色的学生，肯定也是不错的，有机会我也要去看看啊。
打算报考南京大学或浙江大学的数学系，望给出一些建议 ？,你去看看丘赛获奖名单就知道浙大完爆南大了 浙大的数学系尽管不强 但培养的优秀学生很多 因为有老黄一直在耕耘
是去南京大学或浙江大学的一般专业，还是读武大最好专业？,不好意思刚看到你是湖北文科200名，去年浙大南大都是618分，是144-154名之间，你去这两个学校的机会不大。建议考虑低一档的上海财经大学、中央财经大学、对外经济贸易大学、中山大学。  ------------------------------------- 首先看你想本科就业还是想深造。 1，想  深造  （保研或出国）的话要选一个高的平台，也就是好的学校。现在社会上评价学校档次基本是按分数来，全国普遍来看是浙大&gt;南大》武大。想出国的话可以看看全球大学排行榜，国外大学录取的时候也会参考排行榜来判断中国大学的等级，比较有名权威的有三个榜：QS， USNews和泰晤士，你可以自己去查查。  2，想  本科就业  的话，主要看城市，越靠近金融中心越好。 2.1比如你想在上海就业，首先看一下目标学校在上海的分数，也就是在当地的认可程度。相信你也听说过，北京上海的公司更倾向于招本地大学毕业生、或很有名的外地大学毕业生。 举一个例子，兰州大学虽然是985，但在上海就业还真不一定比得上上海大学。因为在上海，上海大学分数比兰州大学高得多，当地人就会觉得上海大学比兰大好很多。另一个例子就是本答案评论里一个辽宁文科生觉得上财好于浙大南大，就是因为在辽宁上财文科分数高于浙大南大。在上海，分数排名是浙大&gt;南大》武大。 2.2再就是看远近，这决定了你以后实习的方便程度，以及不同城市院校之间的交流程度。距离上海由近及远是杭州、南京、武汉。 以此类推，比如你想去北京或者深圳广州也可以用这个方法判断。  其实所谓的选城市、选大学、选专业指的是选沿海  发达大城市  、选  名牌大学  、选  热门专业  。至于学校的这个专业具体排名第几，对于本科生的意义并不大，一般要在博士阶段才更看重该学校的特定专业实力强不强。 比如清华的经管，无论是就业还是深造的出路都是top2，但究其实力则差了不少，其实无所谓的。 再比如复旦计算机，实力排名很低，但是出路依旧不错。 上大学就是为了四年后有个好出路，不是吗？
浙大合校后实力跃居全国第三而吉大不升反降的原因是什么？,其实吉大合并后排名也有一些上升了，不过基于诸多因素影响，综合实力并未像浙大那样迅速上升继而稳居全国3-5名。 从参与合并的高校来看，吉林大学由吉林大学、吉林工业大学、白求恩医科大学、长春科技大学、长春邮电学院、中国人民解放军军需大学等六所高校组成，而这几所高校在校史上几乎没有关联，在合并时受到很大阻力（六校领导班子安置、行政处室干部选用、院系教研室学科带头人评选，六所高校，就要面对着更多的重合处室、专业），可见吉林大学的合并基本完全是由政府行政命令主导。并且现在吉大有6个校区7个校园，多校区大学在教学科研管理（行政处室要在各校区设立派出机构）、基础设施建设（学生宿舍、食堂、田径场、体育馆等）上的资金投入数倍于单一校区大学。另一方面，吉林省的经济增长乏力（2014年13803.81亿元，增速6.5%，位列全国倒数第十）乃至整个东北老工业基地的衰落，政府财政给予吉大的教育科研经费补贴减少，不利于引进人才。并且高校在合并前会上马诸多基建项目，以尽量花完学校财产（合并后各校债务均由新组建的大学承担），吉林大学参与合并的高校过多，负债严重，近两年甚至打算以土地出让的形式偿还巨额利息，不过拟出让的朝阳校区内有原“伪满洲国”八大部建筑（地质宫）属于文保单位，一时难以出让。另外吉林大学的招生也是主要面向东北三省，在东北老工业基地衰落的大环境下，除了各省的几所顶尖中学外生源质量也不可避免地会滑落。 浙江大学合并了浙江大学、杭州大学、浙江农业大学、浙江医科大学等四所重点高校，参与合并院校均为原“国立浙江大学”拆分独立出去的，在校史上存在密切联系，在合并时受到的阻力以及社会舆论压力要小得多，并且浙江大学四校学术科研实力较吉林大学六校要高，且更为平均。另外，浙江省地处江浙沪长三角，经济发展迅速（2014年40153.5亿元，增速7.6%位列全国第四），民营经济发达，高新技术企业多、产学研结合好，更容易引进人才。又由于浙江大学是浙江省仅有的一所985/211工程大学，浙江省给予浙江大学的经济、政策支持均远胜于吉林大学从吉林省得到的（吉林的经济本来就不如浙江，还要把本不充裕的经费分给包括吉林大学在内的三所211工程大学）。另外从生源上来看，浙江大学的招生近八成是面向江浙沪乃至整个华东地区，自古以来江浙沪地区的生源质量高，在学术科研上也更容易出成果，华东六校以及其余重点大学的综合实力均极强，科研以及人才培养上的相互交流也好于东北三省。在基础设施建设上，浙江大学现有五个校区（紫金港、玉泉、西溪、华家池、之江），并且通过土地出让拍卖了整个湖滨校区以及华家池校区的部分土地，偿还了学校债务（杭州地价远高于长春，浙大卖地赚了很多钱，而吉大就不一定了），并且通过政府支持，重点建设紫金港校区，减少了各校区重复建设问题。
浙大副校长是因为违反交通规则而导致车祸身亡的吗？,从公布的监控录像资料来看，可以看到事情的经过是小车突然向右转向，导致大货车躲闪不及而酿成悲剧。因此，存在一下几种可能：         1、小车错过匝道出口，没有注意到后面的大车，强行变道。         2、小车司机身体出现问题，导致突然向右晕倒，从而使方向盘右偏。         3、小车车辆出现故障（例如爆胎），导致突然车辆失去控制。          第一种可能是可能性最大的，同时全责也在于小车。          个人认为第二、三种情况在逻辑上说不通。我们可以从媒体得知，小车司机为浙大副校长。车祸发生地点在杭州绕城高速三墩出口，内环方向（由南向北）。时间为早上6点左右，为上班时间。从地图上来看，该出口正是通往浙大紫金港校区的出口。         正常来讲，司机本应该从此出口驶出。如果事实为第二、三种情况，司机为何不从此出口驶出呢？此处不符合正常的逻辑。          因此，第一种情况是目前来说最符合事实与逻辑的推断。         然而，在事故结果调查出来之前，任何推理仅仅是推断。在此为死者默哀。
在浙江大学生活有哪些技巧？,谢邀（居然被邀）  想在一个地方过得好，第一步是了解这个地方。如果你是浙江人，那需要好好了解一下浙江大学，不是的话还得了解一下浙江 杭州。 ………… ………… ………… ………… ………… ………… 这里是明天考完计组再补充的分割线 回答问题攒人品  实在抱歉拖了这么久才来填坑 ………… ………… ………… ………… ………… ………… 总觉得因为每个人有不同喜好，尤其是遇到同样复杂情况时会有不同判断，介绍自己的喜好和经验有些不负责，所以还是决定尽量介绍得宽一点：   学会搜集信息  　　当你知道什么地方有什么，什么事该怎么做，一切都会变得简单起来。因此，好好利用各种资源吧，qsc新生手册，本科生院网，zupo，学园网，自己的院网，cc98，qsc手机站，xgb，公体部，你的学长组，你的各种学长学姐，史纲课的浙江精神与浙江发展，学生手册，辅导员，各种微信公众号。周边服务信息、学校最新通知、一些理念和民俗，渐渐你也能成为一名浙大的讲解员。其实，哪家店好吃，哪里的服务更良心，买什么东西更实惠永远没有一个绝对的答案，更何况堕落街的店铺更迭速度快得吓人。 你需要搜集的是事实而不是评价。    学会权衡取舍  　　如果你每天把上面所有的网站之类都看一遍，必然会累死；如果你选择把大学所有需要用的东西都从家里带来，必然会后悔；如果你将来打算每天睡10小时打8小时游戏拿国奖出去交流参加所有活动和社团坚持锻炼有个妹子修二专业提前毕业申到一万个学校占个保研，那一定是该送到七院接受治疗了。 　　总之，人不可能顾及到一切，执念太多很难活得优雅，选你最需要的可以大幅提高效率。   学会维权  　　上大一的时候最大的触动就是浙大是个维权意识相对比较强的学校。举个栗子，校园里的自动售货机，偶尔会扔进去钱就死机，或者买了可乐掉出来薯片之类的。事实上拨打机器上的电话很快就会有人来帮你解决，然而大多新生都选择自认倒霉然后四处抱怨社会黑暗腐朽。 　　学校里维权组织不少，校会的权服侠，三大学园的权服，竺院权服部，医学院MSU，求失狗等等。食堂、选课、停车、噪音...大多问题都可以靠他们解决。虽然偶尔会有人说，学校的组织当然还是会给学校说话。但我所看到的是，只要权服的工作人员一心想为大家服务，每次跟他们的交流都会被感动。（所以如果你也是愿意主持正义的人，可以考虑加入他们）   学会接受新鲜事物  　　杭州是支付宝的故乡，浙大在创业的人数不胜数。大学生创业的问题暂且不表，不得不承认的是，很多成果确实给人们带来了便利。网上支付、外卖软件、打车软件，杭州市民卡也算一个吧。习惯了这些的我去年看着我家乡来的新生以不安全为由拒绝使用任何现金以外的交易方式甚至拒绝办银行卡觉得很震惊。在浙大感受到太多的新鲜事物和理念，让我第一次对于某些东西带回家乡感到棘手... 　　当然，来自全国各地的同学生活习惯和思想观念都有很大差异，个体差异往往还会大于地域差异。学会互相尊重互相学习可以让你变得轻松，毕竟无论把跟人争论粽子是甜是咸的时间用来干点什么都会收获更大。  　　也许不仅是在浙大，在哪里生活都需要一些技巧吧，共同进步~  转载请注明出处 →_→  （PS:对于个别在给新生提供帮助的时候从不提起如何分辨是非，如何融入大学生活，却把自己社团的私人恩怨夹杂在其中，顺带炫耀自己的种种成绩，把自己情绪化的夸张评价当作真理的学长组们，我也是醉了...）
在上海财经大学浙江学院就读是怎样一种体验？,居然有这种问题。       我是北方人。来南方各种不习惯。金华也不是我想象中的大城市。因为没听说。而我又见识少，对金华的印象停留在火腿上，印象里南方是高大上的，富裕的。然而。。。。        这里没有我喜欢的人儿，也没有我爱吃的烧烤，没有哥们儿，只有一帮子乐队的好朋友，只能没事儿给我自己找找刺激，在这个波澜不惊的大学，除了那次真的太刺激了，学校劝退我，因为成绩不好。         以后会有很多记忆在这个学校，我会有很多段子讲述在学校里的一天一天，四年的时光很快滑过，毕业后再来完善这个问题吧。
为什么浙大明明不如清华却还是有很多人特别自信特别装逼的样子？,考完试了决定来认真答一下这个问题。  首先来分析一下题目的逻辑：          单从这个题目来说，尤其是补充说明，其实也许题主你想说的是：浙大里面有部分人优越感爆棚，自以为天下第一，傲视一切。那么其实这是与浙大无关的，你想鄙视的是那些目中无人的个体，不管是浙大，交大，北大，任何地方都会有这种人，题目说明里面的“竺可桢校长”可以换成任何一所大学的知名校友，“考败来浙”可以换成“考败来旦”，“考败来交”，“考败来科”。      那么，这样的人在浙大真的很多么？        截止到目前，这个问题只有48人关注，486浏览，在28个答案里，也并没有太多浙大的来无脑喷题主，说“我们就是天下第一题主傻逼”啊。      而且就我认识的浙大学子而言，绝大部分都是在求是，踏实地做自己的事，到网上装逼、无脑参与网上论战的人不多，真正和人吵起来也多半是受够了“某些人阴险的论调”，维护学校的名誉罢了，无脑撕的人少之又少。      可见，这个问题并不怎么成立。      但是其实看过你其他troll的提问的都知道，其实你只是想单纯地黑一下浙大而已。【笑      我相信清华的资源是很多的，也相信很可能比浙大的要多，要好。可是，我们就不能认为浙大不错了么，这样就是自欺欺人的么？     诚然，每个人的层次是不一样的，但是同时每个人的追求也不一样。这些追求并没有优劣之分，我们也不能以一个指标来衡量所有人，题主你总不能说“不搞科研的都是傻逼”，“发不了SCI，EI的人是谁给你们说话的权利？”这样的话吧？      题主很牛，这我早有耳闻。可是其实你也知道，比你牛的人多了去了，至少在光电，题主也不敢说是这么多年来最厉害的一个人吧？      另外，我也不知道为什么题主有这么严重的清华情节，而且为了凸显自己的清华情节还爱拿浙大说事。浙大是比清华差，可国内又有哪所大学比清华厉害呢？按说一个牛人，他最牛的地方就是知道现在该干什么，以后要怎么规划，而不是整天沉浸在过去，拿“自己当年怎么不去复读啊”来叽叽歪歪，这样和那些本科不努力，就爱拿高考成绩吹牛逼的人有什么本质区别呢？     我版搜了题主在cc98的帖子，注意到题主的签名档：  : 龙应台：大学里有两种人，一种人占了大多数，他们“只有两件值得关心的事：一是把朋友交好，以后有结婚的对象，一是把功课读好，将来有满意的出路。”而另一种人极少极少，他们拥有“对社会的关心，对是非的判断能力，择善固执的勇气”。     我丝毫不怀疑题主是有选择固执的勇气的，可是对提到的其他方面，我个人持怀疑态度。       说句题外话，在知乎，我很喜欢Andrew shen 这类人，不仅仅是因为所谓的清华特奖，而是那种科学的态度，求是的精神，而打开题主的主页？     当然我没有资格来要求题主，正如前面所说的，每个人追求不一样，你就是爱钓鱼，爱在网上瞎比比，我也管不着。不过变着相地黑浙大，也不妥吧。   不知道题主毕业这么久，还记不记得校歌的旋律呢？    “昔言求是，实启尔求真。”    共勉。
浙大和南大应该选哪个？,南大数院来答一下，首先呢，南大所有人都明白一个事实就是工科比不上浙大，起步晚，氛围不够，所以，你弟弟要真心想读工科，那肯定还是浙大。但是呢，如果想读理科，南大是再好不过的选择了。（ps：那些喷的人，其实我南的人都明白工科比不上浙大，但是，我南不是哪项都比浙大差，所以别喷了，除非你是清北的，不然我南还是不太可能被你们全面碾压的。）
浙大复旦清华的研究生方向的数学专业，到底哪个更好？,我是浙大数学系毕业生，但我大二和大三的两个暑假都在清华上暑期数学学校。这两所学校都各有利弊。如果你想学习纯数学，那么现在清华比浙大好些，因为有丘成桐坐镇。如果是应用数学，那么浙大好些，浙大的应用数学很强。
“浙大军训女神”的后期是如何处理的？,原谅以下的答非所问，忍不住说几句。  作为原作者的朋友，可以负责任的说，嘉俊同学做了后期，是用RAW文件在LR、PS中做过从基础曝光到色彩细节的一系列后期。后期流程固然不算复杂也不算高级，这里不谈上镜的女生外貌因素，但是不经过这些一系列的调整照片不会这么自然养眼。另外，他在拍摄时使用的全部器材是 Canon EOS 5D Mark II 和 Sigma 50mm f/1.4 EX DG HSM。图虫原帖：  http://  tuchong.com/285424/6853  095/       可自行查看EXIF参数。  原作者是浙大非摄影艺术专业的在读学生，偶尔约片补贴生活费。这次纯粹是缘于爱好在军训休息间隙去拍一个上镜的朋友。“炒作”这个词实在不能作为拍摄者和被拍者的动机。另外“女神”这词他在标题里从没用过，是媒体转发时加上的。请勿根据只言片语的报道就马上脑补丑化照片原作者形象。另附照片原作者微博声明截图。  你觉得在烈日当头的军训操场上顶着他人目光和各种军规用闪光灯反光板去布光可能吗？ 你觉得学院人像清新照用商拍那套双曲线dodge burn精致到毛孔的后期合适吗？ 化妆怎么了？现在女生拍个证件照都会化妆的年代你就不容一个妹子拍照前化个淡妆？ 因为细节上和环境光线上的不足就说美图秀秀？请美图秀秀一个。  后期这种个人审美作用因素大的事物本来就难定标准。 语气轻蔑的嘲讽者们，有的照片可能不符合你的审美和艺术认知，但求客观指出别再恶语伤人，无论对摄影者还是出镜的女生。毕竟回答评论区更需要被建设成答疑解惑的教室，不是脏乱差的网络公厕。  之前看过微博也算了解那段时间的他为何会难过。作为朋友的支持评论不出几秒几分就会淹没在充斥着戾气和猜疑的负能量里。谁又能真的越过那些污言秽语去接受一个满是敌意的舆论环境？  作为和他一起拍过照（只是风光和扫街）的机友，我认为一个有才干有热情的摄影爱好者的作品不该被如此刻薄对待。  有时，与其说反映素养与审美的是照片自身和创作者，不如说是看照片的人。
我是浙江省考生 本科金融 准备考浙大金融专硕 以后想回浙江发展 西南财大的金融和浙大比怎么样？,利益相关：同准备考研的西财本科生。 1. 地域最重要。建议首选北上的学校。清北复交人+两财一贸，实习不要太方便。因为你家在浙江，在长三角就业的话，建议复交或者上财（当然清北最好，但是难度很大……） 2. 如果非要在上面两个学校里选的话，建议浙大，尤其考虑你要回长三角。地域上两者都不占优势，但是浙大名牌985护体+离你家很近，不论以后你是就打算留杭州还是去上海，浙大认可度都远大于西财，没有可比性。 3.西财金融专硕的流向主要是成渝+广深，并且银行占主流，基金买方+券商核心业务部门（投行研究所资管之类）都不多，并且基本上是中小机构，能进大机构的很少。 4.其实不一定非要考金融专硕，竞争太激烈。其实只要是大经管类方向（税务、经济、会计等）最后就业上差距都不会太大。相对的，地域和学校牌子比专业重要得多。 5.当然，相对的，浙大因为招的人少很多，所以难度也比西财大，风险大不少。
为什么说「武汉大学是一本，而浙江大学是三本」？,你这么给武大招黑，当心压在樱顶做肥料。
想去浙大读临床医学，求建议？,说浙大是清华北大后国内最好的高校之一，估计没人会反对。说浙大医学院是协和北医之后国内最好的医学院，估计没人会赞成。  如果高考分数够的话，可以选择协和、北医、复旦、交大、中山医、华西、湘雅、武汉同济这些学校。  好像很多人提到了浙大的4+4…说真的，学美国何必要学这种形式…全世界读医这么搞的就北美，大部分国家都是本科医学教育，不也挺好。。。
浙江大学是三本吗？,不是。
2018机械考研，南航与浙大？,南航机械实力很强啊，并不比浙大差。既然考南航胜算更大为什么要去冒险呢
上海财经大学浙江学院怎么样?, 不怎么样 
