在你印象中，浙江海洋大学是怎么样的，如何评价呢？,我16年毕业，其实我毕业了才知道我的大学根本就是非主动的，大学本质上没区别，主要看个人主动性，本着随大流，混毕业，啥学校啥平台给你都是没意义的，我就是反面教材，咋匿名来着…算了，不会，学校是一个大的平台要善于利用……不要指望学校，想要什么自己争取，改变命运………
浙大有可能超过清华吗？,每年武书连出排行榜的时候
保送选择浙大外语系还是北外？, 虽然已经是老帖了，但今天偶然看到这个问题实在不吐不快，所以强答一记，希望给未来有同样困惑的学弟学妹们一点微不足道的参考吧。  利益相关：北外英语系毕业生，现在海外某TOP10高校语言学博士即将毕业  当年准备保送考试的时候，可以选择参加清华英语系或者北外英语系的考试（两者在同一天）。因为打定主意去英语专业，自然知道北外英语系是比清华英语系好的，可是为着清华的光环还是犹豫再三，最后因为清华英语系规模太小，而且当年好像都不叫英语系而是叫外语系英语方向？所以选择了北外。在北外四年说没有动过后悔的念头是骗人的，因为北京名校实在太多，北外又不是综合性大学，说出来感觉没有清北和隔壁人大那么响亮。所以下定决心要出国读一个名校来弥补自己的遗憾。真正意识到北外有多好是出国以后，主要体现在下面几方面：  1. 北外作为外语类强校，实力是国外名校所认可的。我现在所在的组老师都听说过北外（因为去北外参加过某重要国际学术会议），并且认可北外的科研实力。硕士项目里几乎每年都有招1-2个北外学生，而其他的国内学校并没有这样的情况。  2. 和其他国内名校英语系的同学讨论对比，我们都认为北外英语系的教学是非常扎实的。扎实的基本功为以后硕士博士的学习铺平了道路，不管是继续学习语言类专业还是转行去学别的专业（仍然需要用英文进行学术写作）。  3. 在北外英语系的地位是绝对是很高的（并无贬低其他专业的意思），所获得的资源也相对较多。真的如愿以偿来到了综合性名校，会发现往往受重视的是STEM学科（大势所趋）；即便是我现在所在的学校身为传统文科强校，语言学系所获得的资源肯定比不上理工专业。虽然未曾就读过浙大，可是想必浙大外语系也会有类似的困扰。  4. 北外的学术氛围很好，校园环境相对单纯。周围同学都很努力上进，毕业的时候大部分同学出路都不错而且多种多样，在国内去北大/人大读法律/金融的我们那届有好几位，出国转专业的更是有许多。  总之如果想读外语专业，北外真的是一个非常好的选择，而且在北京找工作认可度也是很高的。如果担心外语类院校格局小提供的资源有限的话，我只想说，北京的学校那么多，现在获得知识的途径也五花八门，想要学习的话总是有办法的。而且北京毕竟是天朝首都嘛，机遇发展绝不会比杭州差。  越写越想念母校了呢。吃水不忘挖井人，毕业方念母校恩（？？）遁走。。。 
相比较其它地区，浙江考生上浙大有多大优势？,为什么邀请我？ 在欠发省份看来，浙大不错。是一所“好学校”，毕竟在发达地区，比本省的985（有的话）区位条件和经济情况要好。至于是否是全国知名名牌大学，主要看省内某排名机构的宣传了。 但对于浙江省这样的发达省份（还不算上海北京）来说，浙大的优势就有些捉襟见肘了。条件稍微好的家庭（特指杭州，温州，宁波等地），一般不会以孩子考上浙大为骄傲。稍有志向的都是复旦，清华北大。实际上最有志向的都出国念本科了。那个去哈佛的女生的故事你知道在浙商群里传了多久吗？她爸爸很多人都认识。 哈佛，才是他们的目标。清华北大是继承家业的基本要求，复旦也是可以的毕竟是商贾之地。浙大就真的有点low了。换个好听点的说法，就是没有挑战吧。小康家庭，普通孩子就能去。
怎么样才能找到浙大的研究生做男票？,我就是浙大研究生......哈哈哈哈哈， 多来玉泉转转就行。 我给你推荐个人啊，浙大大帅锅博士...我去，超超师兄的知乎呢
浙江大学对二本学校的考研生有歧视吗？, 这个世界，是个尊重强者的社会。  你若是足够强大，当然没问题。  有实力，叫自信，没实力，叫自负  二本院校的学生，说明高考之前，与上一本学校的比起来，是失败的，自然被那些一本的瞧不起。  但是你若是自己都瞧不起自己，从心底怀疑自己，又怎么可能会成功呢。  祝好运  
如何评价浙大马院120校庆方阵照片微博爆红事件？, 浙大躺枪，浙大正规院系躺枪。  一开始没人说清楚这是马院的方阵，只说浙大，自然都高潮了。  现在说清楚了，不管是马院领导授意还是马院学生主动，马院搞这种丑剧很正常啊。这种五毛系还是和本校划清界限比较好，占了人家的地还毁人家名声真的不地道。 
浙江大学每年招收6000本科生，这么大的招生规模对个人发展会有影响吗？,谢邀。  首先，浙大当年的并校并非是随意地就近地找了几个就并在一起的。题主不妨翻阅下下1952年学校改革的历史：当年学习苏联模式，把大量中国的综合性大学拆分成了专科学校，浙大在这一年里除了工科四个专业保留，其他学科全被拆分。时移世转，曾经拆分出去的文学院，医学院，农学院后来各自成为了杭州的四所大学，并且一直和浙大秉承着一样的校徽和校训。1998年，为了加强学科合作，在老一辈校友（如苏步青，王淦昌等）的提议下，浙大收回了曾经分出去的部分，组建了新的学校。当时，浙农大，浙医大，杭大都是211的candidate， 尤其是浙农大的农学实力，一点也不比当时浙大的工科实力差。所以说，并了三个二本，绝对是无稽之谈。  当然，合并一定会带来很多问题，比如大幅上涨的学生数，比如整个浙江省一下子就剩下一所211学校了。幸运的事，紫金港校区的开辟，学科融合的促进，加上本身文化的认同，让并校之后诸多问题很快得到解决，而且也让浙大的实力上了一个阶层。  有一些学校，总爱标榜自己招生少，宣扬所谓的精英教育。即使贵校一届只招1000+，敢说平均生源质量有我浙好，敢说毕业生质量有我浙高？ 我相信浙大今日的实力（财力，师资等）足够为5000＋的本科生提供中国顶级的本科教育。而且，我一直认为本科教育更多的应该是通才教育，是一种视野和格局的提升，而并非一种技能的培训。这一点上，只有一个综合大学，和一个不斤斤计较的自由大学，才能给予。
家庭条件不是很好，想读浙江大学负担会大吗，在其他同学面前会很自卑吗？,楼主来自安徽南部某小镇，情况和题主类似。我谈下自己的经历和看法吧。  1. 浙大的学生里，家庭条件好的确实很多。有一个原因是浙大在浙江招的人多，而浙江省普遍富裕。但是呢，  往往能考上浙大的孩子们，除了富裕的家境，还有好的教养。  这样的人，并不会像传说中的土豪一样，给人压迫感。他们往往会给你很舒服的感觉。这样的人，其实是值得相交，和见贤思齐的。 知乎有句名言：一个人的努力是很难超过几代人的积累。  我觉得放好自己的心态，认清自己的三观，在学校里与朋友们真诚相交。    2. 题主所谓的压力，可能是觉得交友过程中的娱乐成本负担不下。确实，杭州的物价有点高。但楼主的经验是，  真正有修养的富家子弟根本也不会去炫富，反而藏得很深 。 在集体活动中，他们会考虑到大部分人的经济水平。说到底大家都是没收入的学生。楼主曾和某几只土豪小伙伴坐过硬座出去玩，夜宵沙县。直到毕业我才认清某几只土豪的真实财力，比如被请客五星级饭店自助，比如被土豪开车带出去玩。＝。。＝。所以，  交朋友不是相亲，不需要门当户对，只要兴趣相投。  用这个心态去交往，去认知，才是正确的姿势。   最后依然是bbt，亲爱的小伙伴们，我想你们了～ 
华东师大软件学院和浙江大学软件学院应该选择哪个？,浙大不解释，第二年实习完全是开挂，秒杀计算机的渣渣们。  ---  更新：看到当时随手写的答案陆陆续续有了一些互动，来补充一下。我觉得研究生认准自己的需求是最重要的，相比导师的项目组，一个相对自由的环境更适合研究生发展自己的技术和职业生涯。  毕竟给导师做的项目往往不一定能和自己感兴趣的东西匹配上，导师项目本身水平也不一定高。  当然，如果能跟到大牛导师那就可以额外考虑了。
请大家评论一下浙江大学管理学院？,hhh，大一选了管理学，有神一般的老师鲁柏祥。作业很多但教的确实好。 管院整体实力还是很强的，大部分的专业都有全国前五，农经好像是第一吧。而且一个专业最多也就20几个人，应该是每个人都能有很好发展的。
对于在浙江农林大学读动物医学是什么体验？,我觉得这几年动物医学不错，兽医工作好找。
浙大金属材料怎么样？和哈工大、上交比呢？, 国内金属材料研究最好的地方就是：上海交大、北科大、沈阳金属所。哈工大的金属材料也不错。  浙大材料学院主要侧重于半导体材料，有硅材料国家重点实验室和浙江省电镜中心，电镜资源尤为强大（得益于张泽老院士）。所以浙大材料主要还是一些半导体类的新材料比较好，做金属材料的老师很少，我知道的就是潘洪革老师做储氢合金非常厉害。 
如何评价浙大褚健案？,刚看到判决了。褚健一审判了三年。这个判决唯一能说的只有呵呵了。  内幕目前都是机密信息，没人敢讲。  褚健虽然进去了，但是中控集团，留给了其妻儿，坐拥30余亿资产，褚家这几年一直使尽浑身解数鼓动舆论，想向司法机关施压，给褚翻案。光是专门洗地的新闻稿我都不知道看过多少。也不知道楼上这么多回答，有多少是拿钱办事，有多少是人云亦云。  不过有一点，  @李大谬  说得对，这事儿如何处理在高校圈具有普遍意义，高级知识分子都在看着呢，太严，绝了产学研的路子，肯定不妥，太宽了，以后贪污科研经费，侵占国有资产会更加猖狂，两难。这么多次延期，上面也是非常慎重的。  细节不多说，公平地讲，褚健确实是我们国家难得的人才，中控集团也是非常成功的民族企业。我们这个科研体制问题确实是太大了。像褚健这种一流人才，理应给其足够的空间施展才华，让中国的人才天才们也能像比尔盖茨那样合法地成为亿万富翁。而不是一边动情讴歌知识分子，一边坐视他们贫病而死。不甘心清贫一世的，像褚健这样的，只能用各种见不得光的手段来将知识变现。褚健是玩的太大了。树大招风，最后引火烧身。  知乎上读过硕士以上学历的，说实话，高校内贪污科研经费，掏空国有资产这种事情，就是没亲身干过，亲眼见过，至少也该听说过吧。大学教授有几个不这么干的？话又说回来，人家博士，博士后，博士生导师，一个科研成果出来价值上亿，让人家一个月拿几千块钱万把块的工资。是不是太不公平了一点。八百多位教授为褚健喊冤。不是为褚健喊冤。是为了这种对人才极度不尊重不公平的科研体制下的广大科技工作者喊冤啊。21世纪了，科技立国都已经是全球共识了啊，中国的高级知识分子还是跟搬砖的农民工（无意歧视农民，我家是农村的）一样廉价。  最后，就个案来讲，褚健别想全身而退，看看起诉书上那么多罪名，他干的的事儿远远不止起诉书上什么挪用经费资产那么简单的。不然，直接按照新法判他无罪了。
华科计算机学硕还是浙大软院专硕？,这两个都是比较好的选择，如果仅仅是为了心里上的平衡，我觉得还是选计算机吧，因为就算选软院，也不会太开心。这两个都比较牛逼，华科计算机很牛逼，浙大软院也不错。如果研究生就就业的话，我觉得浙大可能更好。  华科如果是跟着金海大boss 可能很厉害。  学术就选华科，就业就选软院吧。牛逼的人外哪里都会牛逼
浙江工业大学三位一体？,三位一体直接去绿药 然后按照算分公式算出综合分 对了记住今年高考分数较历年偏高，可能需要计算一点浮动，还有招生人数增加也是一个问题。 今年招生报考是所有药学一个大类 包括绿药 但是行政上绿药应该是大一就分出来的，专业前二十名以及看进来考试分配  没有证实！！！       2017年8月14日更新  今年绿药选拔是招60人 三位一体招20人，取药学大类前20人，以及报名选拔20人。报名选拔，一半面试，应该是英语，另一半是看一份2k字的调研报告。
浙大艺考分数线大概是多少？ 浙大是个怎样的学校？是一本么？,這是浙大被黑的最慘的一次
浙大南大北航的计算机专业选择？,浙大南大北航计算机都很强，从专业上来看差不多。但是浙大南大都是C9中的2+5所，定位要比北航高一个档次，北航只是赢在了城市上。本科选学校还是要考虑学校知名度的。能上清北的不要选华东五校，能上华东五校的不要选其他。至于南大和浙大而言，学校综合实力都不差。但是杭州要比南京好，所以综合而言，浙大略大于南大，两者大于北航。大致如此。
如何评价浙大与巴黎高科共建工程师学院？,时隔好几个月终于摆脱拖延症过来回答这个问题。  根据与题目中第一张照片中某位大佬的聊天内容，经证实综合理工学院（Ecole polytechnique，X）与浙江大学这一新项目暂时只涉及硕士层面的合作，也正如题主所写的，“就…双硕士学位联合培养方面展开合作”，项目采用英文授课。  因此可以打消以下一些疑惑或猜测： 1. 综合理工学院在减少与上海交大的合作。虽然综合理工学院已经退出巴黎高科集团，但是与上海交大巴黎高科学院的合作依旧在进行。实际上，今年年中刚刚新上任的交大巴黎高科学院的法方院长Dr. Joaquim Nassar 就是从Ecole polytechnique 的教学主管职务上调过去的，可见未来两校关系还是稳定的。  2. Polytechnique 故意在中国造成两校竞争局面。正如上面所说，X 与浙大的潜在合作是硕士层面，英语教学，与大部分的中外master项目性质相同；而目前的上海交大-巴黎高科学院是全法语教学，走法式预科教育（Classe préparatoire） - 工程师大学校（Grandes écoles）路线（参考北航中法学院、中山大学中法核等学院），两者的招生对象、教学内容与模式、文凭等方面都相差甚远，完全不构成竞争关系。  巴黎综合理工学院近年在拓展与海外合作交流方面大下功夫，其一是为了应对法国国内的一些新挑战，另一方面当然也是为了能够扩大X 乃至整个法国工程师教育体系在世界的知名度，继而能够提高X 在各大世界高校排名里的位置（尤其是不知为何在综合理工学院眼中颇为重要的上海交大排名 - Classement Shanghai）。  正如这位大佬所说，X 在中国的深度合作“不能只局限于上海交大”，所以采用联合硕士培养的方式在浙大另辟一块天地，也有许多好处。一是法国的硕士培养基本与世界各国模式相符，所以几乎不存在双方学校学制、文凭难以协调的问题；二是不像工程师教育体系，硕士教育不需要长时间的联合培养；三是有助于推广X 本校的几个新的master项目。  至于为什么选择了浙大，以及浙大为什么选择的综合理工学院，相信双方校董会都有各自的利弊权衡。有意思的是，法国人察觉到了浙江在未来5年内在中国政治博弈上的优势，而且也把这一因素纳入了考量范围，不得不说法国人也是相当了解中国政治的玩法……
如何评价杭州地铁10号线将浙江大学玉泉校区命名为浙大站？,对杭州人来说认知就是这样的 玉泉→浙大 紫金港→紫金港（新来的） 西溪→杭大 之江→之江 华家池→农大 湖滨（已死）→医大
如何评价浙江大学化学系教授彭笑刚？,对科研认真负责，博士生的实验结果不仅自己要能重复，而且同课题组其他人也要能重复（这点很令人钦佩），所以老彭来浙大后文章不多（篇篇都是精华），彭组的博士一般就是一篇JACS或Nano Research毕业；物理化学课讲的很好；自从老彭来了浙大后，化学系老师都不好混了，95%的副教授这辈子都评不了教授了；未来几年老彭应该是想赚钱了，纳晶去年融了上亿。
我想考浙大，男友在山东，要求我考山大，怎么办？, 当然应该选择山东大学了。  考上世一大，做个听话的女朋友，乖乖地陪在男朋友身边，这才是我们山东媳妇的大局观。山东是礼仪之邦，重感情，重孝道。你听了男人的话，来到我们山东大学，就是你懂规矩的表现。你一个姑娘大老远去了浙江大学，你还顾得上男人吗，你还顾得上你婆婆的感受吗？不说别的，婆婆有个急事需要你照顾，你能跑得过来帮忙吗？你是未来的山东媳妇，怎么能连孝顺婆婆的重要性都不知道呢，你这样今后会吃大亏的。  何况我听一朋友说浙江大学在知乎上名声挺不好的，至于为什么这样，他也没细说，总之苍蝇不叮无缝的蛋吧，你懂的。而且我看网上都说山东大学口碑一直挺好的，只要有人说山东大学哪里不好，就立刻跑出来好多山大校友集体把他骂回去。  先写这么多吧。预祝题主高考成功，顺利被山东大学录取。 
请问如何看待浙江大学把城市学院（三本）的学生转入浙大？,这叫作立交桥项目。  除了城院，宁波理工学院也有。就是这两所由浙大和地方政府合作建设的三本，每一个年级都有一定数量的名额可以从三本把学籍转到浙大。由于中国的法律比较扯淡，咱们只谈政策，这个项目是教育主管部门批准同意的，所以并不是什么暗箱操作，而是一个正儿八经的转学项目。  名额不多，城院和宁波理工每届一共万把来个学生，通过立交桥转成正式浙大人的就几十个（年代久远，数据记不太清了），比率大概是1%不到。换句话说，是在城院或宁波理工里，学习水平能达到TOP 1%的人，才有可能走上立交桥。  至于说怎么看，反正我念书时浙大人基本都是反对的，88上还出现过城院和浙大互喷的大场面。作为一个通过高考考进浙大的学生，当年的我自然也是反对的。   现在再回头来看的话，我可以理解这个项目，其本质就是，浙大以一部分优质的教育资源，换取地方政府的支持 。 浙大和清华北大不同，一半的资金来自于浙江省地方财政，四校合并时吞了三所211级别的高校，本省招生数量逐年压缩，地方不满情绪无比强烈。浙大必须做出一部分妥协，其中一个方式就是在杭州和宁波两市建二级学院，让浙大的教育资源辐射得更广（浙大内部有规定，浙大教师需要去城院或宁波理工开课及指导学生）。 但仅仅是师资共享是不足够的，因为全国其他高校的二级学院也是这样，不足以构成招生上的噱头，为了提高这两所三本的吸引力，立交桥项目就横空出世了。试想，你是一个穷得只剩下钱的土豪，儿女不成器高考考得把你老脸都丢尽了，只能上三本，现在有个三本跑来和你说，来我们学校大二有机会直升浙大，你会怎么选？ 对浙大来说，这就相当于每届增加了几十个学生而已，以浙大的体量，这几十个人真算不上什么成本。  从学生个体的角度来说，三本虽然水，但是要保持TOP 1%的成绩并不是一件容易的事情。浙大的两个三本因为地处浙江，所以生源要相对好一些，从录取线来看的话，不输于一般的二本（因为浙江人有一种很执着的乡土情节，不爱出省）。 TOP 1%是什么概念，就是一个系里有100个人，你必须是年级第1名；就算是400人的大系，也必须在年级前5。各位高考考入985的凭心而论，依你们大一时学习的努力程度，放到一个一般水平的二本去，一定能考上全系第1吗？恐怕未必。所以对这TOP 1%的人而言，相当于在大学里复读了一年，第二年考入浙大（当年难度还是比正经高考要低一些）。  有没有关系户通过立交桥的呢？我不敢说没有，但是此事的程序性决定了，就算有，也是极少数。   当年我们系有个人就是立交桥过来的，后来保研了。  大概就是这样。
